113,,What is the main innovation of Layer2 data availability committee mechanisms in 2024-2025?,Using centralized servers to store data,Distributed validator networks jointly ensuring data availability,Complete reliance on Layer1 to store all data,Not storing any historical data,B,
114,,What is the main breakthrough in Layer2 cross-chain messaging protocols in 2025?,Completely abandoning cross-chain functionality,Standardized cross-chain message formats and verification mechanisms,Only allowing specific tokens to cross chains,Cross-chain only possible through centralized exchanges,B,
115,,What is the main technical innovation of Ondo Finance's RWA tokenization platform in 2025?,Only supporting real estate tokenization,Multi-asset class support and compliance automation framework,Only supporting gold tokenization,Completely abandoning KYC requirements,B,
116,,What is the main advantage of MANTRA Chain's RWA-specific blockchain compared to traditional blockchains in 2025?,Higher transaction speed,Lower transaction fees,Built-in compliance layer and asset-specific modules,Simpler user interface,C,
117,,What is the core innovation of Plume Network's RWA tokenization infrastructure in 2025?,Only supporting specific types of assets,Modular design and cross-chain interoperability,Completely centralized control,Only supporting institutional investors,B,
118,,What trend does the RWA market size forecast and growth model show according to 2024-2025 market data?,Market shrinking with negative annual growth rate,Market stabilizing with almost no growth,Market rapidly growing, projected to reach $16 trillion by 2030,Only specific asset classes growing,C,
119,,What is the main technical innovation in cross-chain RWA solutions architecture in 2024?,Completely abandoning cross-chain functionality,Unified asset identifiers and cross-chain verification protocols,Only supporting specific blockchains,Cross-chain only possible through centralized exchanges,B,
120,,What problem does RWA corporate action automation management primarily solve in 2025?,Only simplifying the user interface,Automating the execution and recording of corporate actions (such as dividends, voting, reporting),Completely replacing corporate management teams,Only focusing on marketing automation,B,
121,,How is the innovative model for intangible asset tokenization primarily manifested in 2024-2025?,Only focusing on art NFTs,Fractional ownership and dynamic valuation of intellectual property, carbon credits, and data assets,Completely abandoning intangible asset tokenization,Only supporting in-game assets,B,
122,,What is the core innovation of IoTeX 2.0 modular DePIN architecture in 2024?,Only supporting specific types of IoT devices,Breaking down DePIN functions into independent modules, improving flexibility and composability,Completely centralized control,Abandoning blockchain technology,B,
123,,How is the technical implementation of AI and DePIN integration primarily manifested in 2024-2025?,Only used for marketing,AI used for device data analysis, predictive maintenance, and autonomous decision-making,Completely replacing physical devices,Only used for user interface optimization,B,
124,,How is interoperability in cross-chain DePIN ecosystems primarily implemented in 2025?,Completely abandoning cross-chain functionality,Unified device identifiers and cross-chain messaging protocols,Only supporting specific blockchains,Only possible through centralized servers,B,
125,,What direction is the technical innovation of Solana's DePIN ecosystem primarily focused on in 2024?,Only focusing on gaming applications,High-performance, low-latency IoT device integration and real-time data processing,Completely abandoning DePIN applications,Only supporting specific types of devices,B,
126,,What is the biggest challenge in the technical implementation of DePIN for large-scale interaction between the physical world and Web3 in 2025?,User interface design,Device security, data validation, and physical world oracles,Marketing strategy,Brand naming,B,
127,,What problem do the technical challenges and solutions for building DePIN parallel systems primarily focus on in 2024-2025?,Only focusing on user interfaces,Device interoperability, data standardization, and cross-network coordination,Only focusing on marketing strategies,Completely abandoning parallel system building,B,
128,,What trend does the DePIN market size growth path show according to the 2025 prediction model?,Market shrinking with negative annual growth rate,Market stabilizing with almost no growth,Market rapidly growing, projected to reach $3.5 trillion by 2030,Only specific market segments growing,C,
129,,How are the development technologies and challenges for AAA-level blockchain games primarily manifested in 2024-2025?,Only focusing on simple 2D games,Balancing high-quality graphics rendering, complex game logic, and blockchain integration,Completely abandoning blockchain integration,Only focusing on NFT trading,B,
130,,What is the main technical innovation in the implementation and performance optimization of fully on-chain games in 2024?,Completely abandoning on-chain functionality,Hybrid architecture of on-chain state management and off-chain computation,Only putting NFTs on-chain,Complete reliance on centralized servers,B,
131,,What key components does the full-chain interoperability technical architecture include in 2024-2025? (Choose 3),Unified cross-chain message formats,Modular verification protocols,Centralized control servers,Decentralized liquidity networks,"A,B,D",
132,,What advantages does the application of zero-knowledge proofs in cross-chain bring in 2024? (Choose 2),Improved verification efficiency,Enhanced security,Complete elimination of validator requirements,Forced use of specific blockchains,"A,B",
133,,What features does modular cross-chain protocol design include in 2025? (Choose 2),Functional components can be independently upgraded,Improved protocol adaptability,Forced use of a single programming language,Must go through centralized servers,"A,B",
134,Advanced,"In the context of DePIN (Decentralized Physical Infrastructure Networks), which architectural component is most critical for preventing Sybil attacks in distributed GPU compute marketplaces like GAIMIN's gaimin.cloud?",Proof-of-Work consensus for compute verification,Hardware attestation combined with stake-weighted reputation systems,Geographic distribution requirements for node operators,Time-locked token bonding with slashing conditions,B,No
135,Advanced,Select all mechanisms that Celestia's modular data availability layer employs to achieve scalability without compromising security in 2024's implementation.,Data availability sampling with fraud proofs,Namespace-based data segregation for rollups,Reed-Solomon erasure coding for data recovery,Optimistic data availability with challenge periods,"A, B, C",Yes
136,Advanced,"Which zero-knowledge proof system characteristic makes zk-STARKs particularly suitable for blockchain applications requiring post-quantum security, as emphasized in 2024 research?",Smaller proof sizes compared to zk-SNARKs,Elimination of trusted setup requirements,Faster verification times for complex circuits,Lower computational overhead for proof generation,B,No
137,Advanced,"In ERC-4337 account abstraction, identify all components that are essential for implementing gasless transactions while maintaining decentralization.",Paymaster contracts with sponsored transaction logic,Bundler nodes for UserOperation aggregation,EntryPoint contract for execution coordination,Centralized relayer services for gas payment,"A, B, C",Yes
138,Advanced,What is the primary economic incentive misalignment that DePIN energy networks like Daylight Protocol must address when integrating distributed energy resources (DERs) with traditional grid operators?,Grid operators preferring centralized generation over distributed sources,Temporal mismatch between renewable energy production and demand peaks,Regulatory capture preventing fair compensation for DER providers,Information asymmetry regarding real-time grid conditions and pricing,D,No
139,Advanced,Which technical innovations distinguish Avail's data availability solution from Celestia's approach in the modular blockchain ecosystem as of 2024?,Validity proofs for data availability instead of fraud proofs,Native integration with Polygon's ecosystem and tooling,Support for both optimistic and zk-rollup architectures,Erasure coding with different redundancy parameters,"A, B",Yes
140,Advanced,"In intent-driven architecture implementations like NEAR Intents, what is the most significant challenge for maintaining atomic execution across multiple blockchain networks?",Coordinating transaction ordering across different consensus mechanisms,Ensuring solver incentive alignment with user intent fulfillment,Managing state synchronization delays between heterogeneous chains,Preventing front-running attacks on cross-chain intent resolution,C,No
141,Advanced,Select all factors that contribute to the superior capital efficiency of Bitcoin DeFi protocols utilizing Taproot compared to traditional Bitcoin scripting.,Reduced on-chain footprint through script aggregation,Enhanced privacy through indistinguishable transaction outputs,Support for complex smart contract logic without soft forks,Lower transaction fees due to witness data optimization,"A, B, D",Yes
142,Advanced,Which architectural pattern in rollup-as-a-service platforms like Caldera addresses the challenge of shared sequencer coordination while maintaining rollup sovereignty?,Hierarchical sequencing with local and global ordering,Consensus-based sequencer rotation with stake-weighted selection,Intent-based cross-rollup transaction batching,Modular execution environments with pluggable consensus,C,No
143,Advanced,"In the context of AI-blockchain integration, identify all mechanisms that decentralized AI training networks employ to ensure model integrity without revealing training data.",Federated learning with differential privacy guarantees,Zero-knowledge proofs of correct gradient computation,Homomorphic encryption for encrypted model updates,Secure multi-party computation for aggregation,"A, B, C, D",Yes
144,Advanced,"What is the fundamental limitation of optimistic rollups that zk-rollups address, particularly relevant for high-frequency DeFi applications in 2024?",Higher computational costs for transaction processing,Extended withdrawal periods due to challenge windows,Limited throughput due to fraud proof complexity,Inability to support complex smart contract execution,B,No
145,Advanced,Which components are essential for implementing cross-chain atomic swaps without trusted intermediaries in modern bridge architectures?,Hash time-locked contracts (HTLCs) with coordinated timeouts,Light client verification of foreign chain state,Multi-signature validator sets with economic security,Zero-knowledge proofs of transaction inclusion,"A, B",Yes
146,Advanced,"In Helium's 5G DePIN network evolution, what economic mechanism ensures quality of service while preventing race-to-the-bottom pricing among coverage providers?",Proof-of-Coverage with location-based rewards,Service level agreements with penalty mechanisms,Dynamic pricing based on demand density and coverage quality,Stake-weighted voting on minimum service standards,C,No
147,Advanced,Select all technical challenges that shared sequencer architectures must solve to enable atomic cross-rollup transactions.,Consistent transaction ordering across multiple execution environments,State root synchronization between heterogeneous rollups,Equitable MEV distribution among participating rollups,Rollback coordination for failed cross-rollup operations,"A, C, D",Yes
148,Advanced,What is the primary advantage of RGB protocol over traditional Bitcoin smart contracts for implementing complex DeFi primitives?,Client-side validation reduces on-chain computational overhead,Native support for Turing-complete smart contract execution,Integration with Lightning Network for instant settlements,Compatibility with existing Bitcoin wallet infrastructure,A,No
149,Advanced,Which reserve management strategy distinguishes Tether's $600M funding round approach from traditional stablecoin backing mechanisms in 2024?,Diversification into Bitcoin and gold reserves beyond traditional assets,Real-time attestation through zero-knowledge proof systems,Integration with traditional banking infrastructure via Cantor Fitzgerald,Algorithmic reserve rebalancing based on market volatility,C,No
150,Advanced,Select all technical requirements for implementing compliant real-world asset (RWA) tokenization that address regulatory concerns in 2024.,Immutable ownership records with privacy-preserving compliance checks,Automated KYC/AML verification through oracle integration,Programmable transfer restrictions based on jurisdiction,Real-time asset valuation feeds with dispute resolution mechanisms,"A, B, C, D",Yes
151,Advanced,"In liquid staking derivatives (LSDs), what is the primary risk that restaking protocols like EigenLayer introduce beyond traditional staking risks?",Slashing cascades across multiple validation services,Liquidity fragmentation between different LSD tokens,Validator centralization due to economies of scale,Smart contract risk from automated restaking logic,A,No
152,Advanced,Which mechanisms do intent-based DEX aggregators employ to prevent MEV extraction while maintaining competitive execution prices?,Private mempool routing with encrypted order flow,Batch auction mechanisms with uniform clearing prices,Solver competition with performance-based fee structures,Time-weighted average price (TWAP) execution strategies,"A, B, C",Yes
153,Advanced,What is the fundamental challenge that chain abstraction protocols must solve to enable seamless multi-chain user experiences?,Unified gas payment across heterogeneous fee markets,Consistent state finality guarantees across different consensus mechanisms,Standardized smart contract interfaces for cross-chain applications,Atomic transaction execution with rollback capabilities,B,No
154,Advanced,"In decentralized AI inference networks, identify all components necessary for ensuring model output verifiability without revealing model parameters.",Zero-knowledge proofs of correct inference computation,Cryptographic commitments to model weights and biases,Multi-party computation for distributed inference,Trusted execution environments with remote attestation,"A, B, D",Yes
155,Advanced,Which architectural innovation in Ethereum's proposed EIP-7702 addresses the limitations of ERC-4337 for account abstraction adoption?,Native protocol support for smart accounts without separate infrastructure,Reduced gas costs through optimized transaction processing,Backward compatibility with existing externally owned accounts (EOAs),Enhanced security through mandatory multi-signature requirements,A,No
156,Advanced,Select all factors that contribute to the economic sustainability of DePIN transportation networks like decentralized ride-sharing platforms.,Dynamic pricing algorithms based on real-time supply and demand,Reputation systems with stake-weighted driver scoring,Geographic clustering to optimize route efficiency,Token incentives for network effect bootstrapping,"A, B, C, D",Yes
157,Advanced,What is the primary advantage of using validity proofs over fraud proofs in modular blockchain architectures for data availability?,Immediate finality without challenge periods,Lower computational overhead for proof generation,Better compatibility with existing rollup infrastructure,Reduced storage requirements for historical data,A,No
158,Advanced,"In cross-chain bridge security, which combination of mechanisms provides the strongest protection against validator collusion attacks?",Economic security through bonded validators and slashing conditions,Cryptographic verification using light clients and merkle proofs,Time delays with emergency pause mechanisms,Multi-signature schemes with threshold cryptography,"A, B",Yes
159,Advanced,Which technical innovation in CBDC (Central Bank Digital Currency) architectures addresses privacy concerns while maintaining regulatory compliance?,Selective disclosure through zero-knowledge proofs,Hierarchical deterministic key derivation for transaction unlinkability,Ring signatures with regulatory backdoors,Homomorphic encryption for aggregate transaction analysis,A,No
160,Advanced,Identify all challenges that rollup-as-a-service platforms must address to enable enterprise adoption of custom blockchain networks.,Compliance with industry-specific regulatory requirements,Integration with existing enterprise IT infrastructure,Customizable governance mechanisms for business logic,Guaranteed service level agreements for transaction processing,"A, B, C, D",Yes
161,Advanced,What is the key innovation in Bitcoin's Rune protocol that enables more efficient token operations compared to previous Bitcoin token standards?,Native UTXO-based token accounting without additional data structures,Integration with Lightning Network for instant token transfers,Support for programmable token logic through Bitcoin Script,Compatibility with Ethereum Virtual Machine for smart contracts,A,No
162,Advanced,Which mechanisms do decentralized healthcare data networks employ to ensure patient privacy while enabling valuable research insights?,Differential privacy with calibrated noise injection,Federated learning with encrypted gradient aggregation,Homomorphic encryption for computation on encrypted data,Secure multi-party computation for statistical analysis,"A, B, C, D",Yes
163,Advanced,"In the context of AI agent coordination on blockchain networks, what is the primary challenge for implementing autonomous economic agents that can transact without human intervention?",Legal liability and regulatory compliance for autonomous transactions,Ensuring deterministic behavior in non-deterministic AI models,Managing private key security for autonomous wallet operations,Coordinating multi-agent negotiations without central authority,B,No
164,Advanced,Which consensus mechanism innovation in DePIN robotics networks ensures coordination between autonomous agents without centralized control?,Byzantine fault-tolerant consensus with robot-specific validators,Proof-of-useful-work based on completed robotic tasks,Swarm intelligence algorithms with blockchain state synchronization,Hierarchical consensus with local and global coordination layers,C,No
165,Advanced,Select all technical components required for implementing verifiable delay functions (VDFs) in blockchain randomness generation.,Sequential computation that cannot be parallelized,Publicly verifiable proof of correct computation,Deterministic output based on input and time parameter,Resistance to quantum computing attacks,"A, B, C",Yes
166,Advanced,What is the primary innovation in Ethereum's proposed PBS (Proposer-Builder Separation) that addresses MEV centralization concerns?,Separation of block proposal from block construction roles,Encrypted mempool to prevent transaction front-running,Auction mechanisms for fair MEV distribution,Mandatory inclusion of user transactions before MEV extraction,A,No
167,Advanced,"In the context of decentralized storage networks, which mechanisms ensure data persistence and availability without relying on altruistic node behavior?",Proof-of-replication with cryptographic challenges,Economic incentives through storage mining rewards,Redundant encoding with erasure codes,Slashing conditions for data unavailability,"A, B, C, D",Yes
168,Advanced,Which architectural pattern in multi-chain applications addresses the challenge of maintaining consistent state across heterogeneous blockchain networks?,Event sourcing with cross-chain state reconstruction,Optimistic state synchronization with fraud proofs,Consensus-based state checkpointing across chains,Atomic commit protocols with two-phase locking,A,No
169,Advanced,Identify all security considerations specific to implementing social recovery mechanisms in smart wallet architectures.,Guardian collusion resistance through threshold schemes,Time delays to prevent unauthorized recovery attempts,Identity verification without compromising privacy,Backup key rotation to prevent long-term compromise,"A, B, C, D",Yes
170,Advanced,What is the fundamental trade-off that zk-SNARK recursive proof systems address in blockchain scalability solutions?,Proof size versus verification time for large transaction batches,Security assumptions versus computational efficiency,Privacy guarantees versus regulatory compliance requirements,Decentralization versus throughput in consensus mechanisms,A,No
171,Advanced,Which mechanisms do decentralized prediction markets employ to ensure accurate price discovery while preventing manipulation?,Automated market makers with bonding curves,Oracle integration for objective outcome resolution,Liquidity incentives for market depth,Reputation systems for market creators,"A, B, C",Yes
172,Advanced,"In the context of blockchain interoperability, what is the primary advantage of using IBC (Inter-Blockchain Communication) protocol over traditional bridge architectures?",Native support for heterogeneous consensus mechanisms,Elimination of trusted intermediaries through light client verification,Atomic transaction execution across multiple chains,Standardized packet routing for cross-chain communication,B,No
173,Advanced,Select all technical requirements for implementing compliant DeFi protocols that can integrate with traditional financial infrastructure.,Real-time transaction monitoring with suspicious activity detection,Programmable compliance rules with automatic enforcement,Identity verification without compromising transaction privacy,Regulatory reporting capabilities with audit trails,"A, B, C, D",Yes
174,Advanced,What is the key innovation in threshold signature schemes that makes them particularly suitable for decentralized custody solutions?,Elimination of single points of failure in key management,Reduced computational overhead compared to multi-signature schemes,Compatibility with existing wallet infrastructure,Enhanced privacy through signature aggregation,A,No
175,Advanced,"In decentralized autonomous organizations (DAOs), which governance mechanisms address the challenge of voter apathy while maintaining decentralization?",Quadratic voting to prevent plutocracy,Delegation systems with revocable proxy voting,Conviction voting for time-weighted preferences,Futarchy for prediction-based decision making,"B, C, D",Yes
176,Advanced,Which architectural innovation in Layer 3 applications addresses the limitations of current Layer 2 scaling solutions?,Application-specific rollups with custom execution environments,Recursive proof aggregation for unlimited scalability,Sovereign execution with selective state commitments,Modular consensus with pluggable security models,A,No
177,Advanced,Identify all components necessary for implementing privacy-preserving analytics in decentralized applications.,Differential privacy with calibrated noise parameters,Secure aggregation protocols for statistical computation,Zero-knowledge proofs for query result verification,Homomorphic encryption for computation on encrypted data,"A, B, C, D",Yes
178,Advanced,What is the primary challenge in implementing atomic cross-chain swaps for assets with different finality guarantees?,Coordinating timeout parameters across heterogeneous networks,Ensuring economic security parity between different chains,Managing liquidity fragmentation across multiple networks,Preventing front-running attacks during swap execution,A,No
179,Advanced,Which mechanisms do decentralized identity systems employ to enable selective disclosure while maintaining verifiability?,Zero-knowledge proofs for credential verification,Merkle tree commitments for attribute hiding,Blind signatures for unlinkable credentials,Homomorphic commitments for range proofs,"A, B, C",Yes
180,Advanced,"In the context of MEV (Maximal Extractable Value) protection, what is the fundamental limitation of commit-reveal schemes in preventing front-running attacks?",Vulnerability to timing attacks during reveal phase,Inability to prevent sandwich attacks on large transactions,Computational overhead of cryptographic commitments,Requirement for synchronized reveal across all participants,A,No
181,Advanced,Select all technical innovations that enable efficient state synchronization in sharded blockchain architectures.,Cross-shard communication protocols with atomic execution,State rent mechanisms to prevent unbounded state growth,Erasure coding for distributed state storage,Merkle tree updates with incremental hashing,"A, C, D",Yes
182,Advanced,What is the key advantage of using polynomial commitments over Merkle trees in zero-knowledge proof systems for blockchain applications?,Constant-size proofs regardless of data size,Better resistance to quantum computing attacks,Lower computational overhead for proof generation,Native support for range and membership proofs,A,No
183,Advanced,"In the evolution of blockchain consensus mechanisms, which innovations address the energy efficiency concerns of Proof-of-Work while maintaining security guarantees?",Proof-of-Stake with slashing conditions for malicious behavior,Proof-of-Space-Time utilizing storage capacity and temporal proofs,Proof-of-Useful-Work directing computation toward beneficial tasks,Delegated Proof-of-Stake with validator rotation mechanisms,"A, B, C",Yes
184,Advanced,Which architectural component of Band Protocol V3 is specifically responsible for high-frequency asset price streaming?,Signaling Hub,Concurrent Price Stream,Data Tunnel,Custom Mempool,B,No
