185,Advanced,"According to the MoveVM development in 2025, which blockchain implements a dual-VM architecture supporting both MoveVM and EVM compatibility?",Sui,Aptos,IOTA,Polkadot,C,No
186,Advanced,What is the block proof generation time achieved by zkSync's Airbender zkVM using a single GPU?,15 seconds,25 seconds,35 seconds,45 seconds,C,No
187,Advanced,Which of the following factors contributed to Polygon's decision to deprecate zkEVM by 2026?,Never adopted Ethereum's Blob data structure,Annual operational loss exceeding $1 million,Quiet discontinuation of development,Lack of significant adoption,"A, B, C, D",Yes
188,Advanced,"In Arbitrum Stylus, which WebAssembly runtime is used as the execution environment?",Wasmtime,Wasmer,WAMR,V8 WASM,B,No
189,Advanced,What is the target block time that Optimism Bedrock aims to achieve after recent upgrades?,500 milliseconds,200 milliseconds,1 second,100 milliseconds,B,No
190,Advanced,Which consensus protocol does IOTA use in combination with MoveVM for sub-second finality?,Tendermint BFT,HotStuff,Mysticeti BFT,PBFT,C,No
191,Advanced,"According to 2025 data, what is the approximate Total Value Locked (TVL) managed by Aries Markets on Aptos?",Over $200 million,Over $300 million,Over $400 million,Over $500 million,B,No
192,Advanced,Which feature distinguishes Sui's execution model from traditional account-based blockchains?,Object-centric architecture,Parallel transaction processing,zkLogin authentication,Sponsored transactions,A,No
193,Advanced,"What percentage of ZK tokens was unlocked on June 17, 2025?",18.5%,20.91%,22.3%,25.1%,B,No
194,Advanced,Which programming languages are supported by Arbitrum Stylus for smart contract development?,Rust,C++,AssemblyScript,Move,"A, B, C, D",Yes
195,Advanced,What is the maximum transaction throughput that IOTA claims to achieve with its MoveVM implementation?,"25,000 TPS","50,000 TPS","75,000 TPS","100,000 TPS",B,No
196,Advanced,Which organization commissioned the DePIN Report 2025?,Helium Foundation,io.net,Filecoin Foundation,IoTeX,B,No
197,Advanced,"According to Ethereum's post-Pectra network statistics, what percentage of ETH supply is currently staked?",25.3%,26.8%,28.3%,30.1%,C,No
198,Advanced,Which validator client was launched by the Firedancer team for Solana in 2025?,Solana Labs Client,Frankendancer,Jito Client,Triton Client,B,No
199,Advanced,What improvement in throughput does the Frankendancer validator client provide compared to standard Solana validators?,5-8% higher,10-15% higher,20-25% higher,30-35% higher,B,No
200,Advanced,Which upgrade allows Kusama chains to deploy Ethereum-compatible smart contracts?,Polkadot v1.5,Kusama v1.6 runtime upgrade,Substrate v3.0,Parachain v2.0,B,No
201,Advanced,What is the total funding amount of Avalanche's Retro9000 retroactive grant program?,$30 million,$40 million,$50 million,$60 million,B,No
202,Advanced,Which key architectural improvements does Band Protocol V3 introduce for performance enhancement?,Block time reduction from 6 seconds to 1 second,Tripled throughput capacity,Tenfold performance enhancement,Custom mempool for mission-critical data,"A, B, C, D",Yes
203,Advanced,"According to the MoveVM comparison table, which blockchain requires specifying all data accessed for parallelization?",Aptos,Sui,Solana,Ethereum,"B, C",Yes
204,Advanced,What is the primary technical reason behind Fuel Network's ability to achieve 600+ TPS?,Parallel execution capabilities,Modular execution layer design,FuelVM optimization,UTXO model implementation,A,No
205,Advanced,Which feature of Move language prevents common smart contract vulnerabilities by design?,Resource-oriented programming,Static dispatch,Formal verification support,Explicit ownership model,"A, C, D",Yes
206,Advanced,What is the scheduled mainnet release date for Starknet v0.14.0?,"July 15, 2025","July 28, 2025","August 5, 2025","August 15, 2025",B,No
207,Advanced,Which top-tier validators support Band Protocol V3's new mainnet?,Binance Validator,HashKey Cloud,Nansen,Cosmo Station,"A, B, C, D",Yes
208,Advanced,"According to 2025 data, what is the approximate stake percentage that Frankendancer holds in the Solana network?",6%,8%,10%,12%,B,No
209,Advanced,Which feature of Sui's blockchain architecture enables users to interact with applications without private keys?,zkLogin,Sponsored transactions,Object-centric execution,Parallel processing,A,No
210,Advanced,What is the primary reason for Polygon's decision to sunset zkEVM and focus on PoS and AggLayer?,Technical limitations of zero-knowledge proofs,Lack of developer adoption and high operational costs,Regulatory compliance issues,Competition from other Layer 2 solutions,B,No
211,Advanced,Which programming language compilation targets are supported by Arbitrum Stylus?,WebAssembly (WASM),LLVM IR,Native machine code,EVM bytecode,A,No
212,Advanced,"According to the 2025 Sui Overflow Hackathon results, how many total project submissions were received?",456,523,599,672,C,No
213,Advanced,Which consensus mechanism does IOTA implement alongside MoveVM for high-throughput processing?,Delegated Proof-of-Stake with Mysticeti BFT,Pure Proof-of-Stake,Practical Byzantine Fault Tolerance,Tendermint BFT,A,No
214,Advanced,What are the key architectural components introduced in Band Protocol V3?,Signaling Hub,Concurrent Price Stream,Data Tunnel,Validator Registry,"A, B, C",Yes
215,Advanced,Which blockchain project launched the PolkaVM initiative to enable Solidity contract deployment?,Polkadot,Kusama,Substrate,Parachain,B,No
216,Advanced,What is the planned SOL delegation amount by Firedancer across approximately 100 validators in its first 3 months?,1 million SOL,1.5 million SOL,2 million SOL,2.5 million SOL,C,No
217,Advanced,Which DePIN projects are considered pioneers that validated the concept of community-driven infrastructure?,Helium,Filecoin,Arweave,Storj,"A, B",Yes
218,Advanced,What is the approximate protocol fee generated by Aries Markets on Aptos during June 2025?,"$390,000","$490,000","$590,000","$690,000",B,No
219,Advanced,Which feature distinguishes Move language's approach to digital asset management?,Resource-oriented programming model,Explicit ownership semantics,Prevention of asset duplication,Formal verification support,"A, B, C, D",Yes
220,Advanced,What is the target block time that Optimism Bedrock plans to achieve in future upgrades?,100 milliseconds,200 milliseconds,500 milliseconds,1 second,B,No
221,Advanced,Which organization spun off the ZisK zkEVM project as an alternative to Polygon zkEVM?,Polygon Labs,Polygon co-founder Jordi Baylina,Ethereum Foundation,ConsenSys,B,No
222,Advanced,What is the current Total Value Locked (TVL) of zkSync Era according to 2025 data?,Over $80 million,Over $100 million,Over $120 million,Over $150 million,B,No
223,Advanced,Which testing framework supports Wasm-level host functions for Arbitrum Stylus smart contracts?,Foundry,Hardhat,Motsu,Truffle,C,No
224,Advanced,What are the primary security risks in cross-chain bridge architectures?,Compromised multi-signature validator keys,Forged cross-chain message proofs,Client-side replay-protection flaws,Divergent consensus rules between connected chains,"A, B, D",Yes
225,Advanced,Which mechanisms can provide trustless verification of foreign-chain blocks?,Merkle-proof light clients,Off-chain oracle attestations,Centralized relayer signatures,Zero-knowledge succinct proofs (zk-SNARKs),"A, D",Yes
226,Advanced,What is the approximate value of trade certificates that Blockticity's Avalanche-based blockchain authenticates?,$800 million,$1.2 billion,$1.6 billion,$2.0 billion,B,No
227,Advanced,Which stablecoin legislation was passed by the US Senate in June 2025?,STABLE Act,GENIUS stablecoin bill,Digital Asset Market Structure Act,Responsible Financial Innovation Act,B,No
228,Advanced,What is the key technical innovation that allows Fuel Network to achieve over 600 TPS?,Parallel execution capabilities,Optimistic rollup design,Sharding implementation,State channel integration,A,No
229,Advanced,Which DAO governance proposal involves restructuring ApeCoin DAO into a new entity?,AIP-394,ApeCo restructuring proposal,Yuga Labs governance reform,BAYC DAO transition,B,No
230,Advanced,What is the reported uptime percentage for Solana network over approximately 16 months according to the June 2025 Network Health Report?,99.5%,99.8%,99.9%,100%,D,No
231,Advanced,Which European regulatory framework is being implemented for crypto operations in 2025?,MiFID II,MiCA (Markets in Crypto-Assets),GDPR,PSD2,B,No
232,Advanced,What is the primary technical advantage of IOTA's DAG-based architecture combined with MoveVM?,"Enables secure, parallelizable Layer 1 smart contracts",Reduces transaction fees to zero,Eliminates the need for consensus mechanisms,Provides unlimited scalability,A,No
233,Advanced,Which factors contribute to the maturation of the DePIN ecosystem in 2025?,Token incentive mechanisms for distributed networks,Permissionless participation in infrastructure provision,Reduced dependence on centralized entities,New ownership and governance structures,"A, B, C, D",Yes
234,Advanced,Which architectural component is NOT part of Band Protocol V3's infrastructure that enables its 1-second block time achievement?,Signaling Hub for decentralized symbol governance,Concurrent Price Stream for high-frequency asset pricing,Data Tunnel for cross-chain secure feed relays,Merkle Tree Validator for transaction batching,D,No
235,Advanced,Select all projects that represent legitimate modular blockchain tokens with market caps under $5 million as of July 2025.,KardiaChain ($KAI) - hybrid public-private blockchain infrastructure,Matchain ($MAT) - AI-integrated zk-rollup Layer 2 blockchain,Lumerin ($LMR) - P2P data stream control protocol,SatoshiVM ($SAVM) - Bitcoin ZK Rollup Layer 2 solution,"A, B, C, D",Yes
236,Advanced,What is the primary technical innovation that distinguishes ATBFT (Asynchronous Threshold Byzantine Fault Tolerance) from traditional consensus mechanisms?,It eliminates the need for validator nodes entirely,It merges the advantages of leader-based and leaderless consensus models,It uses quantum-resistant cryptographic signatures,It implements sharding at the consensus layer,B,No
237,Advanced,"According to the 2025 cross-chain bridge security analysis, which factors contribute to the $2.3 billion in cumulative losses? Select all that apply.",Fundamental design flaws affecting 99% of existing bridges,Compromised multi-signature validator keys,Forged cross-chain message proofs,Client-side replay protection vulnerabilities,"A, B, C, D",Yes
238,Advanced,Which consensus mechanism is specifically designed by DUSK Network to prioritize both speed and privacy?,Proof of Stake with Privacy Extensions (PoSPE),Succinct Attestation (SA),Zero-Knowledge Proof of Authority (zkPoA),Delegated Privacy Consensus (DPC),B,No
239,Advanced,"As of June 2025, which Layer 2 solution has surpassed Arbitrum One in Total Value Locked (TVL)?",Optimism with $5.2 billion TVL,Polygon zkEVM with $4.8 billion TVL,Base with $4.94 billion TVL,Starknet with $4.1 billion TVL,C,No
240,Advanced,Select all components that are part of OpenBridge's ERC-7786 standard for composable cross-chain infrastructure.,Vendor lock-in removal for enhanced security composition,High-value transaction protection mechanisms,Multi-validator signature aggregation,Automated cross-chain arbitrage prevention,"A, B",Yes
241,Advanced,"What percentage increase in MEV attacks was recorded in April 2025, leading to enhanced protection mechanisms?",25.4%,30.8%,35.2%,42.1%,B,No
242,Advanced,Which AI-enhanced security features are being implemented in cross-chain bridge protocols in 2025? Select all that apply.,Advanced threat detection using machine learning,Automated transaction routing optimization,Real-time anomaly detection in cross-chain transfers,Predictive validator behavior analysis,"A, C",Yes
243,Advanced,"According to Flashbots' 2025 research, what has become the dominant limit to scaling blockchains?",Network bandwidth constraints,Storage capacity limitations,MEV (Maximal Extractable Value),Consensus finality delays,C,No
244,Advanced,Which technical mechanisms does Zama's Confidential Blockchain Protocol implement for privacy preservation?,End-to-end encrypted transactions and state,Onchain composability with encrypted computation,Zero-knowledge proof verification layers,Homomorphic signature schemes,"A, B",Yes
245,Advanced,What is the annual revenue generated by Mawari Network through its DePIN infrastructure as of 2025?,$1.2 million,$1.5 million,$1.8 million,$2.1 million,B,No
246,Advanced,Select all blockchain networks that Band Protocol V3 supports through its IBC and IBC-Hook integration.,Cosmos ecosystem chains,IBC-enabled Ethereum Layer 2s,Polkadot parachains,IBC-Hook-enabled chains,"A, D",Yes
247,Advanced,Which consensus mechanism enables Bitcoin Hyper's Layer 2 solution to process transactions without gas fees?,Proof of Burn (PoB),HyperBFT,Delegated Proof of Stake (DPoS),Practical Byzantine Fault Tolerance (pBFT),B,No
248,Advanced,"According to the 2025 DePIN Report, which factors drive the transformation of traditional infrastructure models? Select all that apply.",Token incentives for distributed participation,Permissionless network participation,Reduced dependence on centralized entities,New ownership and governance structures,"A, B, C, D",Yes
249,Advanced,What is the key technical difference between Solana's Proof of History and traditional timestamp mechanisms?,It uses external time oracles for synchronization,It creates a cryptographic clock before consensus,It eliminates the need for block confirmations,It implements parallel transaction processing,B,No
250,Advanced,Which GDPR compliance strategies are recommended for blockchain implementations in 2025? Select all that apply.,Avoid storing personal data directly on blockchain,"Use encryption, hashing, and off-chain storage",Implement data protection by design principles,Enable selective data deletion mechanisms,"A, B, C",Yes
251,Advanced,What percentage of crypto users consider privacy a critical feature of digital finance according to 2025 surveys?,76%,84%,91%,88%,B,No
252,Advanced,Which technical improvements did IOTA implement in their Mysticeti consensus mechanism during Q2 2025?,Enhanced network stability through consensus optimizations,Reduced transaction confirmation times,Improved validator selection algorithms,Integrated quantum-resistant signatures,A,No
253,Advanced,Select all MEV protection mechanisms implemented by leading DEX platforms in 2025.,RFQ (Request for Quote) systems,CLMM (Concentrated Liquidity Market Making),Advanced routing mechanisms,Sandwich attack compensation programs,"A, B, C, D",Yes
254,Advanced,What is the primary technical challenge that ePBS (Enshrined Proposer Builder Separation) aims to address in Ethereum?,Reducing validator hardware requirements,Native MEV mitigation and reduced validator costs,Improving cross-shard communication,Enhancing smart contract execution speed,B,No
255,Advanced,Which spatial computing capabilities does Mawari Network provide for AR/VR/XR applications? Select all that apply.,Real-time low-latency streaming of 3D content,Global mesh of GPU-powered nodes,Compatibility with Meta Quest 3 and Apple Vision Pro,Spatial Streaming SDK for developers,"A, B, C, D",Yes
256,Advanced,"According to 2025 market analysis, what percentage of the highest valuation crypto rounds are dominated by top-tier investors?",35%,40%,45%,50%,B,No
257,Advanced,Which consensus model characteristics define Avalanche's approach to blockchain scalability?,High throughput with parallel processing capabilities,Efficient blockchain pruning mechanisms,Subnet-based application-specific chains,Probabilistic finality with rapid confirmation,"A, B",Yes
258,Advanced,What is the expected impact of the 2025 ZKP (Zero-Knowledge Proof) standardization on the Web3 ecosystem?,Elimination of gas fees across all networks,Prevention of fragmented protocol development,Universal cross-chain interoperability,Automated smart contract verification,B,No
259,Advanced,Which partnerships has Mawari Network established to demonstrate its leadership in the XR market? Select all that apply.,KDDI for telecommunications infrastructure,T-Mobile for 5G network integration,BMW for automotive XR applications,Netflix for immersive content delivery,"A, B, C, D",Yes
260,Advanced,What is the primary technical innovation that enables Fully Homomorphic Encryption (FHE) in Zama's blockchain protocol?,Computing on encrypted data without decryption,Parallel processing of zero-knowledge proofs,Quantum-resistant signature schemes,Distributed key generation protocols,A,No
261,Advanced,"According to 2025 research, which factors contribute to the concerns about ePBS implementation in Ethereum? Select all that apply.",Multiparty collusion risks,Chain stagnation possibilities,Increased validator operation complexity,Reduced transaction throughput,"A, B",Yes
262,Advanced,What percentage of Europeans have engaged with cryptocurrencies as of early 2025?,Over 15%,Over 20%,Over 25%,Over 30%,B,No
263,Advanced,Which technical mechanisms does CowSwap DEX implement for MEV protection?,Built-in front-running prevention,Sandwich attack protection,Gas optimization through batch processing,Automated arbitrage detection,"A, B",Yes
264,Advanced,What is the total funding amount raised by Mawari Network for its DePIN infrastructure development?,$15.8 million,$17.3 million,$19.2 million,$21.5 million,B,No
265,Advanced,Select all blockchain networks that are supported by Wormhole's cross-chain bridge infrastructure as of 2025.,35+ chains with $60B transaction volume,Ethereum and all major EVM chains,Solana and Cosmos ecosystem,Bitcoin Layer 2 solutions,A,No
266,Advanced,Which consensus mechanism innovation allows Idena blockchain to implement Proof-of-Person (PoP)?,AI-resistant simultaneous testing for all participants,Biometric verification through smart contracts,Social graph analysis for identity validation,Cryptographic identity linking to single persons,"A, D",Yes
267,Advanced,What is the key architectural difference between traditional oracle networks and Band Protocol V3's approach?,Elimination of off-chain data sources,Custom mempool for mission-critical data protection,Decentralized validator selection algorithms,Automated cross-chain arbitrage mechanisms,B,No
268,Advanced,Which AI-driven capabilities are being integrated into Web3 infrastructure in 2025? Select all that apply.,Autonomous DeFi portfolio management,Real-time blockchain data analysis,Automated smart contract interaction,Cross-chain transaction optimization,"A, B, C",Yes
269,Advanced,What is the primary technical challenge that Bitcoin Hyper addresses in Bitcoin Layer 2 scaling?,Implementing smart contract functionality on Bitcoin,Reducing Bitcoin transaction confirmation times,Enabling cross-chain Bitcoin transfers,Optimizing Bitcoin mining efficiency,A,No
270,Advanced,Which regulatory developments in 2025 have impacted crypto staking operations? Select all that apply.,SEC's clarified guidelines on legal staking methods,GDPR compliance requirements for blockchain data,Enhanced KYC requirements for staking platforms,Energy efficiency mandates for PoS networks,"A, B",Yes
271,Advanced,What percentage increase in Bitcoin treasury companies was recorded in 2025?,125%,135%,145%,155%,B,No
272,Advanced,Which technical features distinguish Theta Network's EdgeCloud platform in 2025?,EdgeCloud Hybrid for consumer and enterprise GPU marketplace,AI-powered mascot development capabilities,Integration with major sports organizations,Support for DeepSeek R1 LLM processing,"A, D",Yes
273,Advanced,What is the primary innovation of Lumerin's protocol in the DePIN ecosystem?,Decentralized GPU mining coordination,Smart contract control of P2P data streams,Automated bandwidth allocation algorithms,Cross-chain storage optimization,B,No
274,Advanced,Select all applications that Lumerin's protocol enables in the DePIN infrastructure.,Encrypted video and audio streams,Permissioned communications systems,Programmable data streams and NFTs,AI compute power decentralization,"A, B, C, D",Yes
275,Advanced,Which consensus mechanism characteristic makes Avalanche particularly suitable for high-throughput applications?,Probabilistic finality with sub-second confirmation,Parallelizable transaction processing,Efficient blockchain state pruning,Subnet-based application isolation,B,No
276,Advanced,What are the key components of DePIN's transformation of traditional infrastructure models? Select all that apply.,Token incentives for distributed participation,Permissionless network access and contribution,Community-driven governance structures,Reduced reliance on centralized providers,"A, B, C, D",Yes
277,Advanced,Which technical innovation enables SatoshiVM to bridge Bitcoin and Ethereum ecosystems?,Native BTC as gas for EVM-compatible transactions,Cross-chain atomic swaps with Ethereum,Bitcoin script extensions for smart contracts,Merged mining with Ethereum validators,A,No
278,Advanced,"According to 2025 analysis, which factors make privacy a critical concern for Web3 users? Select all that apply.",84% of users consider privacy critical for digital finance,Increasing regulatory scrutiny of transaction data,Growing sophistication of blockchain analysis tools,Enhanced MEV extraction targeting user transactions,"A, B, C",Yes
279,Advanced,What is the primary technical mechanism that GMGN implements for MEV protection in 2025?,Pre-transaction simulation and validation,Compensation programs for sandwich attack victims,Real-time MEV bot detection algorithms,Encrypted transaction pool management,B,No
280,Advanced,Which advanced routing mechanisms does Bybit's Byreal DEX implement for MEV protection on Solana?,RFQ (Request for Quote) systems,CLMM (Concentrated Liquidity Market Making),High-speed MEV-protected swaps,Cross-chain arbitrage prevention,"A, B, C",Yes
281,Advanced,What is the total number of sandwich attacks recorded on Solana-based applications in April 2025?,"Over 240,000 attacks","Over 260,000 attacks","Over 280,000 attacks","Over 300,000 attacks",B,No
282,Advanced,Select all technical innovations that distinguish modular blockchain architecture from monolithic designs.,"Separation of execution, consensus, and data availability",Independent scaling of different blockchain layers,Customizable security and performance trade-offs,Interoperable cross-chain communication protocols,"A, B, C",Yes
283,Advanced,"According to the 2025 DePIN Expo announcement, where and when will the world's first DePIN-themed exhibition take place?","August 27-28, 2025, at Cyberport, Hong Kong","September 15-16, 2025, at Marina Bay, Singapore","October 10-11, 2025, at ExCeL London, UK","November 5-6, 2025, at Tokyo Big Sight, Japan",A,No
284,Advanced,"In Celestia's data availability sampling mechanism, what is the primary mathematical property that enables light clients to detect data withholding attacks with high probability using only a small number of random samples?",Reed-Solomon erasure coding with 2D polynomial commitment schemes,Merkle tree inclusion proofs with cryptographic accumulators,Fraud proof generation through interactive verification games,Byzantine agreement protocols with threshold signatures,A,No
285,Advanced,Which technical innovations distinguish IOTA's 2025 Tangle voting consensus from traditional blockchain consensus mechanisms?,Coordinator-free operation with deterministic finality,DAG structure enabling parallel transaction validation,Feeless transactions through self-validating architecture,Asynchronous message propagation without global ordering,"A, B, C",Yes
286,Advanced,"In Hedera Hashgraph's asynchronous Byzantine Fault Tolerance (aBFT) consensus, what is the theoretical maximum percentage of malicious nodes the network can tolerate while maintaining safety and liveness guarantees?",25% (1/4 threshold),33.3% (1/3 threshold),49% (majority threshold),50% (simple majority threshold),B,No
287,Advanced,What are the key security vulnerabilities that have emerged in cross-chain bridge architectures during 2025?,Multi-signature validator key compromises leading to unauthorized withdrawals,Oracle manipulation attacks exploiting price feed delays,Smart contract upgrade mechanisms bypassing timelock protections,Cross-chain message replay attacks due to insufficient nonce validation,"A, C, D",Yes
288,Advanced,"In Algorand's Pure Proof of Stake (PPoS) mechanism, what cryptographic technique ensures that block proposers cannot be predicted or targeted before the consensus round begins?",Verifiable Random Functions (VRFs) with private key signatures,Threshold signatures with distributed key generation,Zero-knowledge proofs with commitment schemes,Hash-based time-lock puzzles with difficulty adjustment,A,No
289,Advanced,Which architectural components are essential for EigenLayer's restaking security model to prevent cascading slashing events across multiple protocols?,Operator delegation with slashing condition isolation,Cryptoeconomic security with stake weighting mechanisms,Withdrawal delay periods with dispute resolution windows,Cross-protocol risk assessment with automated stake rebalancing,"A, B, C",Yes
290,Advanced,"In NEAR Protocol's Nightshade sharding implementation, what mechanism enables asynchronous cross-shard transaction execution without requiring global state synchronization?",Receipt-based communication with delayed state transitions,Merkle proof validation with state root commitments,Threshold signature aggregation with shard coordination,Optimistic execution with fraud proof challenges,A,No
