No,classification,Question,Option A,Option B,Option C,Option D,Correct option,Multiple Choice or Not
1,,What is the core characteristic of the PoW consensus mechanism in blockchain?,Determining validation rights through token holdings,Validating transactions by solving complex mathematical puzzles,Electing validation nodes through voting,Selecting validators through random sampling,B,
2,,What is the main purpose of Merkle Trees in blockchain?,Accelerating transaction processing speed,Efficiently verifying if transactions are included in a block,Enhancing blockchain anonymity,Reducing block size,B,
3,,What is the essence of transaction confirmation in blockchain?,Transactions being packaged into blocks by miners,Transactions being accepted by the majority of nodes in the network,Transactions having a sufficient number of blocks generated after them,Transactions being confirmed by exchanges,C,
4,,What is the main purpose of blockchain incentive mechanisms?,Attracting more users to use the blockchain,Incentivizing nodes to honestly participate in network maintenance,Increasing blockchain transaction speed,Reducing blockchain usage costs,B,
5,,Which consensus mechanism is most vulnerable to 51% attacks?,PoS (Proof of Stake),PoW (Proof of Work),DPoS (Delegated Proof of Stake),PBFT (Practical Byzantine Fault Tolerance),B,
6,,What is the main advantage of the P2P network topology in blockchain?,Higher transaction processing speed,Better privacy protection,Stronger censorship resistance,Lower network latency,C,
7,,"What problem does cross-shard communication"" mainly solve in blockchain sharding technology?""",Data exchange between different shards,Data synchronization between shards and the main chain,Consensus within a shard,Data storage in shards,A,
8,,In PoS consensus mechanism, what mainly determines the probability of a validator being selected?,Computing power,Amount of staked tokens,Network connection speed,Historical validation record,B,
9,,What is the main difference between Optimistic Rollup and ZK Rollup?,Different data storage methods,Different transaction validation mechanisms,Different supported token types,Completely identical user experience,B,
10,,"What does ZK"" stand for in ZK Rollup?""",Zero Knowledge,Zone Keeper,Zeta Kappa,Zoom Key,A,
11,,How do Layer2 solutions ensure security?,By relying entirely on their own validator network,By inheriting security from the underlying Layer1,By relying on centralized servers,By increasing transaction fees,B,
12,,What does the data availability problem in Layer2 mainly refer to?,Whether data can be accessed quickly,Whether data can be stored long-term,Whether data is publicly verifiable by everyone,Whether data is protected by encryption,C,
13,,How long does it typically take for a user to withdraw from Layer2 to Layer1?,A few seconds,A few minutes,Several hours to several days,Several weeks,C,
14,,How is communication between Layer2 and Layer1 primarily implemented?,Through peer-to-peer networks,Through smart contracts,Through centralized servers,Through email systems,B,
15,,Which of the following is NOT a main advantage of Layer2 solutions?,Lower transaction fees,Higher transaction throughput,Faster transaction confirmation,Stronger anonymity,D,
16,,"What does batching"" mainly refer to in Layer2 solutions?""",Processing multiple users' transaction requests simultaneously,Combining multiple transactions into one submission to Layer1,Distributing token rewards in batches,Upgrading network protocols in batches,B,
17,,What security assumption are Layer2 solutions typically based on?,Most users are honest,The underlying Layer1 is secure,The network will never disconnect,All validators are trustworthy,B,
18,,How is the economic model of Layer2 solutions typically designed?,Completely free to use,Charging lower transaction fees than Layer1,Charging the same transaction fees as Layer1,Only charging corporate users,B,
19,,How does ZK Rollup prove transaction validity?,Through community voting,By waiting for a challenge period,Through zero-knowledge proofs,Through centralized validators,C,
20,,What is the main purpose of asset tokenization?,Increasing the physical value of assets,Improving asset liquidity,Reducing asset risk,Reducing tax burden on assets,B,
21,,Which of the following is an example of tangible asset tokenization?,Music copyright NFT,Real estate NFT,Patent NFT,Carbon credit NFT,B,
22,,What is the main role of NFTs in RWA?,Providing entertainment value for assets,Representing unique ownership of assets,Enhancing physical properties of assets,Reducing transaction costs of assets,B,
23,,What aspect does the legal foundation of tokenized assets mainly involve?,Physical storage of assets,Digital representation of assets,Legal confirmation of asset ownership,Insurance coverage of assets,C,
24,,How is asset ownership typically represented on blockchain?,Through paper certificates,Through digital tokens,Through court records,Through bank accounts,B,
25,,What is tokenized asset valuation typically based on?,Only on the activity of the blockchain network,Only on the scarcity of the token,On the market value of the underlying physical asset,On the reputation of the token creator,C,
26,,How is the transparency of tokenized assets mainly reflected?,All transactions can be publicly queried on blockchain,The identity of asset holders must be public,The physical location of assets must be public,The insurance information of assets must be public,A,
27,,How is the distribution of returns for tokenized assets typically implemented?,Only through bank transfers,Only through cash payments,Can be automatically distributed through smart contracts,Only through court orders,C,
28,,Which of the following is NOT an example of intangible asset tokenization?,Music copyright NFT,Patent right NFT,Gold ETF token,Carbon credit NFT,C,
29,,What does DePIN stand for?,Decentralized Physical Infrastructure Networks,Distributed Protocol Integration Network,Digital Payment Infrastructure Network,Decentralized Private Internet Network,A,
30,,What is the main purpose of the token incentive mechanism in DePIN?,Only for fundraising,Incentivizing users to deploy and maintain physical infrastructure,Only for marketing promotion,Replacing fiat currency,B,
31,,Which of the following is NOT a major category of DePIN?,Decentralized server networks,Wireless communication networks,Sensor networks,Centralized storage networks,D,
32,,What is the basic security assumption in DePIN?,All participants are malicious,Most participants are honest,Only validators are trustworthy,Security completely depends on centralized regulation,B,
33,,Which of the following is a typical example of a DePIN project?,Bitcoin,Ethereum,Helium,Uniswap,C,
34,,Which of the following are common cross-chain bridge verification methods? (Choose 2),Hash time-locked atomic swaps,Witness verification,Centralized server verification,Social media verification,"A,B",
35,,What features do Hash Time-Locked Contracts (HTLCs) have? (Choose 2),If the receiver doesn't provide the correct key within the specified time, funds return to the sender,The receiver needs to provide the correct key to obtain the funds,Must be executed through a centralized exchange,Can only be used for transactions within the same blockchain,A,B,
36,,Which of the following are types of blockchain consensus mechanisms? (Choose 3),PoW (Proof of Work),PoS (Proof of Stake),DPoS (Delegated Proof of Stake),PoA (Proof of Authority),"A,B,C",
37,,What are the characteristics of blockchain sharding technology? (Choose 2),Dividing the blockchain network into multiple subchains,Each shard processes transactions independently,Completely eliminating the need for cross-shard communication,Reducing blockchain security,"A,B",
38,,What are the solutions to the blockchain state explosion problem? (Choose 2),State rent,State expiry,Increasing block size,Reducing transaction count,"A,B",
39,,What are the types of blockchain nodes? (Choose 3),Full nodes,Light nodes,Archive nodes,Virtual nodes,"A,B,C",
40,,What are the basic components of blockchain data structures? (Choose 3),Block headers,Transaction lists,Merkle trees,Graphical interfaces,"A,B,C",
41,,What are the solutions for blockchain network partition tolerance? (Choose 2),Longest chain rule,Byzantine fault tolerance algorithms,Complete centralized control,Prohibiting network partitions,"A,B",
42,,What are the main advantages of Layer2 solutions? (Choose 3),Lower transaction fees,Higher transaction throughput,Faster transaction confirmation,Stronger anonymity,"A,B,C",
43,,What are the characteristics of ZK Rollup? (Choose 2),Using zero-knowledge proofs to verify transaction validity,Transactions are immediately finalized,Requiring a waiting period for challenges,Not submitting any data to Layer1,"A,B",
44,,What are the communication mechanisms between Layer2 and Layer1? (Choose 2),Smart contracts,Message passing,Email,Social media,"A,B",
45,,What are the basic types of Layer2 solutions? (Choose 3),Rollups,State Channels,Plasma,Proof of Authority,"A,B,C",
46,,What are examples of tangible asset tokenization? (Choose 3),Real estate NFTs,Art NFTs,Gold ETF tokens,Music copyright NFTs,"A,B,C",
47,,What are examples of intangible asset tokenization? (Choose 3),Music copyright NFTs,Patent right NFTs,Carbon credit NFTs,Real estate NFTs,"A,B,C",
48,,What types of risks do tokenized assets face? (Choose 3),Technical risks,Legal risks,Market risks,Zero risk,"A,B,C",
49,,What problem does the Proto-Danksharding implementation mechanism in EIP-4844 primarily solve?,Layer1 transaction throughput,Data availability and cost for Layer2,Layer1 smart contract security,Layer1 consensus mechanism efficiency,B,
50,,What is the main challenge facing blockchain sharding technology?,How to maintain network decentralization,How to achieve cross-shard communication and atomicity,How to increase processing speed of individual shards,How to reduce storage costs of shards,B,
51,,How does EIP-4844 in Ethereum's Dencun upgrade optimize data availability for Layer2?,By increasing block size,By introducing blob transaction types for temporary data storage,By reducing block generation time,By increasing validator count,B,
52,,What is the core of the blockchain data availability problem?,Whether data can be accessed quickly,Whether data can be stored long-term,Whether data is publicly released and correctly published by validators,Whether data is protected by encryption,C,
53,,What was the main content of Ethereum's Shanghai upgrade in 2023?,Implementing sharding technology,Enabling withdrawals of staked ETH,Introducing EIP-4844,Completing the transition from PoW to PoS,B,
54,,In blockchain consensus algorithm security analysis, what percentage of malicious nodes can Byzantine Fault Tolerance (BFT) type algorithms typically tolerate?,Less than 1/3,Less than 1/2,Less than 2/3,Less than 3/4,A,
55,,What major new functionality did Arbitrum's Stylus upgrade bring in 2023?,Support for writing smart contracts in Rust and C++,Lowering transaction fees,Adding cross-chain functionality,Increasing transaction throughput,A,
56,,What problem does zero-knowledge proof technology in ZK Rollup primarily solve?,User privacy protection,Quickly verifying the correctness of large amounts of computation,Reducing gas fees,Increasing transaction throughput,B,
57,,What was the main technical advantage of zkSync Era in 2024?,Fully EVM-compatible zkEVM,Lower transaction fees,Faster transaction confirmation,Better cross-chain compatibility,A,
58,,What is the main purpose of Layer2 data compression technology?,Improving data transmission speed,Reducing data storage costs on Layer1,Enhancing data security,Simplifying data structures,B,
59,,How did Optimism's OP Stack promote Layer2 ecosystem development in 2023-2024?,Providing proprietary technology to specific partners,Providing an open-source modular framework allowing creation of compatible Layer2 networks,Attracting developers through high subsidies,Attracting users by lowering transaction fees,B,
60,,How does the MEV problem in Layer2 differ from Layer1?,Layer2 has no MEV problem,Layer2's MEV problem is more severe,Layer2's MEV is concentrated at the sequencer level,Layer2's MEV only affects specific transaction types,C,
61,,What measures did Arbitrum and Optimism take in 2023 to increase decentralization?,Increasing validator count,Issuing governance tokens and launching DAOs,Open-sourcing all code,Lowering validator hardware requirements,B,
62,,What problem does the dynamic data update mechanism for real estate NFTs mainly solve?,Real estate price fluctuation problems,Real-time reflection of changes in the physical state of properties,Automation of property ownership transfers,Automatic distribution of rental income,B,
63,,What was the main feature of Ondo Finance's USDY tokenized product in 2023?,A USD-pegged stablecoin,Tokenized US Treasury bonds providing approximately 4.35% annual yield,Tokenized real estate investments,Tokenized gold reserves,B,
64,,What was the main role of MANTRA's DID (Decentralized Identity) system in RWA in 2024?,Providing anonymous transaction functionality,Ensuring user compliance and security, meeting KYC/AML requirements,Accelerating transaction processing speed,Reducing transaction fees,B,
65,,What is the main challenge facing cross-border regulation of tokenized assets?,Technical standards not being unified,Regulatory differences across jurisdictions,Network connectivity issues,Language barriers,B,
66,,In 2023-2024, what was the most crucial factor in the design of liquidity markets for tokenized assets?,User-friendly trading interfaces,Market depth and price discovery mechanisms,Transaction speed,Marketing strategies,B,
67,,What is the main advantage of price discovery mechanisms for tokenized assets compared to traditional assets?,Prices always increase,Lower price volatility,More transparent, real-time and efficient price discovery,Prices completely controlled by developers,C,
68,,How did RWA projects solve the risk assessment problem for tokenized assets in 2024?,By completely relying on traditional rating agencies,By using on-chain data and smart contracts to automate risk assessment,By ignoring the risk assessment component,By only accepting government-guaranteed assets,B,
69,,What is the innovation in the collateralization mechanism for tokenized assets compared to traditional financial collateral?,No collateral required,Collateral can be digital assets with automated collateralization processes,Collateral can only be physical assets,Collateralization must be done through banks,B,
70,,In 2023, what was the most important consideration in designing secondary markets for tokenized assets?,The level of transaction fees,Market liquidity and compliance,The design of the trading interface,Market opening hours,B,
71,,What mechanism does the data validation process for DePIN hardware tokenization primarily rely on?,Centralized server verification,Decentralized oracles and multi-party validation,User self-reporting,Government regulatory agency certification,B,
72,,What changes occurred in Helium's supply-demand incentive balance mechanism after migrating to Solana in 2023?,All incentive mechanisms were eliminated,More efficient token distribution and burning mechanisms were introduced,Complete reliance on external subsidies,Transition to centralized pricing models,B,
73,,"What does the flywheel effect"" refer to in DePIN network effects and expansion strategies?""",The faster hardware devices spin, the higher the mining efficiency,A positive feedback loop where increasing users enhance network value, attracting more users,Token price increases driving hardware sales,Network expansion speed growing exponentially over time,B,
74,,How did DePIN projects solve the main technical challenge of hardware and blockchain integration in 2024?,By completely relying on centralized servers,By using specialized chips and lightweight clients,By requiring all devices to run full nodes,By abandoning hardware integration and moving to purely software solutions,B,
75,,What technologies were Filecoin's data privacy and security solutions primarily based on in 2023?,Centralized encryption,Zero-knowledge proofs and distributed storage,Biometric authentication,Government regulation,B,
76,,What is the main advantage of layered design in DePIN scalability technical architecture?,Reducing development costs,Enhancing marketing effectiveness,Separating concerns and optimizing performance for each layer,Simplifying user interfaces,C,
77,,How did DePIN projects design value capture mechanisms to ensure long-term sustainability in 2024?,By completely relying on external investment,By combining service fees, token economics, and governance rights,By relying solely on token appreciation,Primarily through advertising revenue,B,
78,,How did DePIN projects solve the challenge of hardware resource pricing in 2023-2024?,Fixed pricing models,Completely determined by developers,Dynamic market pricing and algorithmic adjustments,Government-guided pricing,C,
79,,How did Render Network achieve cross-chain resource integration in 2024?,By abandoning cross-chain functionality,By using centralized bridging services,Through cross-chain messaging protocols and liquidity pools,By requiring users to manually operate on each chain,C,
80,,What is the main purpose of hardware abstraction module technology in DePIN?,Simplifying hardware manufacturing processes,Reducing hardware costs,Allowing different types of hardware to connect uniformly to the network,Improving hardware performance,C,
81,,What are the characteristics of cross-chain bridge atomic exchange mechanisms in 2023-2024? (Choose 2),No need to trust third parties,Transactions either completely succeed or completely fail,Faster transaction speed than centralized exchanges,Lower transaction fees than centralized exchanges,"A,B",
82,,What are the advantages of light client verification technology? (Choose 2),High security,No need to trust third parties,Simple implementation,Low resource consumption,"A,B",
83,,What are the characteristics of external witness verification networks in 2024? (Choose 2),Composed of multiple validators,Using threshold signatures or multisignatures,Completely centralized,Not requiring any incentive mechanisms,"A,B",
84,,What key components are included in the technical implementation of liquidity networks in 2023? (Choose 2),Distributed liquidity providers,Atomic exchange protocols,Centralized control servers,Government regulatory agencies,"A,B",
85,,What important factors are considered in cross-chain bridge security risk assessment models? (Choose 3),Security of verification mechanisms,Degree of decentralization,Code audit status,Social media following of the project team,"A,B,C",
86,,What are the main technical features of Ethereum's EIP-4844 implementation in 2023-2024? (Choose 2),Introduction of blob transaction types,Data only temporarily stored in the consensus layer,Completely replacing Layer2 solutions,Increasing blockchain anonymity,"A,B",
87,,What innovations did Celestia's data availability layer include in 2023? (Choose 2),Data availability sampling,Modular blockchain design,Completely centralized data storage,Abandoning blockchain technology,"A,B",
88,,What performance optimization technologies did Solana include in 2023-2024? (Choose 2),Parallel transaction processing,Historical data compression,Completely centralized processing,Abandoning blockchain technology,"A,B",
89,,What advantages did the Move language in Aptos and Sui have in 2023? (Choose 2),Resource-oriented programming model,Formal verification support,Complete compatibility with Ethereum smart contracts,Not requiring programming knowledge,"A,B",
90,,What blockchain state management optimization technologies were used in 2023-2024? (Choose 2),State rent,State expiry,Unlimited state size increase,Completely centralized state management,"A,B",
91,,What characteristics did Optimistic Rollup fraud proof mechanisms have in 2023-2024? (Choose 2),Using transaction validity proofs,Requiring a challenge period,Using zero-knowledge proofs,Not requiring any verification,"A,B",
92,,What advantages did ZK Rollup zero-knowledge proof technology have in 2023-2024? (Choose 2),Immediate transaction finality,Higher privacy,Lower computational complexity,Complete compatibility with all EVM opcodes,"A,B",
93,,What data availability solutions did Layer2 include in 2023? (Choose 2),Data availability committees,Data availability sampling,Complete reliance on centralized servers,Complete abandonment of data availability,"A,B",
94,,What interoperability technologies did Layer2 include in 2023-2024? (Choose 2),Cross-Rollup message passing,Unified bridging protocols,Complete centralized control,Complete abandonment of interoperability,"A,B",
95,,What features did decentralized sequencers for Layer2 have in 2023? (Choose 2),Distributed transaction ordering,Anti-censorship mechanisms,Complete centralized control,Requiring specific hardware,"A,B",
96,,What compliance solutions did RWA tokenization include in 2023-2024? (Choose 2),On-chain KYC/AML integration,Compliance smart contracts,Complete regulatory avoidance,Abandonment of all compliance requirements,"A,B",
97,,What innovative mechanisms did RWA liquidity markets include in 2023? (Choose 2),Automated market makers (AMM),Order book models,Complete centralized control,Only allowing institutional investors to participate,"A,B",
98,,What were the main features of RWA governance models in 2023-2024? (Choose 2),Token holder voting rights,On-chain governance proposals,Complete centralized control,Only allowing founders to make decisions,"A,B",
99,,What innovative methods did RWA value assessment models include in 2023? (Choose 2),On-chain oracle price feeds,Decentralized assessment DAOs,Completely subjective assessment,Only relying on centralized institution assessment,"A,B",
100,,What technical implementations did RWA return distribution mechanisms include in 2023-2024? (Choose 2),Automatic distribution through smart contracts,On-chain revenue rights proof,Only through bank transfers,Only through cash payments,"A,B",
101,,What is the core innovation of Celestia's modular blockchain architecture in 2025?,Dividing blockchain functions into four separate layers: execution, settlement, consensus, and data availability,Using a new consensus algorithm,Completely abandoning smart contract functionality,Using centralized servers to process transactions,A,
102,,How do EIP-4844 blob transactions in Ethereum's Dencun upgrade affect the Layer2 ecosystem in 2024?,Completely replacing Layer2 solutions,Reducing Layer2 data costs by approximately 10x,Increasing Layer2 complexity,Reducing Layer2 security,B,
103,,What technology is Solana's ultra-high throughput architecture optimization primarily based on in 2025?,Sharding technology,Parallel transaction processing and Firedancer validation client,Zero-knowledge proofs,Centralized processing nodes,B,
104,,What is the main difference in performance between Aptos and Sui's Move language blockchains in 2024-2025?,Aptos uses a parallel execution engine while Sui uses causal ordering execution,Aptos completely abandons parallel execution,Sui doesn't support smart contracts,Both have identical performance,A,
105,,What direction is the cutting-edge development of blockchain state proof technology primarily focused on in 2025?,Increasing state size,Using zero-knowledge proofs to compress state proofs,Completely abandoning state proofs,Using centralized servers to verify states,B,
106,,What is the main advantage of blockchain data availability sampling technology in 2024?,Allowing light clients to verify the availability of entire blocks by sampling a small number of data chunks,Increasing block size,Reducing validator count,Increasing transaction fees,A,
107,,What strategy is primarily used for optimizing blockchain consensus algorithms in high-concurrency scenarios in 2025?,Increasing block size,Reducing validator count,Using DAG structures and probabilistic confirmation,Completely centralized processing,C,
108,,What is the main advantage of zkEVM compared to traditional EVM according to the 2024 verification efficiency comparison?,Transaction verification speed improved by about 100x but with lower compatibility,Full compatibility with all EVM opcodes but same verification speed,Verification speed improved by about 10x while maintaining high EVM compatibility,Only supporting basic transfer functions,C,
109,,How do StarkNet and Polygon zkEVM primarily differ in their zero-knowledge proof implementations in 2025?,StarkNet uses STARK proofs while Polygon zkEVM uses SNARK proofs,StarkNet doesn't support smart contracts while Polygon zkEVM does,StarkNet is completely centralized while Polygon zkEVM is decentralized,Both implementations are identical,A,
110,,What is the main direction of Optimism and Arbitrum's OP Stack architecture evolution in 2024-2025?,Abandoning open source for proprietary technology,Modular design and superchain architecture supporting multi-chain deployment,Complete transition to zero-knowledge proof technology,Abandoning Layer2 for direct Layer1 scaling,B,
111,,How is the modular design trend for Layer2 primarily manifested in 2025?,Only focusing on execution layer modularization,Separating data availability, execution, settlement, and consensus into independent modules,Completely abandoning modular design,Only focusing on user interface modularization,B,
112,,What problem does Layer2 decentralized sequencer technology primarily solve in 2024?,Transaction execution speed,High transaction fees,Single point of failure and censorship risks of centralized sequencers,Complex user interfaces,C,
