291,Advanced,What are the primary technical advantages of Sui's object-centric data model compared to traditional account-based blockchain architectures?,Parallel transaction execution without global state conflicts,Simplified smart contract programming with ownership semantics,Reduced storage requirements through object lifecycle management,Enhanced privacy through object-level access controls,"A, B",Yes
292,Advanced,"In the OpenBridge (ERC-7786) standard introduced in 2025, what is the primary mechanism for achieving composable security across different bridge implementations?",Standardized security module interfaces with pluggable verification,Multi-bridge aggregation with weighted security scoring,Unified slashing conditions across bridge operators,Cross-bridge insurance pools with shared risk assessment,A,No
293,Advanced,Which factors contributed to Base surpassing Arbitrum in Total Value Locked (TVL) by June 2025?,Coinbase's institutional user base and fiat on-ramp integration,Superior technical performance with lower transaction costs,Enhanced developer tooling and ecosystem incentives,Strategic partnerships with major DeFi protocols,"A, C, D",Yes
294,Advanced,"In zkVM architectures like RiscZero, what is the primary computational bottleneck that limits proof generation throughput for complex smart contract execution?",Constraint system compilation and witness generation,Cryptographic commitment scheme computations,Memory access pattern verification and authentication,Recursive proof composition and aggregation overhead,A,No
295,Advanced,What are the key security considerations for Account Abstraction (ERC-4337) implementations that have emerged from 2025 deployments?,Nonce management vulnerabilities enabling replay attacks across EntryPoints,Paymaster economic attacks through gas price manipulation,Bundler centralization risks affecting transaction inclusion,Smart contract wallet upgrade mechanisms bypassing user consent,"A, B, C",Yes
296,Advanced,"In Aptos's Shardines execution engine announced in February 2025, what architectural innovation enables 'infinite scalability' claims?",Horizontal partitioning with dynamic shard allocation,Parallel execution with optimistic concurrency control,State sharding with cross-shard transaction batching,Modular execution with pluggable consensus layers,A,No
297,Advanced,Which MEV protection mechanisms have proven most effective against sandwich attacks in 2025 DeFi protocols?,Batch auction systems with uniform clearing prices,Private mempool routing with encrypted transaction pools,Commit-reveal schemes with time-delayed execution,Intent-based execution with solver competition,"A, D",Yes
298,Advanced,"In liquid staking derivative protocols, what is the primary systemic risk that could lead to cascading failures across the broader DeFi ecosystem?",Validator slashing events causing LSD token depegging,Withdrawal queue congestion during market stress periods,Recursive leverage strategies amplifying liquidation cascades,Governance token concentration enabling protocol capture,C,No
299,Advanced,What technical innovations in intent-based protocols like Symmio enable trustless derivatives trading without traditional order books?,Solver networks with cryptoeconomic incentive alignment,Symmetrical contract design with bilateral collateral requirements,Off-chain matching with on-chain settlement guarantees,Dynamic pricing through automated market maker integration,"A, B",Yes
300,Advanced,"In the Move programming language ecosystem, what safety guarantee distinguishes it from Solidity in preventing common smart contract vulnerabilities?",Linear type system preventing resource duplication and loss,Formal verification integration with automated theorem proving,Capability-based security with explicit permission modeling,Bytecode verification with runtime safety checks,A,No
301,Advanced,Which factors explain the 800% surge in Real-World Asset (RWA) tokenization by 2025?,Regulatory clarity with compliant tokenization frameworks,Institutional adoption driven by yield optimization strategies,Technical infrastructure maturation with reliable oracle feeds,Cross-chain interoperability enabling global asset access,"A, B, C",Yes
302,Advanced,"In Ethereum's proposed Enshrined Proposer-Builder Separation (ePBS), what is the primary mechanism for mitigating MEV extraction while maintaining decentralization?",Protocol-level auction mechanisms with transparent bid revelation,Validator rotation with randomized block proposal rights,Cryptographic commitment schemes with delayed execution,Multi-party computation for private transaction ordering,A,No
303,Advanced,What are the key technical challenges facing Bitcoin Layer 2 solutions like Bitcoin Hyper in achieving smart contract functionality?,Limited scripting capabilities requiring complex workarounds,UTXO model incompatibility with account-based smart contracts,Consensus mechanism constraints preventing state transitions,Security assumptions requiring additional trust models,"A, B, D",Yes
304,Advanced,"In ZKM's Ziren infrastructure launched in 2025, what architectural component enables 'realtime proving' for zero-knowledge applications?",Distributed proving networks with parallel computation,Hardware acceleration with specialized ZK circuits,Incremental verification with streaming proof generation,Proof caching with recursive composition optimization,C,No
305,Advanced,Which consensus mechanism properties enable Hedera Hashgraph to achieve deterministic finality without the possibility of forks?,Gossip protocol with virtual voting mechanisms,Asynchronous Byzantine Fault Tolerance with mathematical proofs,Timestamp consensus with fair ordering guarantees,Directed Acyclic Graph structure with causal ordering,"A, B, C",Yes
306,Advanced,"In Cardano's announced Layer 2 solutions targeting 1 million TPS, what scaling approach differs fundamentally from Ethereum's rollup-centric roadmap?",Hydra state channels with isomorphic state machines,Mithril light client protocols with stake-based signatures,Plutus smart contract optimization with parallel execution,Extended UTXO model with native multi-asset support,A,No
307,Advanced,What are the primary attack vectors that have led to over $2.1 billion in cross-chain bridge exploits during the first half of 2025?,Signature verification bypasses in multi-signature schemes,Oracle manipulation through flash loan attacks,Smart contract upgrade exploits circumventing timelocks,Consensus mechanism attacks on validator sets,"A, C",Yes
308,Advanced,"In AI agent blockchain integration, what technical infrastructure enables autonomous agents to execute complex DeFi strategies without human intervention?",Intent-based protocols with natural language processing,Account abstraction with programmable transaction logic,Oracle networks providing real-time market data feeds,Multi-signature schemes with AI-controlled key management,B,No
309,Advanced,"In modular blockchain architectures, what is the fundamental trade-off between data availability sampling efficiency and security guarantees that affects light client design?",Higher sampling rates increase security but reduce bandwidth efficiency,Larger block sizes improve throughput but compromise fraud proof generation,Erasure coding redundancy enhances availability but increases storage costs,Cryptographic commitment schemes provide verifiability but limit scalability,A,No
310,Advanced,Which technical factors contributed to the Force Bridge exploit resulting in $3.6 million losses in June 2025?,Insufficient validator signature verification in cross-chain message processing,Smart contract upgrade mechanism bypassing established timelock protections,Oracle price feed manipulation during high volatility periods,Multi-signature threshold reduction without proper governance approval,"A, B",Yes
311,Advanced,"In Avail's data availability layer, what cryptographic primitive enables efficient verification of data availability without downloading the entire block?",KZG polynomial commitments with random sampling,Merkle tree inclusion proofs with fraud detection,Reed-Solomon erasure coding with 2D extension,Cryptographic accumulators with batch verification,A,No
312,Advanced,What are the key innovations in Morpho V2's intent-based lending model launched in 2025?,"Fixed-rate, fixed-term loan matching without traditional order books",Automated liquidation mechanisms with MEV protection,Cross-chain collateral management with unified risk assessment,Dynamic interest rate optimization through machine learning algorithms,"A, B",Yes
313,Advanced,"In zkSNARK trusted setup ceremonies, what is the primary security risk that could compromise the entire proof system's soundness?",Toxic waste retention by ceremony participants,Insufficient randomness in parameter generation,Collusion between multiple trusted parties,Quantum computer attacks on elliptic curve cryptography,A,No
314,Advanced,Which architectural components enable NEAR Protocol to achieve 46 million monthly active users while maintaining decentralization?,Nightshade sharding with asynchronous cross-shard communication,Thresholded Proof of Stake with dynamic validator selection,Human-readable account names with progressive onboarding,WebAssembly runtime with gas-efficient smart contract execution,"A, C, D",Yes
315,Advanced,"In Ethereum's proposed EIP-7702 account abstraction upgrade, what fundamental change distinguishes it from ERC-4337's approach?",Native protocol integration without requiring separate EntryPoint contracts,Backward compatibility with existing Externally Owned Accounts,Reduced gas costs through optimized transaction processing,Enhanced security through cryptographic signature aggregation,A,No
316,Advanced,What are the primary systemic risks associated with the 800% growth in RWA tokenization by 2025?,Regulatory compliance failures leading to asset seizures,Oracle dependency creating single points of failure,Liquidity fragmentation across multiple tokenization platforms,Cross-border legal jurisdiction conflicts in asset recovery,"A, B, D",Yes
317,Advanced,"In Sui's parallel execution model, what mechanism prevents transaction conflicts when multiple operations target the same object simultaneously?",Object versioning with optimistic concurrency control,Dependency graph analysis with topological ordering,Ownership-based access control with exclusive locks,Consensus-level serialization with conflict resolution,C,No
318,Advanced,Which factors explain why Injective Protocol's daily active addresses increased 10X from January 2025?,EVM testnet launch enabling Ethereum developer migration,RWA tokenization capabilities attracting institutional users,Cross-chain interoperability with major DeFi protocols,AI-powered trading features and automated market making,"A, B",Yes
319,Advanced,"In liquid restaking protocols, what is the most critical risk factor that could trigger cascading liquidations across the DeFi ecosystem?",Validator slashing events causing LRT token depegging,Withdrawal queue congestion during market volatility,Recursive leverage strategies with amplified exposure,Cross-protocol correlation in slashing conditions,C,No
320,Advanced,What technical innovations enable CowSwap's MEV protection mechanisms to prevent sandwich attacks effectively?,Batch auction clearing with uniform settlement prices,Private mempool routing with encrypted order submission,Solver competition with cryptoeconomic incentive alignment,Time-weighted average pricing with slippage protection,"A, C",Yes
321,Advanced,"In Band Protocol V3's multichain oracle architecture, what mechanism ensures data integrity across different blockchain environments?",Cross-chain message verification with cryptographic proofs,Decentralized validator networks with stake-based security,Real-time data aggregation with outlier detection algorithms,Economic incentive alignment with slashing conditions,B,No
322,Advanced,Which architectural decisions in Fetch.ai's decentralized AI platform enable autonomous agents to interact with blockchain protocols?,Agent-based programming model with economic incentives,Machine learning integration with smart contract execution,Decentralized identity management with reputation systems,Cross-chain communication protocols with AI-readable interfaces,"A, C, D",Yes
323,Advanced,"In Rebar Shield's Bitcoin MEV protection system, what technical approach prevents transaction front-running in the mempool?",Direct routing to mining pools bypassing public mempool exposure,Encrypted transaction submission with delayed revelation,Batch processing with randomized transaction ordering,Proof-of-work based priority mechanisms with fee optimization,A,No
324,Advanced,What are the key technical challenges that limit the scalability of zero-knowledge proof generation in production systems?,Constraint system compilation requiring exponential time complexity,Memory-intensive witness generation for large computations,Cryptographic operations bottlenecked by single-threaded execution,Proof verification costs scaling linearly with computation size,"A, B",Yes
325,Advanced,"In Wormhole's Native Token Transfer integration with Algorand announced in July 2025, what security model ensures cross-chain message authenticity?",Guardian network consensus with threshold signatures,Light client verification with fraud proof challenges,Multi-signature validation with economic stake requirements,Cryptographic commitment schemes with time-locked deposits,A,No
326,Advanced,Which factors contribute to the complexity of implementing intent-based protocols in cross-chain environments?,Solver network coordination across different consensus mechanisms,Economic incentive alignment with varying gas fee structures,State synchronization challenges with asynchronous execution,Security model composition with heterogeneous trust assumptions,"A, B, D",Yes
327,Advanced,"In Aethir's 2025 mainnet upgrade, what infrastructure component enables decentralized GPU compute for AI workloads?",Distributed resource allocation with proof-of-useful-work consensus,Container orchestration with blockchain-based scheduling,Federated learning protocols with privacy-preserving computation,Edge computing networks with tokenized resource markets,D,No
328,Advanced,What are the primary security considerations for paymaster implementations in ERC-4337 account abstraction?,Gas price manipulation attacks through sponsored transaction flooding,Economic denial-of-service through resource exhaustion,Signature verification bypasses in batch transaction processing,Cross-contract reentrancy attacks during gas payment execution,"A, B, D",Yes
329,Advanced,"In Taiko's Ethereum rollup infrastructure partnership with Nethermind, what technical innovation addresses the rollup centralization problem?",Decentralized sequencer networks with rotation mechanisms,Multi-prover systems with cryptographic proof aggregation,Community-driven block production with economic incentives,Permissionless validator participation with stake-based selection,B,No
330,Advanced,Which technical factors enable Boundless's ZK proof marketplace to achieve efficient resource allocation?,Dynamic pricing mechanisms based on proof complexity and demand,Hardware specialization matching with computation requirements,Proof caching and reuse optimization for similar computations,Geographic distribution of proving resources for latency optimization,"A, B, C",Yes
331,Advanced,"In the context of AI agents executing DeFi strategies, what is the most significant technical barrier to achieving full autonomy?",Natural language processing limitations in understanding complex financial instruments,Real-time market data integration with blockchain state synchronization,Risk management algorithms adapting to novel market conditions,Regulatory compliance verification in automated decision-making,C,No
332,Advanced,What are the key innovations in Backed Finance's tokenized stock offerings on Solana DeFi protocols?,Real-time settlement with traditional financial market integration,Fractional ownership enabling micro-investment strategies,Cross-chain compatibility with Ethereum-based DeFi protocols,Regulatory compliance through licensed custodial arrangements,"B, D",Yes
333,Advanced,"In the evolution of Web3 infrastructure toward 2025, what fundamental architectural shift represents the greatest paradigm change from traditional blockchain designs?","Modular separation of consensus, execution, and data availability layers",Intent-based user interfaces abstracting underlying protocol complexity,AI-driven autonomous systems replacing human-mediated governance,Cross-chain interoperability becoming the default rather than exception,A,No
