105,Intermediate,What are the risks of KOLs promoting MEME projects?,Followers lose money following recommendations which damages personal credibility,Average MEME project performance affects content quality,MEME project performance exceeds expectations gaining follower attention,MEME project rug pulls leading to public opinion or even legal implications,A/D,Multiple Choice
106,Intermediate,"What are the risks of following smart money""?""",Smart money sells immediately after buying,Addresses that followed before you sell after you follow,Token price drops after smart money buys,Being identified by smart money addresses as a follower,A/B/C,Multiple Choice
107,Intermediate,Which aspects are suitable for evaluating a MEME project's potential?,Narrative scarcity,DEV background,Association with previously successful MEME projects,Early price chart,A/B/C,Multiple Choice
108,Intermediate,Analyze the impact of 'Community Signals' on investment decisions in MEME coin projects,Community member backgrounds are important reference indicators,Community participation and growth rates are important investment signals,Community buyback plans are important investment signals,Community sentiment is an important investment signal,A/C,Multiple Choice
109,Intermediate,Evaluate the adaptation strategies of MEME coin projects in different market cycles,MEME coin projects usually only survive in bull markets,Successful MEME coin projects focus on building and community maintenance during bear markets,No phenomenal MEME projects have emerged during bear markets,Successful MEME coin projects focus on marketing and price pumping during bull markets,B/C,Multiple Choice
110,Intermediate,Analyze the correlation between the MEME coin market and the secondary market and its impact on investment portfolio diversification,When the secondary market crashes during a bull market the MEME coin market usually shows more vitality,MEME coins typically have a relatively low correlation with the overall secondary market,When the secondary market rises MEME coins can provide a certain degree of excess returns for investment portfolios,MEME coins and secondary market investment portfolios can achieve perfect hedging under normal circumstances,A/B/C,Multiple Choice
111,Advanced,Analyze the philosophy of different types of MEME projects,The potential of AI+MEME projects is not very related to project technology popularity but to technical difficulty,The potential of event-based MEME projects is highly related to event scarcity,The potential of any MEME project is related to whether KOLs promote it,The core determinant of original MEME project potential is the strength and cohesion of the community,B/D,Multiple Choice
112,Advanced,Analyze the mechanisms of long-term value capture in MEME coin projects,Most MEME coins cannot capture long-term value,The long-term value of MEME coins mainly depends on community strength,Successful MEME token economic designs often include deflationary mechanisms NFT interoperability or governance incentives,By developing MEME token utility it's possible to establish long-term value,B/D,Multiple Choice
113,Advanced,"Evaluate the impact of information asymmetry"" in the MEME coin market""",Information asymmetry usually doesn't accelerate the death of MEME projects,Information asymmetry is usually a way for KOLs to consistently profit from MEME coins,Information asymmetry typically only appears in the early stages of MEME projects,Large MEME projects typically don't experience information asymmetry,A/B,Multiple Choice
114,Advanced,What are the reasons why celebrity MEME projects are currently not favored by investors?,TRUMP caused many early investors to suffer huge losses,LIBRA caused many early investors to suffer huge losses,Project teams cashed out and left in the short term removing market liquidity,Investors didn't have a fair opportunity to buy tokens early,B/C/D,Multiple Choice
115,Advanced,What consequences did Trump's release of a MEME coin on Solana cause?,Most early investors gained enormous profits,Investors made huge profits and then stopped investing for a while causing liquidity to dry up on the Solana chain,Triggered a wave of celebrity-issued coins,Made the MEME market more prosperous for a period afterward,A/B/C,Multiple Choice
116,Advanced,"Analyze behavioral finance"" phenomena in the MEME coin market and their impact on price formation""",The MEME coin market is not affected by behavioral biases such as herd behavior and overconfidence,Behavioral biases mainly affect novice investors with little impact on experienced traders,The MEME coin market commonly exhibits herd effects anchoring effects and disposition effects significantly affecting price volatility,Community governance education and information disclosure can mitigate behavioral biases to some extent,C/D,Multiple Choice
117,Advanced,"Evaluate the Lorenz curve analysis of token distribution"" in MEME coin projects and its indication of project health""",The Lorenz curve and Gini coefficient can measure the degree of token distribution inequality with more balanced distribution often indicating a healthier ecosystem,Higher concentration guarantees project safety,Token distribution concentration has no impact on project health,Introducing NFT airdrops or liquidity incentive mechanisms can improve token distribution concentration,A/D,Multiple Choice
118,Advanced,"Analyze the quantitative measurement methods of network effects"" in MEME coin projects and their impact on valuation""",Network effects have no role in MEME coin valuation,Metcalfe's Law or Reed's Law can be used to measure active addresses and transaction volume to evaluate network value,All MEME coins have the same network effects and don't need separate evaluation,Cross-chain bridges and NFT ecosystem expansion can also amplify network effects having a positive impact on valuation,B/D,Multiple Choice
119,Advanced,"Evaluate the contagion mechanisms of liquidity crises"" in the MEME coin market and their systemic risks""",Leverage liquidation liquidity pool depletion and cross-platform panic are potential contagion channels that may trigger systemic risks,Liquidity crises don't exist in the MEME coin market,Liquidity crises only affect individual projects and don't spread to other projects,Monitoring market sentiment and cross-chain capital flows helps reduce systemic risks,A/D,Multiple Choice
120,Advanced,"Analyze the Monte Carlo simulation method for token economic models"" in MEME coin projects and its application in risk assessment""",Risk assessment has little significance for MEME coin projects,Monte Carlo simulation can test different market assumptions user behaviors and token release scenarios to assess robustness,All MEME coin projects have the same results so simulation is unnecessary,More comprehensive risk analysis can be done by combining on-chain data and NFT transaction volume,B/D,Multiple Choice
121,Advanced,"Evaluate the influencing factors of token velocity"" in MEME coin projects and its role in price stability""",Higher velocity is always better leading to price increases,Token velocity is only useful in small MEME projects with no impact on large projects,Token velocity is influenced by holding incentives utility demand and market sentiment with lower velocity often associated with more stable prices,Cross-chain composability further complicates the impact of token velocity on price,C/D,Multiple Choice
122,Advanced,"Analyze the evaluation framework for token economic resilience"" in MEME coin projects""",Token economic resilience can be assessed through dimensions such as market shock recovery governance adaptability and incentive mechanism robustness,All MEME coins have the same economic resilience,Economic resilience is only related to token price volatility,The introduction of NFTs and social factors can enhance system resistance to market shocks,A/D,Multiple Choice
123,Advanced,"Evaluate social network analysis methods for tokenized communities"" in MEME coin projects and their indication of community health""",Community structure is unrelated to project success,Social network analysis can measure node centrality clustering coefficient and connectivity reflecting community health and anti-fragility,All MEME coin communities have the same network structure,Cross-platform social media and NFT sharing levels are also important indicators for assessing community stickiness,B/D,Multiple Choice
124,Advanced,"Analyze the long-term sustainability of liquidity mining"" strategies in the MEME coin market and their impact on token value""",Liquidity mining is unrelated to token value,"Inflationary pressure mercenary capital"" and unlimited issuance are common challenges requiring projects to provide incentives sufficient to support long-term value""",Liquidity mining is sustainable in all circumstances,Combining NFT staking or cross-chain liquidity solutions may enhance the innovation and value capture of the mining model,B/D,Multiple Choice
125,Advanced,"Evaluate the identification methods of token economic cycles"" in MEME coin projects and their guidance for investment strategies""",Economic cycles are unrelated to investment strategies,All MEME coins have the same economic cycles,Different stages can be identified through price trends community sentiment development progress and capital flows to formulate corresponding strategies,In NFT and cross-chain trends additional attention should be paid to the collaborative cycles of related ecosystems,C/D,Multiple Choice
126,Advanced,"Analyze the multi-factor model of token valuation"" in MEME coin projects and the limitations of its predictive ability""",MEME coins cannot be valued,Multi-factor models can integrate network value market sentiment and community indicators but are limited by data quality and market irrationality,All MEME coin valuation models can accurately predict prices,Introducing NFT transaction volume and cross-chain liquidity data can improve model comprehensiveness,B/D,Multiple Choice
127,Advanced,"Evaluate the evolutionary game analysis of token economic incentives"" in MEME coin projects""",Most MEME coins have the same incentive evolution,Evolutionary game theory can evaluate the spread and stability of strategies in the community,Long-term evolution has no impact on MEME coin projects,Incorporating cross-chain ecosystem or NFT elements makes incentive games more complex but may also bring new stable equilibria,B/D,Multiple Choice
128,Advanced,"Analyze the statistical characteristics of extreme events"" in the MEME coin market and their implications for risk management""","MEME coin return distributions often exhibit fat tail"" characteristics with high frequency of extreme events requiring adjustment of traditional risk control models""",There are no extreme events in the MEME coin market,Extreme events have no impact on MEME coin investment,During cross-chain or NFT booms there is a greater need to be alert to instantaneous crash risks,A/D,Multiple Choice
129,Advanced,"Evaluate the anti-fragility characteristics of token economic design"" in MEME coin projects and methods for building them""",All MEME coins have the same anti-fragility characteristics,Anti-fragile token economies include self-adaptive parameters multiple value sources and positive feedback loops,Cross-chain deployment or NFT integration can enhance a project's ability to respond to external shocks,Anti-fragility has no impact on MEME coin project success,B/C,Multiple Choice
130,Advanced,"Analyze the liquidity stratification"" phenomenon in the MEME coin market and its impact on market structure""",Liquidity stratification is unrelated to market structure,Uneven distribution of cross-chain DEXs and CEXs forms a multi-level liquidity structure affecting price discovery and arbitrage efficiency,Liquidity stratification doesn't exist in the MEME coin market,Multi-chain deployment and liquidity mining will exacerbate or mitigate stratification depending on specific design,B/D,Multiple Choice
131,Advanced,"Evaluate the dynamic system modeling method for token economic models"" in MEME coin projects and its prediction limitations""",All MEME coin projects have the same dynamic models,Dynamic system models can simulate supply and demand user behavior and market feedback but are affected by initial conditions and the unpredictability of human nature,Combining NFT and cross-chain data inputs can enhance the model's capture of complex scenarios,Dynamic system models can always accurately predict future performance of MEME coins,B/C,Multiple Choice
132,Advanced,"Analyze the dialectical relationship between collective wisdom and cognitive biases in community consensus formation"" of MEME coin projects""",Cognitive biases have no impact on MEME coin communities,Community decisions are always correct with no herd effects or information bias,If diverse information sources and decentralized discussion platforms are introduced the advantages of collective wisdom can be leveraged,Cognitive biases and group polarization phenomena coexist requiring effective governance and decision aggregation mechanisms,C/D,Multiple Choice
133,Advanced,"Evaluate the optimization model of liquidity provision strategies"" in the MEME coin market and its risk-return characteristics""",All MEME coins have the same liquidity provision strategies,Liquidity provision is always risk-free,Need to balance trading fee income impermanent loss and token incentives with different parameters in different volatility environments,Cross-chain liquidity pools or NFT LP shares also affect risk and return structure,C/D,Multiple Choice
134,Advanced,"Analyze the innovation models and systemic risks of token economic composability"" in MEME coin projects""",Composability always reduces risk,Token composability can be achieved through DeFi protocols cross-chain bridges and derivatives creating new use cases but also increasing complexity,All MEME coin projects have the same composability,The introduction of NFT and gamification elements can further increase composability but attention must be paid to chain reaction risks,B/D,Multiple Choice
135,Advanced,"Evaluate the changes and long-term impacts of tokenized incentives"" on open source collaboration models in MEME coin projects""",Tokenized incentives typically enhance the participation of external contributors but may also affect intrinsic motivation,Open source collaboration is unrelated to MEME coins,If incentive design is inappropriate it can easily lead to short-term speculation and community division,All MEME coins have exactly the same impact on open source,A/C,Multiple Choice
136,Advanced,"Analyze the operating mechanisms of narrative economics"" in the MEME coin market and their impact on price cycles""",MEME coins mainly rely on narrative spread with their lifecycle often going through introduction diffusion peak and decline,All MEME coin narratives are the same with no impact on price,NFT social media hype and KOL promotion amplify narrative heat accelerating price fluctuations,The marginal cost of narrative spread decreases as it spreads making the ceiling for MEME coins higher,A/C/D,Multiple Choice
137,Advanced,"Evaluate the interdisciplinary integration methods of token economic design"" in MEME coin projects and their innovation potential""",Only technical factors need to be considered without game theory or behavioral science,Integrating economics game theory network theory and cryptography can bring new incentives and value capture models,Interdisciplinary methods are usually not applicable to MEME coins,Combining NFT and social attributes can produce more innovation under community drive,B/D,Multiple Choice
138,Advanced,"Analyze the influencing factors of price discovery efficiency"" in the MEME coin market and its comparison with traditional markets""",Price discovery in the MEME coin market is highly efficient with no difference from traditional markets,Liquidity distribution information transparency and market segmentation affect price discovery efficiency,Compared to traditional markets MEME coins often react faster to new information but with greater volatility,Introducing cross-chain oracles and NFT transaction data can improve overall price discovery efficiency,B/C/D,Multiple Choice
139,Advanced,"Evaluate the system dynamics model of token economic sustainability"" in MEME coin projects and its long-term equilibrium conditions""",Most MEME coins can be sustainable long-term,Sustainability requires balancing token issuance demand drivers and value capture mechanisms establishing positive feedback loops,System dynamics is not applicable to MEME coins,During cross-chain and NFT integration excessive inflation or disorderly expansion should be prevented,B/D,Multiple Choice
140,Advanced,"Analyze the multi-layer delegation model of community governance"" in MEME coin projects and its trade-offs between decentralization and efficiency""",Multi-layer delegation governance always leads to power concentration,Multi-layer delegation can improve decision execution efficiency while maintaining a degree of decentralization,Representative responsibility and conflicts of interest are challenges faced by multi-layer delegation governance,Cross-chain or NFT voting mechanisms can make governance more flexible,B/C/D,Multiple Choice
141,Advanced,"Evaluate the quantitative measurement methods of liquidity risk"" in the MEME coin market and their application in investment portfolio management""",Bid-ask spread is an important indicator for measuring MEME coin liquidity risk,Market depth and price impact cost are key assessment elements,Liquidity risk doesn't exist in the MEME coin market,NFT and cross-chain capital flows don't affect overall liquidity risk,A/B,Multiple Choice
142,Advanced,"Analyze the stress testing methods and design principles for token economic resilience"" in MEME coin projects""",Effective stress testing should simulate extreme market scenarios,Need to assess system recovery capability when facing large-scale redemptions or attacks,Should consider simulations of governance attacks cross-chain bridge security and external shocks,Token economic resilience is only related to price,A/B/C,Multiple Choice
143,Advanced,"Evaluate the evolution path of tokenized communities"" in MEME coin projects and their challenges to traditional organizational forms""",Tokenized communities typically go through four stages: formation normalization turbulence and steady state,All communities have the same evolution path,Tokenized communities challenge traditional hierarchical structures and value distribution models,Tokenization has no impact on organizational forms,A/C,Multiple Choice
144,Advanced,"Analyze the behavioral economics model of investor behavior"" in the MEME coin market and its explanation for market anomalies""",Prospect theory can explain changes in risk preferences in the MEME coin market,Limited attention models can explain market information processing biases,Social influence models can explain group herding behaviors,Investor behavior has no impact on MEME coin prices,A/B/C,Multiple Choice
145,Advanced,"Evaluate the incentive compatibility analysis of token economic mechanism design"" in MEME coin projects""",All MEME coin projects naturally have incentive compatibility,Incentive-compatible design can prevent strategic manipulation and external negative effects,Ensuring individual rational behavior aligns with overall goals is the key to effective mechanism design,Incentive compatibility has no impact on MEME coin success,B/C,Multiple Choice
146,Advanced,"Analyze the game equilibrium of liquidity provider behavior"" in the MEME coin market and its impact on market stability""",Strategic interactions between liquidity providers form multiple equilibria,Liquidity providers directly affect market depth and price stability,All liquidity providers have the same strategy,The timing of entering and exiting liquidity pools affects market efficiency and volatility,A/B/D,Multiple Choice
147,Advanced,"Evaluate the cross-cycle adaptability and anti-fragility building methods of token economic design"" in MEME coin projects""",Market cycles have no impact on MEME coins,Multiple value sources can enhance project stability,Counter-cyclical incentive mechanisms can maintain functionality in bull and bear markets,Automated parameter adjustments allow systems to benefit from volatility,B/C/D,Multiple Choice
148,Advanced,"Analyze the tail dependency of extreme risk"" in the MEME coin market and its implications for investment portfolio risk management""",Correlation between MEME coins increases during extreme market conditions,Traditional diversification strategies have limited effect during systemic shocks,Correlation between MEME coins is the same in all market environments,Extreme risk has no impact on MEME coin investment,A/B,Multiple Choice
149,Advanced,"Evaluate the evolution path of token economic innovation"" in MEME coin projects and its potential impact on the future financial system""",MEME coin economic innovations include novel value capture mechanisms,Community drive and group culture are the core drivers of economic innovation,Cross-chain integration and NFT-ization may reshape future financial participation modes and value definition,The same types of MEME coins all adopt the same economic innovations,A/B/C,Multiple Choice 
150,Advanced,"In the context of Pump.fun's bonding curve mechanism, which mathematical properties are essential for preventing arbitrage exploitation during the price discovery phase?",Monotonic increasing price function with continuous derivatives,Convex utility functions with bounded second derivatives,Lipschitz continuity with logarithmic price elasticity,Non-decreasing marginal cost curves with finite integral bounds,"A, D",Yes
151,Advanced,"According to recent academic research on meme coin ecosystems, which factors contribute most significantly to the emergence of pump-and-dump schemes?",Asymmetric information distribution among early adopters,Lack of intrinsic value backing and speculative hype dependency,Centralized exchange facilitation of market distortions,Regulatory arbitrage opportunities in cross-jurisdictional trading,"A, B, C, D",Yes
152,Advanced,"In AI agent-driven meme coins like Mind of Pepe, which technical architecture components are critical for autonomous decision-making?",Multi-layer perceptron networks with reinforcement learning,Graph neural networks for social sentiment analysis,Transformer-based language models for meme interpretation,Federated learning protocols for decentralized training,"B, C",Yes
153,Advanced,Which cryptographic primitives are most suitable for implementing verifiable fair launch mechanisms in meme coin deployments?,Verifiable Random Functions (VRFs) with threshold signatures,Zero-knowledge proofs for private allocation verification,Commit-reveal schemes with time-locked commitments,Multi-party computation for distributed key generation,"A, C",Yes
154,Advanced,"In the analysis of viral meme coin propagation networks, which graph-theoretic measures best predict cascade amplification?",Betweenness centrality of influencer nodes,Clustering coefficient of community subgraphs,Eigenvector centrality weighted by engagement metrics,PageRank scores adjusted for temporal decay,"A, C",Yes
155,Advanced,Which tokenomic mechanisms can effectively mitigate the 'rug pull' risk in newly launched meme coins?,Time-locked liquidity with gradual vesting schedules,Multi-signature treasury management with community oversight,Automated market maker integration with permanent liquidity locks,Decentralized autonomous organization governance from launch,"A, B, C",Yes
156,Advanced,"In cross-chain meme coin bridge architectures, which security vulnerabilities pose the greatest systemic risks?",Oracle manipulation attacks on price feeds,Validator collusion in multi-signature schemes,Smart contract reentrancy in bridge protocols,Consensus finality discrepancies between chains,"B, D",Yes
157,Advanced,Which machine learning techniques are most effective for detecting coordinated inauthentic behavior in meme coin promotion campaigns?,Anomaly detection using isolation forests on engagement patterns,Natural language processing for sentiment manipulation identification,Graph convolutional networks for bot detection in social networks,Time series analysis for synchronized trading pattern recognition,"A, C, D",Yes
158,Advanced,"In the context of meme coin liquidity provision, which automated market maker invariants provide optimal capital efficiency?",Constant product formula (x * y = k) with dynamic fees,Constant sum formula (x + y = k) with bounded price ranges,Concentrated liquidity with custom price curves,Hybrid invariants combining multiple mathematical functions,"C, D",Yes
159,Advanced,Which consensus mechanisms are most suitable for meme coin networks requiring high throughput and low transaction costs?,Delegated Proof of Stake with Byzantine Fault Tolerance,Practical Byzantine Fault Tolerance with instant finality,Proof of History combined with Proof of Stake,Directed Acyclic Graph consensus with parallel processing,"A, C",Yes
160,Advanced,"In meme coin tokenomics design, which burn mechanisms provide the most sustainable deflationary pressure?",Transaction fee burns proportional to network usage,Periodic burns based on treasury accumulation,Algorithmic burns triggered by price volatility thresholds,Community-voted burns with governance token requirements,"A, C",Yes
