161,Advanced,Which privacy-preserving techniques can be implemented in meme coin transactions without compromising regulatory compliance?,Zero-knowledge proofs with selective disclosure,Ring signatures with auditable anonymity sets,Homomorphic encryption for confidential amounts,Stealth addresses with view key mechanisms,"A, C",Yes
162,Advanced,"In the study of meme coin market microstructure, which factors most significantly impact price discovery efficiency?",Order book depth and bid-ask spread dynamics,Market maker inventory management strategies,Information asymmetry between retail and institutional traders,Cross-exchange arbitrage opportunities and latency,"A, C, D",Yes
163,Advanced,Which game-theoretic models best explain the coordination dynamics in meme coin community formation?,Evolutionary stable strategies with mutation rates,Nash equilibria in repeated prisoner's dilemma games,Coordination games with multiple equilibria and focal points,Auction theory with common value uncertainty,"C, D",Yes
164,Advanced,"In AI-powered meme coin trading systems, which reinforcement learning algorithms are most effective for volatile market conditions?",Deep Q-Networks with experience replay and target networks,Policy gradient methods with advantage actor-critic,Multi-agent reinforcement learning with competitive dynamics,Hierarchical reinforcement learning with temporal abstractions,"B, C",Yes
165,Advanced,Which cryptoeconomic incentive structures can align meme coin developer interests with long-term community value creation?,Vesting schedules tied to network adoption metrics,Performance-based token allocations with milestone requirements,Quadratic funding mechanisms for public goods development,Retroactive public goods funding with community evaluation,"A, B, D",Yes
166,Advanced,"In meme coin governance systems, which voting mechanisms prevent plutocracy while maintaining efficiency?",Quadratic voting with identity verification requirements,Conviction voting with time-weighted preferences,Futarchy with prediction market-based decisions,Liquid democracy with delegated voting chains,"A, B",Yes
167,Advanced,Which technical approaches can enable interoperability between meme coins across different blockchain ecosystems?,Atomic swaps with hash time-locked contracts,Cross-chain communication protocols with message passing,Wrapped token standards with collateral backing,Relay chain architectures with shared security models,"B, D",Yes
168,Advanced,"In the analysis of meme coin network effects, which mathematical models best capture viral adoption patterns?",SIR epidemiological models with recovery rates,Bass diffusion models with innovation and imitation parameters,Preferential attachment models with fitness landscapes,Threshold models with heterogeneous adoption thresholds,"B, D",Yes
169,Advanced,Which oracle design patterns provide the most reliable external data feeds for meme coin price discovery mechanisms?,Decentralized oracle networks with cryptoeconomic security,Time-weighted average price oracles with manipulation resistance,Commit-reveal oracle schemes with stake-based penalties,Multi-source aggregation with outlier detection algorithms,"A, B, D",Yes
170,Advanced,"In meme coin smart contract architecture, which design patterns provide optimal gas efficiency for high-frequency trading?",Proxy patterns with upgradeable logic contracts,Factory patterns with minimal proxy deployments,Diamond patterns with modular facet architecture,Singleton patterns with state compression techniques,"B, D",Yes
171,Advanced,Which behavioral economics principles most accurately explain meme coin investment decision-making patterns?,Prospect theory with loss aversion and probability weighting,Herding behavior with social proof and conformity bias,Anchoring effects with reference point dependency,Hyperbolic discounting with present bias preferences,"A, B, C",Yes
172,Advanced,"In cross-chain meme coin protocols, which consensus finality mechanisms ensure atomic transaction execution?",Probabilistic finality with confirmation depth requirements,Deterministic finality with immediate irreversibility,Economic finality with slashing conditions,Social finality with community consensus validation,"B, C",Yes
173,Advanced,Which machine learning architectures are most effective for predicting meme coin price movements based on social sentiment?,Transformer models with attention mechanisms for text analysis,Convolutional neural networks for image meme classification,Recurrent neural networks with LSTM for temporal dependencies,Graph neural networks for social network influence modeling,"A, D",Yes
174,Advanced,"In meme coin liquidity mining protocols, which reward distribution mechanisms optimize long-term capital retention?",Linear vesting with cliff periods and gradual unlocks,Exponential decay functions with early withdrawal penalties,Performance-based multipliers tied to protocol metrics,Loyalty bonuses with compounding reward structures,"A, C, D",Yes
175,Advanced,Which cryptographic commitment schemes provide optimal security for meme coin fair launch auctions?,Pedersen commitments with discrete logarithm assumptions,Hash-based commitments with collision resistance properties,Polynomial commitments with homomorphic properties,Vector commitments with position binding guarantees,"A, B",Yes
176,Advanced,"In meme coin ecosystem analysis, which network topology metrics best predict community resilience to external shocks?",Network diameter and average path length,Modularity and community detection coefficients,Robustness measures under targeted node removal,Small-world properties with clustering and randomness,"B, C",Yes
177,Advanced,Which formal verification techniques can ensure correctness of meme coin smart contract implementations?,Model checking with temporal logic specifications,Theorem proving with interactive proof assistants,Symbolic execution with constraint solving,Abstract interpretation with static analysis,"A, B, C",Yes
178,Advanced,"In AI agent meme coin systems, which multi-agent coordination protocols prevent adversarial manipulation?",Byzantine agreement protocols with authenticated channels,Consensus algorithms with verifiable random beacons,Reputation systems with stake-weighted voting,Mechanism design with incentive compatibility,"A, D",Yes
179,Advanced,Which economic models best explain the relationship between meme coin utility and speculative value?,Quantity theory of money with velocity considerations,Asset pricing models with fundamental and speculative components,Network effects models with Metcalfe's law variations,Bubble theory with rational and irrational investor behavior,"B, C",Yes
180,Advanced,"In meme coin cross-chain bridge security, which zero-knowledge proof systems provide optimal verification efficiency?",zk-SNARKs with trusted setup ceremonies,zk-STARKs with transparent setup requirements,Bulletproofs with range proof optimizations,PLONK with universal trusted setup,"B, D",Yes
181,Advanced,Which algorithmic trading strategies are most effective in meme coin markets with extreme volatility?,Mean reversion strategies with dynamic threshold adjustment,Momentum strategies with trend-following indicators,Market making strategies with inventory risk management,Arbitrage strategies with latency optimization,"A, C",Yes
182,Advanced,"In meme coin governance token design, which voting power distribution mechanisms prevent centralization risks?",Square root voting with diminishing marginal influence,Time-locked voting with commitment requirements,Delegation caps with maximum voting power limits,Participation rewards with active voter incentives,"A, C",Yes
183,Advanced,Which consensus mechanisms provide optimal security-scalability tradeoffs for meme coin payment networks?,Sharded consensus with cross-shard communication,Layer 2 solutions with optimistic rollups,State channels with dispute resolution mechanisms,Plasma chains with fraud proof systems,"B, C",Yes
184,Advanced,"In meme coin market manipulation detection, which statistical techniques provide the highest accuracy?",Benford's law analysis for transaction amount distributions,Granger causality tests for price-volume relationships,Regime switching models for volatility clustering,Hawkes processes for self-exciting trading patterns,"B, D",Yes
185,Advanced,Which cryptoeconomic mechanisms can incentivize honest behavior in decentralized meme coin oracles?,Staking with slashing conditions for false reporting,Prediction markets with skin-in-the-game requirements,Reputation systems with historical accuracy weighting,Commit-reveal schemes with deposit forfeiture penalties,"A, B, C",Yes
186,Advanced,"In meme coin automated market maker design, which impermanent loss mitigation strategies are most effective?",Dynamic fee adjustment based on volatility metrics,Concentrated liquidity with active range management,Impermanent loss insurance with premium calculations,Multi-asset pools with correlation-based rebalancing,"A, C",Yes
187,Advanced,Which privacy-preserving audit techniques can verify meme coin treasury management without revealing sensitive information?,Zero-knowledge proofs of solvency with range proofs,Homomorphic encryption for confidential balance verification,Secure multi-party computation for distributed auditing,Commitment schemes with selective disclosure protocols,"A, C",Yes
188,Advanced,"In meme coin social token economics, which coordination mechanisms optimize community value creation?",Quadratic funding with matching pool allocations,Retroactive public goods funding with impact assessment,Prediction markets for community decision-making,Bonding curves for continuous token issuance,"A, B",Yes
189,Advanced,Which machine learning techniques can detect sophisticated wash trading patterns in meme coin markets?,Anomaly detection with isolation forests and local outlier factors,Graph neural networks for transaction flow analysis,Time series clustering for behavioral pattern recognition,Adversarial training for robust feature extraction,"B, C",Yes
190,Advanced,"In cross-chain meme coin interoperability, which bridge architecture patterns provide optimal security guarantees?",Optimistic bridges with fraud proof mechanisms,Pessimistic bridges with full verification requirements,Hybrid bridges with selective verification strategies,Native bridges with shared validator sets,"B, D",Yes
191,Advanced,Which game-theoretic equilibrium concepts best model meme coin mining pool dynamics?,Nash equilibria with complete information assumptions,Bayesian equilibria with incomplete information,Evolutionary stable strategies with population dynamics,Correlated equilibria with communication protocols,"B, C",Yes
192,Advanced,"In meme coin flash loan attack prevention, which smart contract design patterns provide the strongest protection?",Reentrancy guards with state locking mechanisms,Time delays with multi-block transaction requirements,Oracle price validation with multiple data sources,Circuit breakers with emergency pause functionality,"A, C, D",Yes
193,Advanced,Which consensus finality mechanisms ensure atomic execution in meme coin cross-chain transactions?,Probabilistic finality with exponential confirmation confidence,Economic finality with stake-weighted security guarantees,Instant finality with immediate irreversibility properties,Practical finality with bounded reorganization depth,"B, C",Yes
194,Advanced,"In AI-driven meme coin sentiment analysis, which natural language processing techniques provide the most accurate market predictions?",Transformer models with fine-tuned financial domain adaptation,Sentiment lexicons with context-aware polarity scoring,Topic modeling with latent Dirichlet allocation,Named entity recognition with cryptocurrency-specific training,"A, D",Yes
195,Advanced,Which cryptographic primitives enable efficient verification of meme coin supply audits without revealing individual balances?,Merkle trees with zero-knowledge inclusion proofs,Accumulator schemes with membership witnesses,Polynomial commitments with batch verification,Range proofs with logarithmic proof sizes,"A, D",Yes
196,Advanced,"In meme coin decentralized exchange design, which automated market maker invariants optimize for both capital efficiency and price stability?",Constant product with dynamic fee adjustment,Constant mean with weighted asset ratios,Hybrid invariants with piecewise linear functions,Concentrated liquidity with custom price curves,"C, D",Yes
197,Advanced,Which formal methods can verify the correctness of meme coin governance protocol implementations?,Temporal logic model checking with CTL specifications,Process algebra with bisimulation equivalence,Hoare logic with pre- and post-condition verification,Abstract interpretation with invariant discovery,"A, C",Yes
198,Advanced,"In meme coin network security analysis, which attack vectors pose the greatest threats to consensus integrity?",Long-range attacks with historical key compromise,Nothing-at-stake attacks in proof-of-stake systems,Eclipse attacks with network partition strategies,Grinding attacks with predictable randomness exploitation,"A, C",Yes
199,Advanced,Which economic incentive alignment mechanisms can ensure sustainable development of meme coin ecosystems beyond speculative trading?,Retroactive public goods funding with quadratic matching,Continuous token issuance tied to utility metrics,Developer incentive programs with milestone-based rewards,Community treasury management with democratic allocation,"A, C, D",Yes
200,Advanced,Which technical mechanism is primarily responsible for preventing rug pulls in Pump.fun's meme coin launch system?,Multi-signature wallet requirements,Bonding curve automated market making,Time-locked liquidity pools,Decentralized oracle price feeds,B,No
201,Advanced,Select all blockchain networks where BRETT (Pepe's best friend) has achieved significant market presence as a flagship meme coin.,Base (Coinbase L2),Arbitrum,Polygon,Fantom,A,No
202,Advanced,"What is the primary consensus mechanism that enables Solana's high-throughput meme coin ecosystem, particularly for platforms like Pump.fun?",Proof of Work (PoW),Proof of Stake (PoS),Proof of History (PoH),Delegated Proof of Stake (DPoS),C,No
203,Advanced,Which AI meme coins are considered leaders in the 2025 market cycle? Select all that apply.,FARTCOIN,TURBO,GOAT,ArbDoge AI (AIDOGE),"A, B, C, D",Yes
204,Advanced,What is the maximum staking APY offered by certain meme coins in 2025 according to recent market data?,96%,156%,196%,256%,C,No
205,Advanced,Which deflationary mechanisms are commonly implemented in advanced meme coin tokenomics? Select all that apply.,Transaction fee burning,Utility-based token burns,Periodic supply reductions,Staking reward dilution,"A, B, C",Yes
206,Advanced,What is the approximate market capitalization that the meme coin ecosystem reached in 2024?,$40 billion,$50 billion,$60 billion,$70 billion,C,No
207,Advanced,Which Avalanche-based meme coins are considered top performers in 2025? Select all that apply.,Kimbo,Coq Inu,Osaka Protocol,AvaxMinerAI,"A, B, C, D",Yes
208,Advanced,What is the native token symbol for Sonic Labs (formerly Fantom) that enables meme coin transactions?,FTM,SONIC,S,SLB,C,No
209,Advanced,Which features distinguish TOSHI as the flagship meme coin on Base chain? Select all that apply.,Direct Coinbase integration potential,Zero-gas transaction capability,Cross-chain bridge functionality,Anticipation for major CEX listings,"A, D",Yes
210,Advanced,What is the primary technical innovation behind ArbDoge AI (AIDOGE) on the Arbitrum network?,Deflationary AI-powered tokenomics,Cross-chain liquidity aggregation,Automated yield farming,NFT-backed collateralization,A,No
211,Advanced,Which platforms are specifically designed for trading Avalanche meme coins? Select all that apply.,Arena app,MEVX,DeBridge Finance,Trader Joe,"A, B",Yes
212,Advanced,What is the maximum token supply cap for Ponke (PONKE) on Solana?,555 million tokens,777 million tokens,999 million tokens,1 billion tokens,A,No
213,Advanced,Which technical features are implemented in Little Pepe's Layer 2 chain? Select all that apply.,Zero-tax transactions,EVM compatibility,Sniper bot protection,Built-in staking mechanisms,"A, B, C",Yes
214,Advanced,What is the primary revenue model being considered for Pump.fun's PUMP token holders?,Transaction fee redistribution,Revenue-sharing mechanism,Governance voting rewards,Liquidity mining incentives,B,No
215,Advanced,Which meme coins have successfully integrated gaming features into their ecosystems? Select all that apply.,Snaky Way,Gamer Pepe (GPEPE),BONK,CrocCoin,"A, B",Yes
216,Advanced,What is the target valuation that Pump.fun is aiming for in its token launch?,$2 billion,$3 billion,$4 billion,$5 billion,C,No
217,Advanced,Which blockchain networks support Four.meme's bonding curve launchpad? Select all that apply.,BNB Chain,Ethereum,Polygon,Arbitrum,A,No
218,Advanced,What is the primary mechanism that prevents liquidity rug pulls in bonding curve-based meme coin launches?,Time-locked smart contracts,Automated liquidity provision through price curves,Multi-signature wallet requirements,Decentralized governance voting,B,No
219,Advanced,Which features distinguish VADER token on Fantom as an agent token? Select all that apply.,Product-market fit in agent commerce,Consistent price action,Real usage metrics,Cross-chain interoperability,"A, B, C",Yes
220,Advanced,What is the maximum number of UpTop tokens per wallet during Four.meme's fair launch mechanism?,500 tokens,750 tokens,"1,000 tokens","1,500 tokens",C,No
221,Advanced,Which technical innovations are implemented in Neo Pepe Coin's governance system? Select all that apply.,Structured tokenomics,Strategic token launch mechanisms,Cultural relevance algorithms,Utility-focused governance,"A, B, D",Yes
222,Advanced,What is the primary blockchain network where GOGGLES (GOGLZ) operates with its 'future is bright' theme?,Ethereum,Fantom,Solana,Base,B,No
223,Advanced,Which meme coins have achieved integration with NFT ecosystems? Select all that apply.,Neo Pepe Coin,Little Pepe,Shiba Inu (SHIB),CrocCoin,"A, C",Yes
224,Advanced,What is the primary technical advantage of Sonic Labs' blockchain for meme coin transactions?,"10,000 TPS with sub-second finality",Zero-knowledge proof integration,Cross-chain atomic swaps,Quantum-resistant cryptography,A,No
225,Advanced,Which DeFi mechanisms are integrated into CrocCoin's ecosystem? Select all that apply.,Progressive decentralization,Multiple deflationary mechanisms,Liquidity mining rewards,Automated yield optimization,"A, B",Yes
226,Advanced,What is the primary exchange where Pump.fun's PUMP token is launching?,Binance,Gate.io,KuCoin,OKX,B,No
227,Advanced,Which technical features enable Snaky Way's cross-blockchain functionality? Select all that apply.,AI-powered trading bots,Multi-chain bridge protocols,Gaming feature integration,Automated arbitrage mechanisms,"A, C",Yes
228,Advanced,What percentage of PUMP token supply is allocated to the initial token sale?,10%,15%,20%,25%,B,No
229,Advanced,Which Layer 2 solutions have emerged as primary platforms for meme coin innovation? Select all that apply.,Base (Coinbase L2),Arbitrum,Optimism,Polygon zkEVM,"A, B",Yes
230,Advanced,What is the primary mechanism behind DEGEN's 20% weekly performance on Base network?,Automated buyback programs,Community-driven momentum,Yield farming incentives,Cross-chain arbitrage opportunities,B,No
231,Advanced,Which technical innovations distinguish Credbull (CBL) on Arbitrum? Select all that apply.,Community engagement algorithms,Steady liquidity mechanisms,Modest popularity metrics,Dual-token economic model,"A, B",Yes
232,Advanced,What is the primary trading application specifically designed for Avalanche meme coin discovery and trading?,Arena,MEVX,Pangolin,Trader Joe,A,No
233,Advanced,Which meme coins have implemented emoji-based naming conventions? Select all that apply.,Snek,GOGGLES (GOGLZ),Dogwifhat,Pepe (PEPE),"A, C",Yes
234,Advanced,What is the primary unlock mechanism for Pump.fun token sale participants?,Gradual vesting over 12 months,100% unlock at launch,Cliff vesting with 6-month lock,Performance-based unlocking,B,No
235,Advanced,Which blockchain networks support MemeX's MRC20 token standard? Select all that apply.,Bitcoin Layer 2,Ethereum,Solana,Base,A,No
236,Advanced,What is the primary technical mechanism that enables instant liquidity in bonding curve systems?,Automated market making algorithms,Pre-funded liquidity pools,Cross-chain bridge protocols,Oracle-based price discovery,A,No
237,Advanced,Which AI integration features are present in Future Pepe (FPEPE)? Select all that apply.,Machine learning price prediction,Automated trading algorithms,AI-powered community management,Smart contract optimization,"A, B",Yes
238,Advanced,What is the primary consensus mechanism upgrade that Sonic Labs implemented compared to original Fantom?,Proof of Stake to Proof of History,Enhanced Byzantine Fault Tolerance,Delegated Proof of Stake optimization,Zero-knowledge proof integration,B,No
239,Advanced,Which meme coins have achieved successful integration with traditional finance through tokenized stocks? Select all that apply.,Arbitrum-based meme tokens,Base-native meme coins,Polygon meme projects,Solana meme tokens,A,No
240,Advanced,What is the primary technical innovation behind L Bu MEME Coin's bonding curve economics?,No presale or insider allocations,Viral narrative integration,Community-driven tokenomics,Historical character licensing,A,No
241,Advanced,Which platforms enable commission-free trading of tokenized stocks on Arbitrum? Select all that apply.,Robinhood partnership,24/7 trading capability,200+ US stock tokens,ETF token integration,"A, B, C, D",Yes
242,Advanced,What is the primary technical advantage of EVM compatibility in Little Pepe's Layer 2 implementation?,Seamless Ethereum dApp integration,Lower gas fees than mainnet,Enhanced security protocols,Cross-chain interoperability,A,No
243,Advanced,Which deflationary mechanisms are specifically implemented in Shiba Inu's ecosystem? Select all that apply.,SHIB burn mechanism,Shibarium transaction fees,Metaverse utility burns,Staking reward reductions,"A, B, C",Yes
244,Advanced,What is the primary technical mechanism that enables SunPump.meme's token launches on TRON?,TRC-20 standard implementation,Bonding curve economics,Delegated Proof of Stake consensus,Smart contract automation,B,No
245,Advanced,Which technical features enable Arctic Pablo Coin's structured weekly presale mechanism? Select all that apply.,Time-locked smart contracts,Automated price discovery,Progressive token release,Community governance integration,"A, C",Yes
246,Advanced,What is the primary blockchain network where Snorter Token (SNORT) combines meme virality with utility?,Ethereum,Polygon,Base,Arbitrum,A,No
247,Advanced,Which AI-powered features distinguish SKYAI as a meme-AI crossover token? Select all that apply.,8.6% daily performance metrics,Machine learning integration,Automated trading capabilities,Predictive analytics algorithms,"A, B",Yes
248,Advanced,What is the primary technical innovation behind Popcat's tokenomics structure?,Supply elasticity mechanisms,Utility-driven value accrual,Distribution optimization,Governance incentive alignment,B,No
249,Advanced,Which emerging trends are reshaping the meme coin landscape in 2025? Select all that apply.,Trust replacing hype in token markets,Integration with traditional finance,AI-powered tokenomics optimization,Cross-chain interoperability standards,"A, B, C, D",Yes
250,Advanced,Which Layer 2 blockchain solution specifically designed for meme culture raised over $4.5 million in its presale during 2025?,Little Pepe (LILPEPE),Arctic Pablo Coin,Non-Playable Coin (NPC),Future Pepe,A,No
251,Advanced,Select all characteristics that accurately describe Non-Playable Coin (NPC) as of July 2025.,"Combines sarcasm, pixels, and passive-aggressive comedy",Built on Solana blockchain,Focuses on digital satire in Web3,Uses ERC-404 token standard,"A, C",Yes
252,Advanced,"As of June 2025, which Layer 2 solution surpassed Arbitrum One in Total Value Locked (TVL)?",Optimism,Base,Polygon zkEVM,zkSync Era,B,No
253,Advanced,What is the approximate TVL that Base achieved when it surpassed Arbitrum One in June 2025?,$3.94 billion,$4.03 billion,$4.94 billion,$5.94 billion,C,No
254,Advanced,Which meme coin project is specifically described as 'fully satirical' and 'ditches utility in favor of pure internet culture'?,PEPE,TOKEN6900,Gigachad,Book of Meme (BOME),B,No
255,Advanced,Select all DePIN projects that were specifically highlighted in the 2025 DePIN Report as leading projects to watch.,Bittensor (TAO),Filecoin (FIL),Helium (HNT),Render Network (RNDR),"A, B",Yes
256,Advanced,What percentage increase in data transfer did the Helium Network achieve quarter-over-quarter in Q1 2025?,118.6%,128.6%,138.6%,148.6%,C,No
257,Advanced,Which major telecommunications company partnered with Helium Network in 2025 to offload cellular traffic?,Verizon,T-Mobile,AT&T,Sprint,C,No
258,Advanced,What is the total amount of data transferred by the Helium Network by the end of Q1 2025?,"1,040.9 TB","1,140.9 TB","1,240.9 TB","1,340.9 TB",B,No
259,Advanced,Select all features that characterize the DN-404 token standard as implemented by projects like Mitosis.,Evolution of ERC-404 standard,Combines ERC-20 and ERC-721 features,Enables fractional NFT ownership,Requires Layer 2 deployment only,"A, B",Yes
260,Advanced,Which blockchain network experienced daily transactions topping 1 million amid an ERC-404 minting frenzy in 2025?,Ethereum,Polygon,Avalanche,BNB Chain,C,No
261,Advanced,What percentage surge in Bitcoin NFT sales has been recorded since the Ordinals protocol launch?,74%,84%,94%,104%,B,No
