262,Advanced,What is the total value of Bitcoin NFT sales since the Ordinals protocol launch?,$4.5 billion,$5.5 billion,$6.5 billion,$7.5 billion,B,No
263,Advanced,Select all projects that are considered top Bitcoin Ordinals by 24-hour volume as of July 2025.,NodeMonkes,Runestone,Ordinal Maxi Biz,Bitcoin Punks,"A, B",Yes
264,Advanced,Which zkEVM project faced potential deprecation in 2026 due to substantial challenges and annual losses?,zkSync Era,Polygon zkEVM,Scroll,Linea,B,No
265,Advanced,What innovative economic model does the Status Layer 2 on Linea implement?,Proof-of-Stake consensus,Gasless transactions with community yield allocation,Cross-chain bridge fees,NFT-based governance,B,No
266,Advanced,Select all characteristics of Book of Meme (BOME) that distinguish it from other meme coins.,Focuses on decentralized storage of internet culture,Archives meme culture on-chain,Built on Solana blockchain,Uses AI for meme generation,"A, B",Yes
267,Advanced,What was Dogecoin's market capitalization as reported in mid-2025?,Over $25 billion,Over $27 billion,Over $29 billion,Over $31 billion,B,No
268,Advanced,"Which global event in 2025 covered 13 cities with 700+ attendees and 18,000+ votes for meme-related awards?",Crypto Twitter Day,MemeDay 2025,Web3 Meme Summit,DeFi Meme Conference,B,No
269,Advanced,Select all factors that contributed to the Meme-Fi token surge in July 2025.,"Bitcoin stabilizing above $107,000",Increased institutional adoption,AI meme generation integration,Cross-chain bridge developments,"A, C",Yes
270,Advanced,Which project is specifically designed as a Bitcoin Layer 2 solution to enhance Bitcoin capabilities with faster and more affordable transactions?,Lightning Network,Bitcoin Hyper ($HYPER),Stacks (STX),Rootstock (RSK),B,No
271,Advanced,What is the projected market size for Web3 gaming by 2032 according to 2025 reports?,$104 billion,$114 billion,$124 billion,$134 billion,C,No
272,Advanced,What is the projected compound annual growth rate (CAGR) for NFT-based games from 2025 to 2032?,18.40%,19.40%,20.40%,21.40%,C,No
273,Advanced,Select all meme coins that were specifically mentioned as top performers in Token Metrics research with outsized returns in 2025.,Gorbagana,FARTCOIN,POPCAT,FLOKI,A,No
274,Advanced,Which Ethereum-based meme coin launched with a whitelist-only model in 2025 and is designed for cryptocurrency dominance?,MoonBull,EarthMeta,SkyToken,StarCoin,A,No
275,Advanced,Which project introduced the DN-404 token standard through its Morse NFT initiative in 2025?,Ethereum Foundation,Mitosis,Polygon Labs,Arbitrum Foundation,B,No
276,Advanced,Select all features that distinguish the Status Layer 2 on Linea from conventional rollups.,Gasless transactions for users,100% community yield allocation mechanism,Replaces sequencer fees with native yield,Uses proof-of-work consensus,"A, B, C",Yes
277,Advanced,What is the current market capitalization ranking of Dogecoin as reported in mid-2025?,Top 5,Top 10,Top 15,Top 20,B,No
278,Advanced,"Which DePIN project is specifically noted for its decentralized, blockchain-based AI network capabilities?",Filecoin (FIL),Helium (HNT),Bittensor (TAO),Render Network (RNDR),C,No
279,Advanced,Select all meme coins that were specifically mentioned in the top market capitalization rankings for May 2025.,Dogecoin (DOGE),Shiba Inu (SHIB),PEPE,OFFICIAL TRUMP (TRUMP),"A, B, C, D",Yes
280,Advanced,What is the projected compound annual growth rate (CAGR) for the Web3 gaming market from 2025 to 2032?,18.40%,19.40%,20.40%,21.40%,C,No
281,Advanced,Which zkEVM project announced potential deprecation in 2026 due to annual losses exceeding $1 million?,zkSync Era,Polygon zkEVM,Scroll,Linea,B,No
282,Advanced,Select all characteristics that accurately describe Filecoin's ecosystem developments in 2025.,Launched new ecosystem metrics roundup program,Expanding DeFi utility and cross-chain data storage,Significant activity in AI and IoT integrations,Migrated to proof-of-stake consensus,"A, B, C",Yes
283,Advanced,What was the total number of cities covered by MemeDay 2025 global event?,11 cities,13 cities,15 cities,17 cities,B,No
284,Advanced,How many votes were cast for the MEME69 Awards during MemeDay 2025?,"16,000+","17,000+","18,000+","19,000+",C,No
285,Advanced,Select all Bitcoin Ordinals collections that are mentioned as leading projects by trading volume.,Uncategorized Ordinals,NodeMonkes,Runestone,Bitcoin Puppets,"A, B, C, D",Yes
286,Advanced,"What is the trading sales volume of NodeMonkes, one of the leading Bitcoin NFT collections?",$299 million,$319 million,$339 million,$359 million,B,No
287,Advanced,Which meme coin project is described as integrating 'playful meme culture with decentralized finance (DeFi)'?,Catslap,Gigachad,Arctic Pablo Coin,Future Pepe,A,No
288,Advanced,Select all factors that contributed to zkEVM rollups gaining ground fast in 2025.,Upgrades in prover efficiency,Improved EVM compatibility,Reduced gas fees,Enhanced security protocols,"A, B",Yes
289,Advanced,What is the total number of Ordinal inscriptions that have been minted on the Bitcoin blockchain network as of 2025?,Nearly 80 million,Nearly 90 million,Nearly 100 million,Nearly 110 million,C,No
290,Advanced,Which blockchain network ranks third-largest by NFT sales volume according to 2025 data?,Polygon,Bitcoin,Avalanche,BNB Chain,B,No
291,Advanced,Select all rollup frameworks that are mentioned as providing mature tooling for modular L2s in 2025.,Optimism's OP Stack,zkSync's ZK Stack,Arbitrum's Nitro Stack,Polygon's CDK,"A, B",Yes
292,Advanced,What percentage of DePIN projects tracked on Solana have an active open-source presence on GitHub as of June 2025?,Approximately 25%,Approximately 35%,Approximately 45%,Approximately 55%,B,No
293,Advanced,Which project is specifically mentioned as pushing the boundaries of decentralized internet by bridging real-world hardware with decentralized protocols?,Helium,Andrena,Filecoin,Render Network,B,No
294,Advanced,Select all characteristics that define the evolution from airdrops to loyalty programs in Web3 user incentives during 2025.,Shift from one-time rewards to ongoing engagement,Focus on community building over user acquisition,Integration with DeFi yield farming,Emphasis on long-term value creation,"A, B, D",Yes
295,Advanced,What is the total value locked (TVL) in Real World Assets (RWA) on the Arbitrum network as reported in July 2025?,Over $250 million,Over $300 million,Over $350 million,Over $400 million,B,No
296,Advanced,"Which major blockchain event in 2025 was described as breaking records with global Web3 leaders, AI agents, and RWA innovation?",Ethereum DevCon,Istanbul Blockchain Week 2025,Consensus 2025,Web3 Summit Berlin,B,No
297,Advanced,Select all meme-fi presale projects that were highlighted as top performers in July 2025.,FloppyPepe (FPPE),Mind of Pepe,BitPepe,MemeMachine,"A, B, C, D",Yes
298,Advanced,"What is the approximate number of weekly transactions that Arbitrum processed in June 2025, doubling its previous record?",12 million,14 million,16 million,18 million,B,No
299,Advanced,Select all factors that position Bitcoin as the third-largest blockchain network by NFT sales volume in 2025.,Introduction of Ordinals protocol in December 2022,Ability to inscribe data directly onto the blockchain,Nearly 100 million Ordinal inscriptions minted,Over $5.5 billion in trading sales volume,"A, B, C, D",Yes
300,Advanced,Which technical mechanism does Pump.fun primarily use to ensure instant liquidity and prevent rug pulls in newly launched meme tokens?,Automated Market Maker (AMM) pools with locked liquidity,Bonding curve algorithms with built-in price discovery,Multi-signature escrow contracts with time-locked releases,Centralized order book matching with collateral requirements,B,No
301,Advanced,Select all blockchain networks that have emerged as significant alternatives to Solana for meme coin launches in 2025.,Sui blockchain using Move programming language,Base network as Coinbase's Layer 2 solution,Blast network with built-in ETH staking yields,"Monad blockchain with 10,000 TPS parallel execution","A, B, C, D",Yes
302,Advanced,What was the peak market capitalization reached by the TRUMP meme coin within 48 hours of its controversial launch in January 2025?,$5.2 billion,$8.5 billion,$11 billion,$15 billion,C,No
303,Advanced,Which governance mechanism distinguishes MetaDAO's token launchpad from traditional meme coin platforms like Pump.fun?,Proof-of-stake consensus voting,Futarchy-based prediction market governance,Multi-signature validator consensus,Delegated proof-of-stake governance,B,No
304,Advanced,Identify all characteristics that define the MRC-20 token standard used by MemeX platform.,Built-in bonding curve mechanics for price discovery,Social launchpad integration with community governance,On-chain tracking of meme token metrics and performance,Cross-chain compatibility with Ethereum Virtual Machine,"A, B, C",Yes
305,Advanced,What was the primary cause of the LIBRA token's catastrophic price collapse from $5.20 to $0.0014?,Smart contract vulnerability exploitation,Coordinated rug pull by token creators withdrawing liquidity,Regulatory intervention by Argentine authorities,Market manipulation by whale investors,B,No
306,Advanced,Which AI-powered meme coins have gained significant traction in the 2025 market cycle?,FARTCOIN with viral meme generation engine,ai16z ($AI16Z) as virtual VC firm with AI agent,TURBO with community-driven AI development,GOAT with autonomous agent economy integration,"A, B, C, D",Yes
307,Advanced,"What percentage market share did LetsBONK.fun achieve on Solana blockchain, surpassing Pump.fun in 2025?",45.7%,51.3%,55.2%,62.8%,C,No
308,Advanced,Select all technical advantages that make Solana the preferred blockchain for meme coin launches in 2025.,Local fee markets preventing fee contagion during high-volume launches,Parallel transaction processing enabling high throughput,Sub-penny transaction costs even during network congestion,Built-in MEV protection for fair token distribution,"A, B, C",Yes
309,Advanced,What was the median transaction fee on Solana during the TRUMP meme coin launch despite massive network activity?,$0.001247 USD,$0.003178 USD,$0.005892 USD,$0.008456 USD,B,No
310,Advanced,"Which meme coin on the Base network has emerged as the flagship token, often referred to as 'Pepe's best friend'?",TOSHI,BRETT,BASED,COINBASE,B,No
311,Advanced,Identify all components of the Blast network's unique value proposition for meme coin projects.,Built-in ETH staking rewards for token holders,Automatic T-Bill yield generation for stablecoin deposits,Gas revenue sharing with dApp developers,Native cross-chain bridge to Ethereum mainnet,"A, B, C",Yes
312,Advanced,"What programming language does the Sui blockchain use, distinguishing it from EVM-compatible chains?",Rust,Move,Solidity,Cairo,B,No
313,Advanced,Which leaked architectural elements suggest Pump.fun may be developing its own blockchain infrastructure?,Orderbook architecture terminology in development documents,Approval mechanisms similar to Ethereum-based chains,Custom consensus algorithm specifications,Native token economics for platform governance,"A, B",Yes
314,Advanced,What was the approximate number of new meme coins launched in January 2025 alone across all platforms?,15 million,25 million,37 million,48 million,C,No
315,Advanced,Select all mechanisms that MemeFi protocols use to bridge meme coins with decentralized finance.,Yield farming opportunities with meme token rewards,PvP gaming integration with token-based wagering,Staking mechanisms with deflationary token burns,Lending protocols accepting meme coins as collateral,"A, B, C",Yes
316,Advanced,What was Pump.fun's peak daily revenue during the height of the meme coin frenzy in January 2025?,$5.2 million,$7.0 million,$9.8 million,$12.5 million,B,No
317,Advanced,Which economic mechanism does BONK's ecosystem use to create shared value for participants?,Proof-of-burn consensus with validator rewards,Buy-and-burn deflationary token mechanics,Liquidity mining with time-locked rewards,Staking derivatives with yield compounding,B,No
318,Advanced,Identify all factors that contributed to Little Pepe (LILPEPE) raising over $4.5 million in its presale.,Custom Layer 2 blockchain designed specifically for meme tokens,EVM-compatible infrastructure with low transaction fees,Community-driven tokenomics allocating 26.5% to presale participants,Integration with existing DeFi protocols for yield generation,"A, B, C",Yes
319,Advanced,What was the valuation assigned to Pump.fun by Messari analysts in their 2025 assessment?,$4 billion,$7 billion,$10 billion,$15 billion,B,No
320,Advanced,"Which consensus mechanism does Monad blockchain employ to achieve 10,000 TPS throughput?",Delegated Proof-of-Stake with sharding,Parallel execution with EVM compatibility,Proof-of-History with parallel processing,Byzantine Fault Tolerance with pipelining,B,No
321,Advanced,Select all characteristics that define the 'gMONAD' cultural movement within the Monad ecosystem.,Community-driven meme creation and viral marketing,Global participation in blockchain development initiatives,Creative expression through digital art and NFT collections,Governance participation through prediction market mechanisms,"A, B, C",Yes
322,Advanced,What strategic acquisition did Monad Foundation complete to enhance its stablecoin infrastructure?,Circle's USDC integration platform,Portal stablecoin infrastructure project,Tether's USDT minting technology,MakerDAO's DAI stability mechanisms,B,No
323,Advanced,Which Arbitrum-based meme token has gained attention for its community-driven engagement model?,ArbDoge AI (AIDOGE),Credbull (CBL),ArbiNyan (NYAN),ArbShiba (ASHIB),B,No
324,Advanced,Identify all technical innovations that Virtuals Protocol brings to the AI agent meme coin ecosystem.,Complete AI agent economy with autonomous trading capabilities,Cross-platform AI agent deployment and management,Decentralized AI model training with token incentives,AI-powered meme generation and viral content creation,"A, B, C",Yes
325,Advanced,What percentage of Little Pepe's total token supply is allocated to presale participants according to its tokenomics?,22.5%,26.5%,31.2%,35.8%,B,No
326,Advanced,Which platform features have made Four.meme the leading memecoin launchpad on BNB Chain?,Built-in bonding curve market mechanisms,Fair launch countdown system with internal trading,Maximum token allocation limits per participant,Cross-chain bridge integration with Ethereum,"A, B, C",Yes
327,Advanced,What was the primary catalyst behind the KEKIUS MAXIMUS token's explosive price movement in January 2025?,Elon Musk's social media profile rebranding to 'Kekius Maximus',Tesla's announcement of meme coin payment integration,SpaceX's partnership with crypto payment processors,Twitter's implementation of crypto tipping features,A,No
328,Advanced,Select all factors that contributed to the BROCCOLI token reaching $280 million market capitalization.,CZ's social media tease about revealing his dog's name and photo,Binance's strategic promotion of BNB Smart Chain ecosystem,PancakeSwap's featured listing and liquidity incentives,Community-driven viral marketing campaign across social platforms,"A, D",Yes
329,Advanced,What architectural advantage does Sui blockchain's object-centric model provide for meme coin applications?,Parallel transaction processing without global state conflicts,Built-in NFT functionality for meme asset creation,Automatic smart contract optimization for gas efficiency,Native cross-chain communication protocols,A,No
330,Advanced,Which meme coin on Sui blockchain has gained attention for its nostalgic virtual pet theme?,SuiDoge (SUIDOGE),Pou On Sui (POU),SuiShiba (SUISHIB),SuiPepe (SUIPEPE),B,No
331,Advanced,Identify all mechanisms that prevent fee contagion on Solana during high-volume meme coin launches.,Local fee markets isolating transaction costs by application,Priority fee auctions with dynamic pricing algorithms,Parallel processing preventing network-wide congestion,Validator rotation ensuring distributed transaction processing,"A, C",Yes
332,Advanced,What was the total value of USDT transactions processed natively on Aptos blockchain by 2025?,$20 billion,$30 billion,$45 billion,$60 billion,B,No
333,Advanced,Which technical features distinguish ArbDoge AI (AIDOGE) from other AI-themed meme coins?,Deflationary tokenomics with automatic burn mechanisms,Native deployment on Arbitrum's Layer 2 infrastructure,AI-powered trading algorithm integration,Cross-chain bridge compatibility with multiple networks,"A, B",Yes
334,Advanced,What was the approximate value of APT tokens scheduled for unlock in July 2025?,$35 million,$50 million,$75 million,$100 million,B,No
335,Advanced,Select all innovations that Mind of Pepe brings to the AI agent crypto movement.,Advanced natural language processing for meme generation,Autonomous trading strategies based on market sentiment analysis,Community governance through AI-assisted decision making,Cross-platform social media engagement automation,"A, B, C",Yes
336,Advanced,What percentage of tokens that fulfilled the bonding curve and 'graduated' on Pump.fun were among the top trending tokens when X suspended memecoin accounts?,35%,48%,52%,67%,B,No
337,Advanced,Which blockchain partnership enabled 24/7 commission-free tokenized stock trading for European users?,Polygon and Robinhood integration,Arbitrum and Robinhood collaboration,Optimism and Interactive Brokers partnership,Base and Coinbase Advanced Trade integration,B,No
338,Advanced,Identify all characteristics of the PVPfun MemeFi platform's gaming integration.,Player-versus-player gaming with meme coin wagering,Tournament structures with token-based prize pools,Cross-ecosystem protocol compatibility for multiple meme coins,NFT integration for unique gaming asset ownership,"A, B, C",Yes
339,Advanced,What was the peak all-time high price reached by the MELANIA token on its launch day?,$6.25,$8.50,$11.75,$15.20,B,No
340,Advanced,Which technical standard does MemeX platform use for its social launchpad meme tokens?,ERC-20 with custom extensions,MRC-20 protocol powered by MemeCore,SPL token standard on Solana,BEP-20 with enhanced functionality,B,No
341,Advanced,Select all factors that contributed to Optimism's first Futarchy contest attracting significant participation.,430 verified real forecasters after bot filtering,"5,898 total trades executed with OP-PLAY tokens","Elimination of 4,122 bot accounts from participation",Integration with existing DeFi yield farming protocols,"A, B, C",Yes
342,Advanced,What was the primary reason behind X (formerly Twitter) suspending dozens of memecoin accounts in 2025?,Violation of financial promotion regulations,Coordinated inauthentic behavior and spam,Copyright infringement of meme content,Promotion of unregistered securities,B,No
343,Advanced,Which architectural elements make Blast network's yield generation unique among Layer 2 solutions?,Built-in ETH staking with automatic reward distribution,T-Bill yield integration for stablecoin deposits,Gas revenue sharing with decentralized application developers,Cross-chain yield farming with multiple asset support,"A, B, C",Yes
344,Advanced,What was the total market value of Solana memecoins that surged past a significant milestone in June 2025?,$8.7 billion,$11.8 billion,$15.2 billion,$18.9 billion,B,No
345,Advanced,Select all technical innovations that distinguish Snaky Way ($AKE) from traditional meme coins.,AI-powered buyback mechanisms with automated execution,Multichain deployment across multiple blockchain networks,Play-to-earn gaming integration with token rewards,Deflationary tokenomics with strategic burn schedules,"A, B, C",Yes
346,Advanced,What percentage of circulating supply will Aptos unlock in its July 2025 token release event?,1.25%,1.75%,2.15%,2.85%,B,No
347,Advanced,Which consensus and execution model enables Monad to achieve EVM compatibility while maintaining high throughput?,Optimistic rollup with fraud proof mechanisms,Parallel execution with EVM bytecode compatibility,Sharded architecture with cross-shard communication,Zero-knowledge proof validation with state compression,B,No
348,Advanced,Identify all mechanisms that Four.meme uses to ensure fair token distribution on BNB Chain.,"Maximum allocation limits of 1,000 tokens per participant",Countdown-based launch system with internal trading periods,Bonding curve market mechanisms for price discovery,Anti-bot measures with human verification requirements,"A, B, C",Yes
349,Advanced,What was the primary technical factor that enabled Pump.fun to handle viral-scale meme coin launches on Solana?,Solana's fast finality and low transaction fees,Custom smart contract optimization for token creation,Parallel execution preventing network congestion,Integrated MEV protection for fair token distribution,A,No
