No,classification,Question,Option A,Option B,Option C,Option D,Correct option,Multiple Choice or Not
1,Basic,In Web3, what are MEME coins primarily NOT based on?,Internet memes,News events,Celebrities,Web3 projects,D,No
2,Basic,Which of the following blockchains is one of the most active platforms for MEME coins?,Bitcoin,Solana,Ethereum,Tron,B,No
3,Basic,Which is NOT a core reason for Solana becoming a popular platform for MEME coins?,Large user base,High TVL (Total Value Locked),Low transaction fees and fast settlement,Foundation engagement,B,No
4,Basic,"What is pump.fun""?""",A decentralized exchange for MEME coins,A no-code creation platform for MEME coins,A technical creation platform for MEME coins,An AMM for MEME coins,B,No
5,Basic,Who is one of the core founders of Dogecoin?,Vitalik Buterin,Billy Markus,Charles Hoskinson,Jackson Palmar,B,No
6,Basic,Which of the following is NOT an animal-themed MEME coin?,FLOKI,SHIB,PEPE,BOME,D,No
7,Basic,Which of the following is NOT a common trading platform for MEME coins?,Pancake,Raydium,Uniswap,Meteora,D,No
8,Basic,"What is a Decentralized Exchange"" (DEX)?""",An exchange without operators,A peer-to-peer trading platform without intermediaries,A platform that only trades MEME coins,An exchange that only accepts Web3 stablecoins,B,No
9,Basic,Which Launchpad has played an important role in the development of MEME coins?,Raydium,Jupiter,Pumpfun,Orca,C,No
10,Basic,What primarily determines the value of MEME coins?,Technological innovation,Community support,Market demand,Project profitability,C,No
11,Basic,Which of the following is NOT a common marketing strategy for MEME coins?,Social media promotion,KOL endorsements,Community building,DEX advertising,C,No
12,Basic,"What does the term whale"" mean in the MEME coin community?""",A new type of MEME coin,An individual or entity that holds a large amount of a specific cryptocurrency,A trading strategy,An individual or entity with a large amount of crypto assets in their wallet,D,No
13,Basic,Which internet culture is closely related to the popularity of MEME coins?,Internet prank culture,Internet marketing culture,Meme and social media culture,Traditional news media culture,C,No
14,Basic,Which of the following is NOT a common motivation for creating MEME coins?,Building community,Speculative profit,Satirizing existing cryptocurrencies,Spreading popular internet memes,C,No
15,Basic,"What does Airdrop"" mean in the context of MEME coins?""",A marketing strategy to increase coin price,A marketing strategy to distribute tokens to users for free,A marketing strategy to randomly distribute tokens to Web3 users,A marketing strategy to distribute tokens to users for a fee,B,No
16,Basic,Which of the following is a characteristic of Shiba Inu (SHIB)?,It is a MEME coin,"It is known as the Dogecoin killer""",It is based on the Ethereum blockchain,Both B and C,D,No
17,Basic,Which of the following is NOT a common marketing channel for MEME coins?,Twitter/X,Telegram,Dexscreener,Youtube,D,No
18,Basic,Which of the following is NOT a common trading pair for MEME coins?,MEME/BNB,MEME/BTC,MEME/ETH,MEME/SOL,B,No
19,Basic,Which MEME coin's market cap never exceeded $4 billion in 2024?,PEPE,SHIB,BOME,WIF,C,No
20,Basic,"What does the term Initial Liquidity"" mean for MEME coins?""",The amount of tokens for presale,The first available token supply on DEX,The funding raised through ICO,Initial listing price of the token,B,No
21,Basic,"What does Liquidity Locked"" mean in the context of MEME coins?""",The MEME coin cannot be traded temporarily,The project team cannot remove liquidity from the pool,Trading volume is restricted,Tokens cannot be transferred between wallets,B,No
22,Basic,"What does Lock Period"" refer to in token liquidity?""",The duration a token cannot be traded,The duration the liquidity cannot be withdrawn by the team,The time required to complete a transaction,The duration a wallet is inactive,B,No
23,Basic,"What is Token Utility""?""",The token's price in USD,The token's price in ETH,The practical functions and use cases of a token,The token's trading volume,C,No
24,Basic,Which of the following is NOT typically a utility for MEME tokens?,Governance voting in DAOs,Transaction fees within an ecosystem,Complex DeFi functions,Access to exclusive community content,C,No
25,Basic,"What is the importance of Community"" for MEME coins?""",Communities are optional for MEME coin success,Communities help maintain token liquidity,Communities are mainly for establishing regulatory compliance,Communities determine the legal status of the token,B,No
26,Basic,What is the typical token distribution model for a MEME coin project?,20% team, 80% public,No team allocation, 100% public trading,50% team, 50% public,Varies widely with no standard model,D,No
27,Basic,Which aspect of MEME coin projects usually operates with the LEAST transparency?,Team members and background,Liquidity and trading data,Marketing campaigns,Project roadmap and updates,C,No
28,Basic,"What is Review Mining"" in the context of meme coins?""",Generating cryptocurrency through social media reviews,Creating fake positive reviews to boost project reputation,A consensus mechanism used by MEME coins,A method to verify transactions on the blockchain,B,No
29,Basic,"What is Social Media Presence"" important for in MEME coin projects?""",It is required for legal compliance,It increases traditional media coverage,It helps with community building and engagement,It guarantees token listing on major exchanges,C,No
30,Basic,"What is Token Burning""?""",A method to destroy tokens permanently reducing total supply,A way to stake tokens for rewards,The process of converting tokens to fiat currency,The transfer of tokens to cold storage,A,No
31,Basic,"What is a Rug Pull""?""",A project where the team slowly increases token value,A strategy to drive long-term adoption,A scam where developers abandon the project after withdrawing all funds,A method to generate higher transaction fees,C,No
32,Basic,What is the most common blockchain for launching MEME coins?,Bitcoin,Solana,Ethereum,Cardano,C,No
33,Basic,Which is typically NOT required when launching a MEME coin?,Smart contract deployment,White paper,Liquidity provision,KYC verification,D,No
34,Basic,"What does DYOR"" stand for in cryptocurrency communities?""",Document Your Official Returns,Deliver Your Own Resources,Design Your Own Roadmap,Do Your Own Research,D,No
35,Basic,"What is a Meme Coin Season""?""",A period when meme coins typically perform well,The launch period for new meme coins,A quarterly report on meme coin performance,A regulated trading period for meme coins,A,No
36,Basic,"What does SAFU"" mean in cryptocurrency communities?""",Secure Asset Fund for Users,Safe And Friendly Usage,System Authentication For Users,Security Assurance Follow-Up,A,No
37,Basic,"What is a Pump and Dump"" scheme?""",A long-term investment strategy,A legitimate marketing campaign,A price manipulation scheme where a group artificially inflates the price before selling,A liquidity optimization technique,C,No
38,Basic,"What is a Fair Launch"" in meme coins?""",A launch where all participants have equal access to tokens,A launch with KYC requirements,A launch with high initial liquidity,A launch with developer pre-allocation,A,No
39,Basic,Which of the following factors directly affect the liquidity of MEME coins?,Trading volume,Market depth,Market popularity of the token,Number of trading pairs,A/B/D,Multiple Choice
40,Basic,Which of the following correctly describes 'Market Makers'?,Individuals who create new MEME coins,Individuals or entities that facilitate trading by providing liquidity,Traders who profit from the spread between buy and sell prices,Analysis teams that predict market trends,B/C,Multiple Choice
41,Basic,Which analysis methods are commonly used by MEME coin investors?,Technical chart analysis,Community analysis,DEV background analysis,Secondary market sentiment analysis,A/B/C,Multiple Choice
42,Basic,Which of the following terms in cryptocurrency communities relate to investor psychological states?,FOMO,HODL,DUMP,PUMP,A/B,Multiple Choice
43,Basic,Which of the following are common market sentiment terms in cryptocurrency communities?,FUD,FOMO,BUILD,Bullish,A/B/D,Multiple Choice
44,Basic,Which of the following terms describe investor token holding behavior in cryptocurrency communities?,Paper hands,Diamond hands,Whale,NGMI,B/D,Multiple Choice
45,Basic,Which of the following terms describe the trading behavior characteristics of cryptocurrency investors?,Paper Hands,Diamond Hands,Buy low and sell high,Left/Right side trading,A/B/D,Multiple Choice
46,Basic,Which communication platforms are commonly used by MEME coin communities?,Reddit,Telegram,Twitter/X,Discord,B/C/D,Multiple Choice
47,Basic,What is the difference between MEME projects with a CTO and those without?,In the former, the DEV has sold tokens, while in the latter they haven't,The former relies on the community, and the latter also relies on the community,For the latter, the project ceiling is usually higher,The former MEME projects are more difficult to succeed,A/B,Multiple Choice
48,Basic,What roles does a CTO Leader generally assume in MEME projects?,Raising funds from the community,Increasing community cohesion,Formulating future project roadmaps,Creating MEME-themed graphics,A/B/C,Multiple Choice
49,Basic,What are the general purposes of funds in a Market Wallet?,Used for future project marketing,Used for technical development,Used to reward community members,Used for collaborations with other projects,A/D,Multiple Choice
50,Basic,What are common risks associated with MEME coins?,High volatility,Low liquidity,Regulatory uncertainty,Technical complexity,A/B/C,Multiple Choice
51,Basic,Which of the following descriptions about Token Vesting are correct?,A mechanism to stabilize token price,A mechanism to prevent large quantities of tokens from entering the market simultaneously,A gradual token release plan,A token burning plan,B/C,Multiple Choice
52,Basic,Why do MEME project teams implement token vesting plans?,To prevent team members from selling large amounts of tokens at once,To demonstrate long-term commitment to investors,To showcase the token's potential,To prevent investors from selling large amounts at once,A/B,Multiple Choice
53,Basic,Which of the following descriptions about 'Token Utility' are correct?,Actual uses of the token in the project ecosystem,Privileges or benefits that token holders receive,Token price stability,Exclusive identity that token holders receive,A/B,Multiple Choice
54,Basic,What are common utilities of MEME coins?,Legal currency alternative,Governance rights,Payment method,Community membership identity,B/C/D,Multiple Choice
55,Basic,Which of the following descriptions about 'Token Governance' are correct?,The community's management of token mechanisms,A system to influence project development direction through voting,A voting mechanism to control token price,A mechanism for token holders to participate in project decisions,B/D,Multiple Choice
56,Basic,Which of the following descriptions about the governance models of MEME coin projects are correct?,Most adopt hybrid models or have no formal governance,Community members usually have some voice,Completely decentralized,In all MEME projects, DEVs are the main governors,A/B,Multiple Choice
57,Basic,Which of the following are common trading tools in the MEME market?,Bullx,Photon,Gmgn,TG Trading BOT,A/B/C/D,Multiple Choice
58,Basic,What are common sales methods for MEME coins?,Public sales,Presales,Airdrops,OTC sales,A/B/D,Multiple Choice
59,Basic,Which of the following descriptions about 'Token Distribution' are correct?,The way tokens are distributed among different holders,The initial token distribution plan for the project,The token burning plan,The future token unlock plan,A/B,Multiple Choice
60,Basic,What token distribution characteristics do healthy MEME coin projects typically have?,Relatively dispersed distribution with no single entity controlling most of the supply,Some team-held tokens have lock-up periods,The founding team holds the vast majority of tokens,All tokens are distributed through airdrops,A/B,Multiple Choice
61,Basic,Which of the following descriptions about 'Token Unlock' are correct?,The process of releasing tokens from a locked state into circulation,The process of breaking token security mechanisms,Usually done according to a predetermined schedule,The process of removing creative restrictions on tokens,A/C,Multiple Choice
62,Basic,What effects can large-scale token unlock events have on the MEME coin market?,They typically cause price drops before the unlock,They increase market circulation,They cause token price drops after the unlock,They always lead to increased trading volume,A/B,Multiple Choice
63,Basic,Which of the following descriptions about 'Proof of Burn' are correct?,Transaction records proving tokens have been permanently removed from circulation,Can be used to reduce the total token supply,Proof that token liquidity has been locked,Proof that tokens have been transferred to a cold wallet,A/B,Multiple Choice
64,Basic,What roles do comprehensive MEME trading tools play in the market?,Buying and selling tokens,Sending tokens,Viewing token transaction records,Monitoring other wallets,A/C/D,Multiple Choice
65,Basic,Which of the following descriptions about 'Token Economic Incentives' are correct?,Token reward mechanisms that encourage specific behaviors,Promoting ecosystem development through token rewards,Usually implemented through activities,Generally leads to a thriving token ecosystem and price increases,A/B/C,Multiple Choice
66,Basic,What important factors are used to evaluate the potential of MEME coin projects?,Community size and activity,Team background and transparency,Token utility and innovation,Whether the DEV has sold tokens,A/B/C,Multiple Choice
67,Basic,What features do good MEME trading tools have?,Support for second-level charts,Support for second-level purchases,Wallet custody function,Rich and diverse features,A/B,Multiple Choice
68,Basic,What are the main value propositions of MEME coins?,Sense of community belonging,Speculative potential,Cultural expression,Becoming a new payment method,A/B/C,Multiple Choice
69,Intermediate,In the MEME market what does CTO stand for?,Community Take Over,Community Technology Officer,Chief Technology Officer,Community Take Off,A,No
70,Intermediate,In the MEME market what does MW stand for?,Market Wallet,Master of Wallet,Making Wave,Making Wallets,A,No
71,Intermediate,In the MEME market what does DEV refer to?,Token creator,Community leader,MEME project team,Technical developer,A,No
72,Intermediate,Evaluate the typical performance pattern of MEME coins in cryptocurrency market cycles,MEME coins perform worst during bear markets,MEME coins perform best during periods of high market sentiment,MEME coin performance is unrelated to market cycles,MEME coins perform best during market transitions,B,No
73,Intermediate,"Evaluate the role of roadmaps"" in MEME coin projects and how they differ from other crypto projects""",MEME coin projects typically don't have roadmaps,MEME coin project roadmaps are usually more detailed and technical,MEME coin project roadmaps are usually briefer sometimes even humorous or satirical,There is little difference between MEME coin project roadmaps and traditional crypto project roadmaps,C,No
74,Intermediate,"Analyze the pros and cons of the anonymous team"" phenomenon in MEME coin projects""",Anonymous teams are always harmful to MEME coin projects,Anonymous teams increase the potential for price appreciation,Anonymous teams may increase creativity and community participation,Whether a team is anonymous has a decisive impact on MEME coin projects,C,No
75,Intermediate,What is the Bonding Curve mechanism?,A mechanism that defines the relationship between price and supply,A mechanism that defines the relationship between price and supply-demand,A mechanism that defines the relationship between value and supply,A mechanism that defines the relationship between value and supply-demand,A,No
76,Intermediate,"Analyze the application of Inscription"" technology in MEME coin projects""",Inscription technology makes it difficult for MEME project teams to obtain large amounts of tokens,Inscription technology is mainly used for creating MEME coins on SOL,Inscription technology is mainly used for creating MEME coins on ETH,Inscription technology is the mainstream method for creating MEME coins in 2024-2025,A,No
77,Intermediate,Evaluate the differences between MEME coin ecosystems on different blockchains,MEME coin ecosystems on all blockchains have little difference,ETH MEME coins have fewer users but projects are more likely to reach high market caps,SOL MEME coins have more users and projects are more likely to reach high market caps,MEME project characteristics are related to the investor profile on different blockchains,B,No
78,Intermediate,Evaluate the effectiveness of different marketing strategies in MEME coin projects,Community participation in charitable activities can increase the influence of MEME coins,Collaboration with KOLs will definitely make the market bullish on MEME coins,Community building is the most effective marketing strategy for MEME coins,Advertising on Dexscreener has a significant positive effect on large-cap MEME coins,A,No
79,Intermediate,Analyze the common reasons for MEME coin project failures,Lack of DEV background is the most common reason for MEME coin project failure,Lack of community cohesion is the most common reason for MEME coin project failure,DEV SELL is the main reason for MEME coin failure,Market competition is the main reason for MEME coin project failure,B,No
80,Intermediate,Evaluate the development differences of MEME coins in different regional regulatory environments,Regions with more relaxed regulations favor the development of MEME projects,MEME coins are subject to the same regulations in most regions,More strictly regulated regions pose greater challenges to the development of MEME coins,MEME coins exist on blockchain networks so regulatory policies have little impact on their development,D,No
81,Intermediate,"What is smart money"" in the MEME market?""",Wallet addresses that trade with high odds and high win rates,Wallet addresses with high profit amounts,Wallet addresses with extensive experience,Wallet addresses with high win rates,A,No
82,Intermediate,"Analyze the implementation methods and effects of token burning"" mechanisms in MEME coin projects""",Token burning is typically achieved by sending tokens to dead addresses,Token burning is the physical destruction of tokens,Token burning typically has little impact on the potential of MEME coins,Token burning is just a marketing strategy with no significant effect,C,No
83,Intermediate,"Evaluate the effectiveness of liquidity mining"" strategies in MEME coin projects""",Liquidity mining is a common marketing strategy for MEME projects,Liquidity mining can attract capital and attention in the short term but may lead to long-term inflation and price pressure,Liquidity mining is always more harmful than beneficial,Liquidity mining is only suitable for large MEME coin projects,B,No
84,Intermediate,Analyze the interactive relationship between MEME coins and the NFT market,MEME coin and NFT market trends usually have a positive correlation,MEME coins and NFTs are usually independent markets,Many MEME coin projects expand into the NFT space creating related collectibles with significant overlap in communities and trends between the two markets,MEME coins have completely replaced the NFT market,B,No
85,Intermediate,"Evaluate the implementation methods and effects of token buyback"" strategies in MEME coin projects""",Token buybacks have no impact on MEME coin projects,Token buybacks typically use project revenue to purchase and burn tokens in circulation aiming to reduce supply and support prices,Token buybacks are a way for the community to show confidence in the MEME project,Token buybacks are usually applicable to large MEME coin projects,C,No
86,Intermediate,"Analyze the design considerations of token staking"" mechanisms in MEME coin projects""",Only a small portion of MEME coin projects don't use staking mechanisms,Staking mechanisms are usually designed to encourage long-term holding improve community confidence and cohesion,Staking mechanisms always drive token price increases,Most MEME coin projects use the same staking mechanism,B,No
87,Intermediate,Which of the following is the most well-known market maker in the MEME coin market?,Wintermute,GSR Markets,Jump Trading,DWF Labs,A,No
88,Intermediate,"Analyze the impact of token incentives"" on user behavior in MEME coin projects""","Token incentives will definitely attract yield farmers""",Token incentives may lead to short-term speculative behavior and unsustainable growth patterns,Token incentives are generally harmful,Token incentives only affect small MEME coin projects,B,No
89,Intermediate,"Evaluate the strategies and impacts of brand partnerships"" in MEME coin projects""",Large MEME coin projects typically don't engage in brand partnerships,Choosing suitable partners and maintaining brand consistency is key for MEME projects,Brand partnerships are always beneficial,Brand partnerships are usually only applicable to marketing-oriented MEME crypto projects,B,No
90,Intermediate,From which aspects should the potential of AI+MEME projects be evaluated?,DEV background,Narrative innovation,MEME design aesthetics,Github code repository,A/B/D,Multiple Choice
91,Intermediate,From which aspects should the potential of celebrity MEME projects be evaluated?,Celebrity influence,Short-term rise and fall in the secondary market,Token distribution situation,Project marketing strategy,A/C,Multiple Choice
92,Intermediate,What are the benefits of participating in MEME projects through Bonding Curve mechanisms rather than presales?,Prevention of rug pulls,Earlier participation is more likely to be profitable,The project has greater potential,More time to think before making investment decisions,A/B,Multiple Choice
93,Intermediate,What is the typical early price trend of MEME projects that the market considers to have potential?,Early holders don't sell for profit,DEV may have already SOLD,MEME price rises basically without drops,MEME price rises with clear small drops during the uptrend,A/B/C,Multiple Choice
94,Intermediate,Which methods are commonly used for 'token valuation' in MEME coin projects?,MEME coin valuation is usually based on community size,MEME coin valuation is usually based on narrative impact,MEME coin valuation is usually based on relative valuation rather than traditional cash flow analysis,MEME coin valuation is usually based on trading volume,B/C,Multiple Choice
95,Intermediate,Evaluate the impact of 'token utility' on the long-term value of MEME coin projects,Token utility is always beneficial,MEME coins with ecosystem access rights usually have more long-term value,MEME coins with governance functions have more sustainable value propositions,All successful MEME coins typically have token utility,B/C,Multiple Choice
96,Intermediate,What are the reasons for the rise of the MEME wave?,Users no longer want to be the last holders of VC coins,The emergence of smart contracts,Fulfilling users' pursuit of gambling-like excitement,The demand for influencers to monetize their influence,A/C/D,Multiple Choice
97,Intermediate,Which of the following public chains were more active in the MEME market in early 2025?,ETH,SOL,BSC,BTC,B/C,Multiple Choice
98,Intermediate,Which of the following are terms describing MEME trader personas?,PVP Player,DEV,Community Leader,Shitcoin Trader,A/D,Multiple Choice
99,Intermediate,What forms of phenomenal AI+MEME projects emerged in 2024-2025?,AI-App,AI-OS,AI-Agent,AI-LLM,B/C,Multiple Choice
100,Intermediate,Which type of token distribution is healthier for MEME projects?,50% team holdings,Top 50 holding addresses have no associations,Top 10 holdings < 30%,80% team holdings but locked,B/C/D,Multiple Choice
101,Intermediate,Evaluate the impact of 'token distribution' on the success of MEME coin projects,Fairer token distribution is usually associated with healthier communities,All successful MEME coin projects typically have the same token distribution,Highly concentrated token distribution may lead to trust issues,Transparent token distribution is strongly correlated with token success,A/C,Multiple Choice
102,Intermediate,Analyze the best practices of 'Community Management' in MEME coin projects,Effective community management includes transparent communication,Effective community management includes active participation and conflict resolution,Effective community management includes maintaining a positive atmosphere,Successful communities usually have several strong community leaders,A/B/C/D,Multiple Choice
103,Intermediate,Evaluate the effectiveness and risks of 'KOL Marketing' (Influencer Marketing) in MEME coin projects,KOL marketing can quickly increase project awareness,KOL marketing projects are usually lower risk,KOL marketing may produce short-term effects rather than sustained value,KOL marketing is usually more suitable for large MEME coin projects,A/C,Multiple Choice
104,Intermediate,What are the profit methods for KOLs in the MEME space?,Accepting advertisements for MEME projects,Launching personal MEME coins,Profiting from MEME trading,Earning commissions by inviting users to projects,A/B/C,Multiple Choice
