No,classification,Question,Option A,Option B,Option C,Option D,Correct option,Multiple Choice or Not
1,Advanced,"In EigenLayer's restaking mechanism, consider an AVS (Actively Validated Service) with a slashing condition that triggers when >33% of restaked ETH validators fail to reach consensus within 12 seconds. If the total restaked ETH is 2.4M ETH, the base slashing rate is 0.5%, and there's a correlation penalty multiplier of 1.5x for correlated failures, what is the maximum potential slashing amount when 850,000 ETH worth of validators experience correlated failures?","Approximately 4,250 ETH","Approximately 6,375 ETH","Approximately 8,500 ETH","Approximately 12,750 ETH",B,No
2,Advanced,"Select all mechanisms that are fundamental to the ve(3,3) tokenomics model as implemented in protocols like Solidly and its forks:",Vote-escrowed tokens with time-weighted voting power decay,Bribes distribution proportional to voting power allocation,Rebase rewards that increase with total locked supply,"Anti-dilution mechanisms through (3,3) game theory equilibrium","A, B, D",Yes
3,Advanced,"In a bonding curve AMM with the formula P = k * S^n, where P is price, S is supply, k is a constant, and n is the curve exponent, if k=0.00001, n=1.5, and the current supply is 1,000,000 tokens, what is the marginal cost to purchase the next 100,000 tokens?",Approximately 94.28 ETH,Approximately 108.15 ETH,Approximately 125.44 ETH,Approximately 142.67 ETH,A,No
4,Advanced,Which of the following represent critical vulnerabilities in liquid staking derivative (LSD) protocols that can lead to systemic risk?,Validator set concentration leading to correlated slashing events,Oracle manipulation affecting the LSD/ETH exchange rate,Liquidity cascades during mass unstaking events,MEV extraction reducing staking rewards below market rates,"A, B, C",Yes
5,Advanced,"In a cross-chain bridge using optimistic verification with a 7-day challenge period, if the bridge has $100M TVL, the challenge bond is 1% of transaction value, and the fraud proof success rate is 99%, what is the expected annual cost of fraud for a bridge processing $120M in monthly volume?","Approximately $144,000","Approximately $172,800","Approximately $201,600","Approximately $230,400",A,No
6,Advanced,Select all factors that contribute to the 'convenience yield' premium in liquid staking tokens as described in recent academic literature:,Immediate liquidity compared to native staking lockup periods,Composability with DeFi protocols for additional yield,Lower slashing risk through validator diversification,Reduced gas costs for staking operations,"A, B, C",Yes
7,Advanced,"In a real-yield protocol where 70% of revenue is distributed to token holders and 30% is retained for protocol development, if the protocol generates $2.4M monthly revenue with a token supply of 10M tokens trading at $8, and the distribution follows a ve-model with maximum lock multiplier of 4x, what is the effective annual yield for maximum-locked tokens?",Approximately 50.4%,Approximately 67.2%,Approximately 84.0%,Approximately 100.8%,C,No
8,Advanced,Which of the following represent advanced MEV extraction strategies that require sophisticated tokenomics design to mitigate?,Time-bandit attacks exploiting block reorganization incentives,Cross-domain MEV extraction in rollup-to-L1 transactions,Validator-proposer collusion in PBS (Proposer-Builder Separation),Just-in-time liquidity provision for sandwich attacks,"A, B, C",Yes
9,Advanced,"In a quadratic voting governance system with token-weighted quadratic costs, if a proposal requires 10,000 vote credits to pass and voters have token holdings of [1000, 2500, 5000, 7500, 10000], what is the minimum coalition size needed to pass the proposal assuming rational voting behavior and quadratic cost formula cost = votes^2 / tokens?",2 voters (7500 + 10000 tokens),3 voters (2500 + 5000 + 7500 tokens),3 voters (5000 + 7500 + 10000 tokens),4 voters (1000 + 2500 + 5000 + 7500 tokens),A,No
10,Advanced,Select all mechanisms that are essential for sustainable tokenomics in Real-World Asset (RWA) protocols:,Regulatory compliance frameworks for asset custody and transfer,Oracle systems for real-time asset valuation and yield distribution,Insurance mechanisms for asset default and liquidation events,Cross-jurisdictional legal frameworks for token holder rights,"A, B, C, D",Yes
11,Advanced,"In a protocol-owned liquidity (POL) model where the protocol uses 40% of revenue to buy back tokens and provide liquidity, if the protocol has $5M in treasury, generates $800K monthly revenue, and the token trades at $10 with 2M circulating supply, what is the theoretical maximum sustainable APR for liquidity providers assuming 50% of tokens are in LP?",Approximately 15.36%,Approximately 19.20%,Approximately 23.04%,Approximately 38.40%,D,No
12,Advanced,Which of the following represent critical design considerations for tokenomics in modular blockchain architectures?,"Separate fee markets for data availability, execution, and settlement layers",Cross-layer value accrual mechanisms for shared security,Interoperability incentives for cross-rollup communication,Validator set coordination across multiple execution environments,"A, B, C, D",Yes
13,Advanced,"In a bribes-based voting system like Curve's gauge voting, if the total weekly CRV emissions are 3.17M CRV, the bribe efficiency ratio is 0.85 (meaning $0.85 in bribes per $1 of redirected emissions), and the average CRV price is $0.45, what is the minimum weekly bribe amount needed to capture 15% of total emissions?","Approximately $182,000","Approximately $203,000","Approximately $224,000","Approximately $245,000",A,No
14,Advanced,Select all factors that contribute to the 'death spiral' risk in algorithmic stablecoin tokenomics:,Reflexive selling pressure during depeg events,Insufficient collateral backing during market stress,Governance token dilution through emergency minting,Oracle latency in price feed updates during volatility,"A, B, C",Yes
15,Advanced,"In a dynamic fee structure AMM where fees adjust based on volatility using the formula: fee = base_fee + volatility_multiplier * sqrt(price_variance), if base_fee = 0.05%, volatility_multiplier = 0.02, and the 24-hour price variance is 0.0144, what is the current trading fee?",0.07%,0.08%,0.09%,0.10%,A,No
16,Advanced,Which of the following represent advanced liquidation mechanisms that improve capital efficiency in lending protocols?,Dutch auction liquidations with time-decaying discounts,Partial liquidations based on health factor gradients,Cross-collateral liquidations across multiple asset positions,MEV-aware liquidation ordering to maximize protocol revenue,"A, B, C, D",Yes
17,Advanced,"In a restaking protocol with multiple AVS commitments, if a validator has 32 ETH staked across 5 different AVS with slashing rates of [0.5%, 1.0%, 0.75%, 1.25%, 0.8%] and independent failure probabilities of [0.01, 0.02, 0.015, 0.025, 0.018], what is the expected annual slashing loss?",Approximately 0.0288 ETH,Approximately 0.0432 ETH,Approximately 0.0576 ETH,Approximately 0.0720 ETH,A,No
18,Advanced,Select all mechanisms that are crucial for preventing governance attacks in token-weighted voting systems:,Time-delayed execution of governance proposals,Quadratic voting to reduce whale influence,Delegation caps to prevent vote concentration,Minimum quorum requirements based on circulating supply,"A, C, D",Yes
19,Advanced,"In a cross-chain yield farming strategy using liquid staking derivatives, if the base staking yield is 4.2%, the LSD protocol fee is 10%, cross-chain bridge costs are 0.15% per transfer, and additional DeFi yield is 8.5%, what is the net APY for a strategy requiring 4 cross-chain transfers annually?",Approximately 11.58%,Approximately 11.88%,Approximately 12.18%,Approximately 12.48%,B,No
20,Advanced,Which of the following represent critical considerations for tokenomics design in zero-knowledge rollup ecosystems?,Proof generation costs and their impact on transaction fees,Sequencer MEV extraction and redistribution mechanisms,Data availability costs for proof verification,Cross-rollup interoperability and shared liquidity incentives,"A, B, C, D",Yes
21,Advanced,"In a ve-tokenomics system with linear decay over 4 years, if a user locks 10,000 tokens for the maximum period and the protocol implements a boost multiplier of min(2.5, 1 + locked_ratio * 1.5) where locked_ratio is the user's share of total locked supply, what is the effective voting power when the user holds 2.5% of total locked supply?","15,000 vote units","17,500 vote units","20,000 vote units","25,000 vote units",D,No
22,Advanced,Select all factors that contribute to impermanent loss in concentrated liquidity AMMs like Uniswap V3:,Price movement outside the specified liquidity range,Fee collection rate relative to price volatility,Capital efficiency improvements from concentrated positions,Rebalancing frequency and associated gas costs,"A, B, D",Yes
23,Advanced,"In a DAO treasury management system using a diversified portfolio approach, if the treasury holds 60% governance tokens, 25% stablecoins, and 15% blue-chip assets, and implements a rebalancing strategy with 5% tolerance bands, what triggers a rebalancing event?",When governance tokens fall below 55% or rise above 65%,When any single asset class deviates by more than 5% from target,When the portfolio Sharpe ratio falls below 1.0,When total portfolio value changes by more than 10%,A,No
24,Advanced,Which of the following represent advanced mechanisms for MEV redistribution in Proposer-Builder Separation (PBS) systems?,Commit-reveal schemes for bid privacy in block auctions,Partial block building with reserved transaction space,Cross-domain MEV sharing between L1 and L2 systems,Time-weighted average pricing for MEV distribution,"A, B, C",Yes
25,Advanced,"In a real-world asset tokenization protocol with insurance coverage, if the underlying asset has a 2.5% annual default probability, insurance costs 0.8% annually, and the protocol charges a 1.5% management fee, what is the risk-adjusted expected yield for investors if the underlying asset yields 6.2%?",Approximately 3.74%,Approximately 3.90%,Approximately 4.06%,Approximately 4.22%,B,No
26,Advanced,"In a modular blockchain architecture with separate data availability (DA), execution, and settlement layers, if the DA layer charges 0.001 ETH per KB, execution layer charges 0.0001 ETH per gas unit, and settlement layer charges 0.01% of transaction value, what is the total cost for a 1000-gas transaction worth 5 ETH that requires 2.5 KB of data availability?",Approximately 0.0015 ETH,Approximately 0.0025 ETH,Approximately 0.0035 ETH,Approximately 0.0045 ETH,C,No
27,Advanced,Select all mechanisms that are critical for preventing MEV extraction in decentralized sequencer networks:,Commit-reveal schemes with cryptographic commitments,Threshold encryption for transaction ordering,Fair sequencing protocols with verifiable delay functions,Batch auction mechanisms for transaction inclusion,"A, B, C, D",Yes
28,Advanced,"In a liquid restaking protocol where users can delegate to multiple operators simultaneously, if the total delegated stake is 500,000 ETH across 5 operators with commission rates [5%, 8%, 12%, 15%, 20%] and stake distributions [100K, 80K, 75K, 125K, 120K] ETH respectively, what is the weighted average commission rate?",Approximately 11.2%,Approximately 12.4%,Approximately 13.6%,Approximately 14.8%,B,No
29,Advanced,Which of the following represent advanced oracle manipulation attack vectors in DeFi tokenomics?,Flash loan attacks exploiting price feed latency,Multi-block MEV attacks on time-weighted average prices,Cross-chain oracle arbitrage during bridge delays,Governance attacks on oracle parameter updates,"A, B, C, D",Yes
30,Advanced,"In a zero-knowledge rollup with proof generation costs of 0.05 ETH per batch and data availability costs of 0.0001 ETH per transaction, if the rollup processes 10,000 transactions per batch and charges users a 20% markup on costs, what is the per-transaction fee?",Approximately 0.00006 ETH,Approximately 0.00012 ETH,Approximately 0.00018 ETH,Approximately 0.00024 ETH,B,No
31,Advanced,Select all factors that contribute to the sustainability of yield farming incentives in DeFi protocols:,Protocol revenue generation exceeding token emission costs,Sticky liquidity through long-term lock mechanisms,Diversified revenue streams beyond trading fees,Dynamic emission schedules based on TVL and utilization,"A, B, C, D",Yes
32,Advanced,"In a cross-chain governance system using optimistic governance with a 72-hour challenge period, if the average proposal value is $2M, the challenge bond is 1% of proposal value, and the false positive rate is 5%, what is the expected annual cost of governance for a DAO making 50 proposals per year?","Approximately $50,000","Approximately $75,000","Approximately $100,000","Approximately $125,000",A,No
33,Advanced,Which of the following represent critical design elements for tokenomics in intent-based architectures?,Solver competition mechanisms for intent fulfillment,Reputation systems for solver reliability scoring,Slashing conditions for malicious or failed intent execution,Dynamic fee structures based on intent complexity and urgency,"A, B, C, D",Yes
34,Advanced,"In a real-world asset (RWA) tokenization protocol with quarterly yield distributions, if the underlying assets generate 8.5% annual yield, the protocol charges 2% management fees, insurance costs 1.2% annually, and there's a 3% annual default rate, what is the expected quarterly distribution per token for a $1000 face value token?",Approximately $5.75,Approximately $6.25,Approximately $6.75,Approximately $7.25,A,No
35,Advanced,Select all mechanisms that are essential for preventing vampire attacks in DeFi protocols:,Vote-escrowed tokenomics with long lock periods,Liquidity mining programs with vesting schedules,Protocol-owned liquidity to reduce dependency on mercenary capital,Cross-protocol partnerships and shared incentive structures,"A, B, C",Yes
36,Advanced,"In a multi-chain yield aggregator that rebalances portfolios across 5 chains with average bridge costs of 0.15% and rebalancing frequency of every 7 days, if the average yield differential is 2.5% annually, what is the minimum portfolio size needed to justify weekly rebalancing assuming break-even analysis?","Approximately $50,000","Approximately $75,000","Approximately $100,000","Approximately $125,000",D,No
37,Advanced,Which of the following represent advanced mechanisms for MEV redistribution in Layer 2 rollups?,Sequencer auction mechanisms with MEV sharing,Cross-rollup MEV extraction through atomic arbitrage,L1-L2 MEV coordination through shared ordering,Decentralized sequencer networks with fair ordering,"A, C, D",Yes
38,Advanced,"In a decentralized derivatives protocol using automated market makers, if the funding rate is calculated as (mark_price - index_price) / index_price * 8 hours, and the current mark price is $2,050 while the index price is $2,000, what is the 8-hour funding rate?",2.50%,3.00%,3.50%,4.00%,A,No
39,Advanced,Select all factors that contribute to the economic security of proof-of-stake networks:,Total value staked relative to market capitalization,Slashing conditions and penalty severity,Validator set decentralization and geographic distribution,Staking reward rates and opportunity costs,"A, B, C, D",Yes
40,Advanced,"In a liquid staking protocol with a 10% protocol fee on staking rewards, if the base Ethereum staking yield is 4.5%, the protocol has 2M ETH staked, and the liquid staking token trades at a 2% premium to ETH, what is the effective yield for liquid staking token holders?",Approximately 2.05%,Approximately 2.25%,Approximately 2.45%,Approximately 3.97%,D,No
41,Advanced,Which of the following represent critical vulnerabilities in cross-chain bridge tokenomics?,Validator set overlap leading to correlated failures,Economic incentive misalignment during market stress,Oracle manipulation affecting cross-chain price feeds,Liquidity fragmentation across multiple chains,"A, B, C, D",Yes
42,Advanced,"In a protocol using Harberger taxation for NFT ownership, if the tax rate is 5% annually, the current self-assessed value is $10,000, and the forced sale price is 120% of assessed value, what is the annual tax burden for maintaining ownership?",$500 ,$600 ,$700 ,$800 ,A,No
43,Advanced,Select all mechanisms that are essential for sustainable tokenomics in decentralized storage networks:,Proof-of-replication and proof-of-spacetime for storage verification,Dynamic pricing based on supply and demand for storage,Slashing conditions for storage providers failing to maintain data,Retrieval mining incentives for data availability,"A, B, C, D",Yes
44,Advanced,"In a decentralized autonomous organization (DAO) with quadratic funding for public goods, if individual contributions are [100, 500, 1000, 2500, 5000] for a project, what is the quadratic funding match amount using the formula: match = (sum of sqrt(contributions))^2 - sum of contributions?","Approximately $15,625","Approximately $18,750","Approximately $21,875","Approximately $25,012",D,No
45,Advanced,Which of the following represent advanced mechanisms for preventing front-running in decentralized exchanges?,Commit-reveal schemes for order submission,Batch auctions with uniform clearing prices,Threshold encryption with delayed decryption,Verifiable delay functions for transaction ordering,"A, B, C, D",Yes
46,Advanced,"In a restaking protocol with multiple slashing conditions, if an operator has commitments to 3 AVS with slashing rates of [1%, 2%, 1.5%] and correlation factors of [0.3, 0.4, 0.2] respectively, what is the maximum correlated slashing exposure for 100 ETH stake?",Approximately 3.2 ETH,Approximately 3.8 ETH,Approximately 4.4 ETH,Approximately 5.0 ETH,B,No
47,Advanced,Select all factors that are critical for the long-term sustainability of algorithmic stablecoin mechanisms:,Diversified collateral backing with low correlation,Adaptive monetary policy based on market conditions,Emergency governance mechanisms for crisis response,Sufficient protocol reserves for market making operations,"A, B, C, D",Yes
48,Advanced,"In a prediction market using automated market makers, if the initial liquidity is 500 shares for each outcome, and traders buy 200 shares of outcome A, what is the new implied probability for outcome A using the formula: P_A = shares_A / (shares_A + shares_B)?",Approximately 55.6%,Approximately 58.3%,Approximately 62.5%,Approximately 66.7%,B,No
49,Advanced,Which of the following represent critical design considerations for tokenomics in decentralized identity systems?,Reputation staking mechanisms for identity verification,Privacy-preserving credential verification with zero-knowledge proofs,Sybil resistance through proof-of-personhood protocols,Economic incentives for identity attestation and verification,"A, B, C, D",Yes
50,Advanced,"In a multi-asset collateralized debt position (CDP) system with dynamic liquidation thresholds, if Asset A has a 150% collateral ratio, Asset B has 200%, Asset C has 175%, and their correlation matrix shows average correlation of 0.57, what is the portfolio-adjusted liquidation threshold for equal weights of all three assets?",Approximately 165%,Approximately 172%,Approximately 178%,Approximately 185%,C,No
51,Advanced,"In a bonding curve with the formula P = 0.01 * e^(0.001 * S), where P is price and S is supply, what is the approximate price when the supply reaches 1,000 tokens?",0.0272,0.0368,0.0451,0.0523,A,No
52,Advanced,Select all factors that contribute to the optimal design of a ve-tokenomics model for maximizing long-term protocol alignment.,Non-linear voting power decay function,Maximum lock duration of 4 years,Quadratic relationship between lock time and voting power,Revenue sharing proportional to voting power,"A, B, D",Yes
53,Advanced,"In a constant product AMM (x * y = k) with reserves of 1,000,000 USDC and 2,000,000 tokens, what is the approximate price impact of a 10,000 USDC swap?",1.97%,2.15%,2.43%,2.67%,A,No
54,Advanced,Which mechanisms are essential components of a sustainable tokenomics model for preventing hyperinflation?,Algorithmic token burning based on transaction volume,Elastic supply adjustment mechanisms,Velocity sinks through staking requirements,Fixed maximum supply cap,"A, B, C",Yes
55,Advanced,"In quadratic voting, if a participant wants to cast 16 votes on a proposal, what is the token cost?",16 tokens,64 tokens,256 tokens,512 tokens,C,No
56,Advanced,Select all scenarios where impermanent loss in liquidity provision becomes permanent loss.,When one token in the pair goes to zero,When the price ratio returns to the original state,When liquidity is withdrawn during maximum divergence,When the pool experiences a rug pull,"A, C, D",Yes
57,Advanced,What is the impermanent loss percentage when one token in a 50/50 LP increases 4x in price relative to the other?,-15.47%,-20.00%,-25.32%,-30.18%,B,No
58,Advanced,Which factors are critical for designing MEV-resistant tokenomics in a Layer 1 blockchain?,Commit-reveal schemes for transaction ordering,Fair sequencing services integration,MEV redistribution to token holders,Encrypted mempool mechanisms,"A, B, C, D",Yes
59,Advanced,"In a concentrated liquidity AMM, what is the primary advantage of the capital efficiency improvement over traditional constant product AMMs?",Reduced slippage for trades within the concentrated range,Elimination of impermanent loss,Guaranteed positive returns for liquidity providers,Automatic rebalancing of positions,A,No
60,Advanced,Select all components that are essential for a robust token velocity control mechanism.,Staking rewards with lock-up periods,Transaction fee burning,Governance participation requirements,Liquidity mining incentives,"A, B, C",Yes
61,Advanced,What is the Network Value to Transactions (NVT) ratio for a protocol with a $1B market cap and $5M daily transaction volume over 90 days?,2.22,3.33,4.44,5.55,A,No
62,Advanced,Which mechanisms can effectively address the 'governance attack' problem in token-weighted voting systems?,Quadratic voting implementation,Time-weighted voting power,Delegation with slashing conditions,Minimum participation thresholds,"A, B, C, D",Yes
63,Advanced,"In a Dutch auction token sale with a starting price of $10 and a 50% price reduction over 24 hours, what is the price after 8 hours?",$6.67 ,$7.22 ,$7.78 ,$8.33 ,D,No
64,Advanced,Select all factors that contribute to the 'death spiral' phenomenon in algorithmic stablecoins.,Excessive minting during depeg events,Lack of sufficient collateral backing,Reflexive selling pressure on governance tokens,Inadequate arbitrage incentives,"A, B, C",Yes
65,Advanced,What is the optimal collateralization ratio for a lending protocol to maintain a 5% liquidation buffer with 10% price volatility?,115%,125%,135%,145%,B,No
66,Advanced,Which design patterns are essential for creating anti-fragile tokenomics that benefit from market stress?,Counter-cyclical token issuance,Stress-activated fee burning,Volatility-based staking rewards,Crisis-triggered governance powers,"A, B, C",Yes
67,Advanced,"In a Curve Finance-style bonding curve with amplification factor A=100, what is the primary benefit compared to a standard constant product curve?",Reduced slippage for trades near the peg,Elimination of impermanent loss,Higher capital efficiency,Automatic arbitrage execution,A,No
68,Advanced,Select all mechanisms that can effectively implement progressive decentralization in tokenomics design.,Time-locked token releases to community,Gradual reduction of team voting power,Milestone-based governance transitions,Automated parameter adjustment algorithms,"A, B, C",Yes
69,Advanced,What is the effective annual yield for a liquidity mining program offering 50% APY with daily compounding?,64.87%,67.23%,69.41%,71.58%,A,No
70,Advanced,Which factors are critical for designing sustainable yield farming incentives that avoid mercenary capital?,Vesting schedules for farming rewards,Loyalty multipliers based on holding duration,Penalty mechanisms for early withdrawal,Dynamic reward rates based on TVL,"A, B, C",Yes
71,Advanced,"In a ve-tokenomics model, if a user locks 1,000 tokens for 2 years (max 4 years), what is their initial voting power?",250,500,750,1000,B,No
72,Advanced,Select all design elements that characterize a well-designed token burning mechanism.,Burns proportional to network usage,Deflationary pressure during high activity,Transparent and verifiable burn process,Emergency burn capabilities for governance,"A, B, C",Yes
73,Advanced,"What is the token velocity for a network with $100M market cap, $50M daily transaction volume, and $2 average token price?",0.5,1,1.5,2,B,No
74,Advanced,Which mechanisms are essential for preventing governance token concentration attacks?,Delegation caps per validator,Quadratic voting for major decisions,Time-delayed execution of proposals,Multi-signature requirements for critical changes,"A, B, C, D",Yes
75,Advanced,"In a bonding curve with polynomial formula P = 0.001 * S^2 + 0.1, what is the marginal cost of the 100th token?",0.199,0.201,0.299,0.301,A,No
76,Advanced,Select all factors that contribute to the reflexivity problem in token-based systems.,Price-dependent utility functions,Collateral-based lending protocols,Market cap-weighted governance,Liquidity-dependent trading fees,"A, B, C",Yes
77,Advanced,"What is the liquidation price for a position with $10,000 collateral, $6,000 debt, and 120% liquidation threshold?","$7,200 ","$7,500 ","$8,000 ","$8,400 ",A,No
