164,Advanced,"In liquid restaking protocols, what is the primary risk that differentiates them from traditional liquid staking?",Smart contract risk from additional protocol layers,Slashing risk from multiple validation services,Liquidity risk from token redemption delays,Governance risk from centralized operator selection,B,No
165,Advanced,Slovenia's $32.5 million digital bond issuance in July 2024 established which precedent for sovereign RWA tokenization?,First EU nation to issue sovereign digital bonds,Use of distributed ledger technology for government securities,Integration with traditional bond settlement systems,Regulatory framework for cross-border digital bond trading,"A, B",Yes
166,Advanced,"In AI agent tokenomics, the 'crypto-economic reward loop' for decentralized machine learning primarily incentivizes which activities?",Data contribution and model training,GPU compute provision and validation,Algorithm optimization and peer review,Network governance and dispute resolution,"A, B",Yes
167,Advanced,The Monetary Authority of Singapore's Project Guardian expansion focuses on which aspect of RWA tokenization infrastructure?,Cross-border regulatory harmonization,Common settlement facilities for tokenized assets,Institutional custody solutions,Retail investor protection mechanisms,B,No
168,Advanced,"In Curve Finance's vote escrow model that inspired ve(3,3), the 'Curve Wars' phenomenon demonstrated which tokenomics principle?",Governance tokens can become more valuable than utility tokens,Protocols will compete for voting power to direct emissions,Lock duration creates sustainable competitive advantages,Revenue sharing aligns long-term stakeholder interests,B,No
169,Advanced,Babylon's Bitcoin restaking protocol enables which novel economic security model?,Using Bitcoin's hash power to secure Proof-of-Stake networks,Leveraging Bitcoin's economic security for other blockchain protocols,Creating liquid Bitcoin derivatives for DeFi applications,Implementing time-locked Bitcoin contracts for validation,B,No
170,Advanced,"In points-based tokenomics systems popular in 2024, which mechanism best prevents Sybil attacks while maintaining user engagement?",KYC verification for all point-earning activities,Progressive point multipliers based on account age,Social graph analysis for authentic user detection,Hardware-based attestation for unique device identification,C,No
171,Advanced,The total tokenized market including stablecoins reached $217.26 billion by December 2024. What percentage of this was attributed to non-stablecoin RWAs?,Approximately 7%,Approximately 12%,Approximately 18%,Approximately 25%,A,No
172,Advanced,"In DePIN tokenomics, which factors are most critical for sustainable network effects in physical infrastructure networks?",Geographic coverage density and quality of service metrics,Token price stability and inflation control mechanisms,Hardware standardization and interoperability protocols,Governance participation and community development,"A, C",Yes
173,Advanced,Lido's liquid staking model differs from restaking protocols in which fundamental way?,Lido only secures the Ethereum consensus layer,Restaking protocols enable multiple simultaneous validation services,Lido provides immediate liquidity while restaking requires lock periods,Restaking protocols have higher slashing risks,"A, B",Yes
174,Advanced,"In Numerai's crowd-sourced hedge fund model, what tokenomics mechanism aligns data scientist incentives with fund performance?",NMR staking on prediction accuracy with performance-based rewards,Proportional fee sharing based on model contribution,Reputation-weighted voting on investment strategies,Time-locked NMR bonuses for consistent performance,A,No
175,Advanced,The Bank for International Settlements' Project Agorá involves central banks from which countries exploring asset tokenization?,"France, Japan, South Korea, Mexico","Switzerland, United Kingdom, United States","Germany, Canada, Australia, Singapore","China, India, Brazil, Russia","A, B",Yes
176,Advanced,"In AI agent token economics, what distinguishes 'AI-to-AI service negotiation' from traditional API-based interactions?",Autonomous price discovery without human intervention,Multi-token payment systems for complex services,Quality-based reputation scoring for service providers,Cross-chain service composition and execution,A,No
177,Advanced,Citibank's February 2024 proof-of-concept with Ava Labs for private equity tokenization aimed to address which traditional PE limitations?,High minimum investment thresholds,Limited liquidity and long lock-up periods,Lack of transparent pricing mechanisms,Complex regulatory compliance requirements,B,No
178,Advanced,"In the context of cross-chain DePIN networks, which tokenomics challenge is most difficult to solve?",Maintaining consistent service quality across different blockchains,Synchronizing token rewards for multi-chain infrastructure providers,Preventing double-spending of physical resource contributions,Ensuring fair dispute resolution across different governance systems,C,No
179,Advanced,The Lummis-Gillibrand Payment Stablecoin Act introduced in April 2024 primarily addresses which tokenomics concern?,Reserve backing requirements for stablecoin issuers,Consumer protection in stablecoin transactions,US dollar dominance in digital asset markets,Regulatory clarity for stablecoin innovation,"A, B, C",Yes
180,Advanced,"In liquid staking derivatives (LSDs), what mechanism prevents the 'depeg risk' where the derivative token trades below the underlying asset value?",Arbitrage opportunities through redemption mechanisms,Protocol-owned liquidity in secondary markets,Insurance funds covering slashing events,Dynamic fee adjustments based on market conditions,A,No
181,Advanced,Tokyo's May 2024 subsidy program for security token issuances recognized which key benefits of tokenization?,Lower minimum investment denominations,Removal of traditional financial intermediaries,Enhanced regulatory compliance automation,Improved cross-border investment accessibility,"A, B",Yes
182,Advanced,"In restaking protocols, what is the primary economic trade-off that validators must consider?",Higher rewards versus increased slashing risk,Liquidity provision versus capital efficiency,Governance participation versus operational complexity,Network security versus decentralization,A,No
183,Advanced,ChainGPT's role as an 'AI oracle' for blockchains enables which novel tokenomics application?,Smart contracts that adapt based on AI-generated insights,Automated token burns based on AI market predictions,Dynamic fee structures optimized by machine learning,AI-driven governance proposal generation and voting,A,No
184,Advanced,The growth of stablecoin holders to 140.53 million accounts by January 2025 indicates which shift in crypto adoption?,Transition from speculative to utility-focused usage,Increased institutional adoption of digital assets,Growing demand for dollar-denominated digital payments,Expansion of DeFi participation globally,"A, C",Yes
185,Advanced,"In Solayer's Solana-based restaking infrastructure, what unique advantage does it have over Ethereum-based restaking?",Lower transaction costs for restaking operations,Faster finality for cross-chain security services,Native support for parallel transaction processing,Built-in MEV protection for restaked assets,"A, C",Yes
186,Advanced,"In the context of AI agent tokenomics, what is the most significant challenge for achieving 'artificial general intelligence (AGI)' on decentralized networks?",Coordinating training across distributed compute resources,Incentivizing long-term research versus short-term profits,Preventing adversarial attacks on shared AI models,Ensuring fair compensation for diverse AI contributions,B,No
187,Advanced,The concept of 'economic security' in restaking protocols is fundamentally based on which principle?,The cost to attack a network should exceed the potential gain,Diversified validation services reduce systemic risk,Staked capital creates skin-in-the-game for honest behavior,Network effects increase security through participation,"A, C",Yes
188,Advanced,"In DePIN networks, what tokenomics mechanism best ensures quality of service while preventing centralization?",Reputation-weighted rewards with slashing for poor performance,Geographic distribution requirements for maximum rewards,Proof-of-coverage with quality attestation from multiple sources,Dynamic pricing based on local supply and demand,C,No
189,Advanced,"The ve(3,3) model's inflation control through community governance (like Aerodrome's Aero Fed) represents which evolution in tokenomics design?",Transition from algorithmic to democratic monetary policy,Integration of real-time market feedback into token supply,Alignment of inflation decisions with stakeholder interests,Reduction of protocol founder influence over token economics,"A, C",Yes
190,Advanced,"In Ocean Protocol's federated learning model with blockchain rewards, what prevents participants from contributing low-quality data while still earning tokens?",Cryptographic proofs of data quality and uniqueness,Peer validation and reputation scoring systems,Economic penalties for models that perform poorly,Differential privacy requirements that expose bad actors,"B, C",Yes
191,Advanced,The US Congressional hearing on 'Next Generation Infrastructure: How Tokenization of Real-World Assets Will Facilitate Efficient Markets' in 2024 primarily validated which aspect of RWA tokenization?,Potential for reducing settlement times in traditional finance,Ability to democratize access to institutional-grade investments,Transformative impact on existing financial services infrastructure,Regulatory readiness for widespread RWA adoption,C,No
192,Advanced,"In liquid restaking protocols, which risk management mechanism is most critical for preventing cascading failures?",Diversification limits across different validation services,Insurance pools funded by protocol fees,Gradual slashing with appeal processes,Circuit breakers that halt operations during stress events,A,No
193,Advanced,Cookie DAO's AI-driven trading bot tokenomics model represents which innovation in automated DeFi strategies?,Community ownership of algorithmic trading strategies,Machine learning optimization of yield farming,Transparent fee sharing with token holders,Decentralized governance of trading parameters,"A, B",Yes
194,Advanced,"In the context of cross-chain restaking, what is the most complex challenge for maintaining economic security guarantees?",Synchronizing slashing conditions across different consensus mechanisms,Preventing double-signing attacks across multiple chains,Maintaining consistent validator set across different networks,Coordinating dispute resolution across different governance systems,A,No
195,Advanced,The Security Token Market's forecast of $30 trillion in asset tokenization by 2030 is primarily driven by tokenization of which asset classes?,Stocks and equity securities,Real estate and property assets,Government and corporate bonds,Commodities and precious metals,"A, B, C, D",Yes
196,Advanced,"In AI agent networks like SingularityNET, what mechanism ensures interoperability between AI services while maintaining economic incentives?",Standardized API protocols with token-based payments,Cross-chain bridges for multi-network AI service calls,Reputation systems that track service quality across platforms,Automated market makers for AI service pricing,A,No
197,Advanced,The transition from traditional staking to restaking represents which fundamental shift in blockchain economic security models?,From single-purpose to multi-purpose capital utilization,From protocol-specific to application-agnostic security,From inflationary to deflationary token economics,From centralized to decentralized validator selection,"A, B",Yes
198,Advanced,"In points-based airdrop systems that became popular in 2024, what is the optimal conversion ratio strategy for maximizing long-term token value?",Linear conversion based on total points accumulated,Logarithmic scaling to prevent whale dominance,Tiered multipliers based on engagement duration,Dynamic conversion based on network growth metrics,"B, C",Yes
199,Advanced,The integration of traditional finance with DeFi through RWA tokenization faces which primary regulatory arbitrage challenge?,Jurisdictional differences in securities law interpretation,Cross-border settlement and custody requirements,Tax treatment inconsistencies across different token structures,Compliance monitoring for decentralized trading platforms,A,No
200,Advanced,"In the evolution of tokenomics from 2024 to 2025, which trend represents the most significant paradigm shift toward sustainable Web3 economics?",Integration of real-world economic value through RWA tokenization,Transition from speculative to utility-driven token models,Adoption of AI-driven autonomous economic systems,Implementation of cross-chain economic security sharing,"A, B",Yes
201,Advanced,"In DePIN tokenomics, which mechanism is most critical for preventing the 'free rider problem' where participants consume network resources without contributing physical infrastructure?",Proof-of-Physical-Work requiring hardware attestation,Stake-weighted governance voting on resource allocation,Dynamic pricing based on supply-demand imbalances,Time-locked token bonding for infrastructure providers,A,No
202,Advanced,"According to the ve(3,3) model implementation in Aerodrome Finance, what happens during the 'Aero Fed' phase when veAERO holders vote to decrease emissions by 0.01% of total supply?",The protocol automatically burns equivalent tokens from the treasury,Future epoch emissions are reduced by 0.52% annualized rate,Liquidity provider rewards are redistributed to veAERO holders,The voting period is extended to allow for reconsideration,B,No
203,Advanced,"In Bittensor's Yuma Consensus mechanism, which factors determine the daily TAO token distribution to miners?",Neural network model performance rankings,Computational power contributed to the network,Stake weight of the mining node,Geographic distribution requirements,"A, C",Yes
204,Advanced,EigenLayer's restaking mechanism addresses which fundamental limitation of traditional Ethereum staking?,The 32 ETH minimum staking requirement,The inability to use staked ETH for additional security services,The lack of liquid staking token derivatives,The centralization risk from large staking pools,B,No
205,Advanced,"BlackRock's BUIDL fund, launched in March 2024, achieved what significant milestone in the tokenized Treasury market?",First institutional-grade tokenized fund on Ethereum,Captured nearly 30% of the $1.3 billion market within six weeks,Reached $657.41M in assets under management,Established regulatory precedent for tokenized securities,"B, C",Yes
206,Advanced,"In SingularityNET's AI marketplace, the AGIX token serves which primary economic function beyond payment for AI services?",Collateral for AI model training disputes,Staking for transaction validation and network governance,Liquidity provision for cross-chain AI service calls,Insurance fund for failed AI computations,B,No
207,Advanced,The restaking ecosystem's TVL of $15.3B as of September 2024 represents what proportion relative to major DeFi protocols?,Exceeds Aave's TVL of $13B,Represents over half of Lido's $26.48B TVL,Equals approximately 60% of Uniswap's total liquidity,Surpasses the combined TVL of all DEX aggregators,"A, B",Yes
208,Advanced,"In Ocean Protocol's data marketplace, what mechanism ensures fair compensation for data providers while maintaining privacy?",Zero-knowledge proofs for data quality verification,Datatokens that enable on-premise data access,Homomorphic encryption for computation on encrypted data,Federated learning with differential privacy,B,No
209,Advanced,"According to 2024 data, the tokenized RWA market (excluding stablecoins) grew by what percentage year-over-year?",65%,75%,85%,95%,C,No
210,Advanced,Pendle Protocol's token emission schedule since September 2024 implements which deflationary mechanism?,"216,000 tokens weekly with 1.1% weekly reduction until April 2026",Fixed 2% annual inflation with quarterly burn events,Dynamic emissions based on protocol revenue,Halving events every 18 months,A,No
211,Advanced,"In the context of DePIN networks, which tokenomics design best addresses the 'cold start problem' for physical infrastructure deployment?",Exponentially decreasing rewards over time,Geographic density bonuses for early adopters,Proof-of-coverage requirements before token rewards,Cross-subsidization from high-demand to low-demand areas,"B, D",Yes
212,Advanced,"The ve(3,3) model's 'plutocratic governance' concern primarily stems from which structural characteristic?",Voting power proportional to locked token amount and duration,Inability to unlock tokens before the lock period ends,Revenue sharing favoring larger token holders,Yield boost mechanisms creating compounding advantages,A,No
213,Advanced,Fetch.ai's Autonomous Economic Agents (AEAs) create a 'machine-to-machine economy' through which tokenomics mechanisms?,FET tokens for inter-agent transactions and negotiations,Staking FET for machine learning utility access,Automated market makers for agent service pricing,Cross-chain bridges for multi-network agent deployment,"A, B",Yes
214,Advanced,"In liquid restaking protocols, what is the primary risk that differentiates them from traditional liquid staking?",Smart contract risk from additional protocol layers,Slashing risk from multiple validation services,Liquidity risk from token redemption delays,Governance risk from centralized operator selection,B,No
215,Advanced,Slovenia's $32.5 million digital bond issuance in July 2024 established which precedent for sovereign RWA tokenization?,First EU nation to issue sovereign digital bonds,Use of distributed ledger technology for government securities,Integration with traditional bond settlement systems,Regulatory framework for cross-border digital bond trading,"A, B",Yes
216,Advanced,"In AI agent tokenomics, the 'crypto-economic reward loop' for decentralized machine learning primarily incentivizes which activities?",Data contribution and model training,GPU compute provision and validation,Algorithm optimization and peer review,Network governance and dispute resolution,"A, B",Yes
217,Advanced,The Monetary Authority of Singapore's Project Guardian expansion focuses on which aspect of RWA tokenization infrastructure?,Cross-border regulatory harmonization,Common settlement facilities for tokenized assets,Institutional custody solutions,Retail investor protection mechanisms,B,No
218,Advanced,"In Curve Finance's vote escrow model that inspired ve(3,3), the 'Curve Wars' phenomenon demonstrated which tokenomics principle?",Governance tokens can become more valuable than utility tokens,Protocols will compete for voting power to direct emissions,Lock duration creates sustainable competitive advantages,Revenue sharing aligns long-term stakeholder interests,B,No
219,Advanced,Babylon's Bitcoin restaking protocol enables which novel economic security model?,Using Bitcoin's hash power to secure Proof-of-Stake networks,Leveraging Bitcoin's economic security for other blockchain protocols,Creating liquid Bitcoin derivatives for DeFi applications,Implementing time-locked Bitcoin contracts for validation,B,No
220,Advanced,"In points-based tokenomics systems popular in 2024, which mechanism best prevents Sybil attacks while maintaining user engagement?",KYC verification for all point-earning activities,Progressive point multipliers based on account age,Social graph analysis for authentic user detection,Hardware-based attestation for unique device identification,C,No
221,Advanced,The total tokenized market including stablecoins reached $217.26 billion by December 2024. What percentage of this was attributed to non-stablecoin RWAs?,Approximately 7%,Approximately 12%,Approximately 18%,Approximately 25%,A,No
222,Advanced,"In DePIN tokenomics, which factors are most critical for sustainable network effects in physical infrastructure networks?",Geographic coverage density and quality of service metrics,Token price stability and inflation control mechanisms,Hardware standardization and interoperability protocols,Governance participation and community development,"A, C",Yes
223,Advanced,Lido's liquid staking model differs from restaking protocols in which fundamental way?,Lido only secures the Ethereum consensus layer,Restaking protocols enable multiple simultaneous validation services,Lido provides immediate liquidity while restaking requires lock periods,Restaking protocols have higher slashing risks,"A, B",Yes
224,Advanced,"In Numerai's crowd-sourced hedge fund model, what tokenomics mechanism aligns data scientist incentives with fund performance?",NMR staking on prediction accuracy with performance-based rewards,Proportional fee sharing based on model contribution,Reputation-weighted voting on investment strategies,Time-locked NMR bonuses for consistent performance,A,No
225,Advanced,The Bank for International Settlements' Project Agorá involves central banks from which countries exploring asset tokenization?,"France, Japan, South Korea, Mexico","Switzerland, United Kingdom, United States","Germany, Canada, Australia, Singapore","China, India, Brazil, Russia","A, B",Yes
226,Advanced,"In AI agent token economics, what distinguishes 'AI-to-AI service negotiation' from traditional API-based interactions?",Autonomous price discovery without human intervention,Multi-token payment systems for complex services,Quality-based reputation scoring for service providers,Cross-chain service composition and execution,A,No
227,Advanced,Citibank's February 2024 proof-of-concept with Ava Labs for private equity tokenization aimed to address which traditional PE limitations?,High minimum investment thresholds,Limited liquidity and long lock-up periods,Lack of transparent pricing mechanisms,Complex regulatory compliance requirements,B,No
228,Advanced,"In the context of cross-chain DePIN networks, which tokenomics challenge is most difficult to solve?",Maintaining consistent service quality across different blockchains,Synchronizing token rewards for multi-chain infrastructure providers,Preventing double-spending of physical resource contributions,Ensuring fair dispute resolution across different governance systems,C,No
229,Advanced,The Lummis-Gillibrand Payment Stablecoin Act introduced in April 2024 primarily addresses which tokenomics concern?,Reserve backing requirements for stablecoin issuers,Consumer protection in stablecoin transactions,US dollar dominance in digital asset markets,Regulatory clarity for stablecoin innovation,"A, B, C",Yes
230,Advanced,"In liquid staking derivatives (LSDs), what mechanism prevents the 'depeg risk' where the derivative token trades below the underlying asset value?",Arbitrage opportunities through redemption mechanisms,Protocol-owned liquidity in secondary markets,Insurance funds covering slashing events,Dynamic fee adjustments based on market conditions,A,No
231,Advanced,Tokyo's May 2024 subsidy program for security token issuances recognized which key benefits of tokenization?,Lower minimum investment denominations,Removal of traditional financial intermediaries,Enhanced regulatory compliance automation,Improved cross-border investment accessibility,"A, B",Yes
232,Advanced,"In restaking protocols, what is the primary economic trade-off that validators must consider?",Higher rewards versus increased slashing risk,Liquidity provision versus capital efficiency,Governance participation versus operational complexity,Network security versus decentralization,A,No
233,Advanced,ChainGPT's role as an 'AI oracle' for blockchains enables which novel tokenomics application?,Smart contracts that adapt based on AI-generated insights,Automated token burns based on AI market predictions,Dynamic fee structures optimized by machine learning,AI-driven governance proposal generation and voting,A,No
234,Advanced,The growth of stablecoin holders to 140.53 million accounts by January 2025 indicates which shift in crypto adoption?,Transition from speculative to utility-focused usage,Increased institutional adoption of digital assets,Growing demand for dollar-denominated digital payments,Expansion of DeFi participation globally,"A, C",Yes
235,Advanced,"In Solayer's Solana-based restaking infrastructure, what unique advantage does it have over Ethereum-based restaking?",Lower transaction costs for restaking operations,Faster finality for cross-chain security services,Native support for parallel transaction processing,Built-in MEV protection for restaked assets,"A, C",Yes
236,Advanced,"In the context of AI agent tokenomics, what is the most significant challenge for achieving 'artificial general intelligence (AGI)' on decentralized networks?",Coordinating training across distributed compute resources,Incentivizing long-term research versus short-term profits,Preventing adversarial attacks on shared AI models,Ensuring fair compensation for diverse AI contributions,B,No
237,Advanced,The concept of 'economic security' in restaking protocols is fundamentally based on which principle?,The cost to attack a network should exceed the potential gain,Diversified validation services reduce systemic risk,Staked capital creates skin-in-the-game for honest behavior,Network effects increase security through participation,"A, C",Yes
238,Advanced,"In DePIN networks, what tokenomics mechanism best ensures quality of service while preventing centralization?",Reputation-weighted rewards with slashing for poor performance,Geographic distribution requirements for maximum rewards,Proof-of-coverage with quality attestation from multiple sources,Dynamic pricing based on local supply and demand,C,No
