239,Advanced,"The ve(3,3) model's inflation control through community governance (like Aerodrome's Aero Fed) represents which evolution in tokenomics design?",Transition from algorithmic to democratic monetary policy,Integration of real-time market feedback into token supply,Alignment of inflation decisions with stakeholder interests,Reduction of protocol founder influence over token economics,"A, C",Yes
240,Advanced,"In Ocean Protocol's federated learning model with blockchain rewards, what prevents participants from contributing low-quality data while still earning tokens?",Cryptographic proofs of data quality and uniqueness,Peer validation and reputation scoring systems,Economic penalties for models that perform poorly,Differential privacy requirements that expose bad actors,"B, C",Yes
241,Advanced,The US Congressional hearing on 'Next Generation Infrastructure: How Tokenization of Real-World Assets Will Facilitate Efficient Markets' in 2024 primarily validated which aspect of RWA tokenization?,Potential for reducing settlement times in traditional finance,Ability to democratize access to institutional-grade investments,Transformative impact on existing financial services infrastructure,Regulatory readiness for widespread RWA adoption,C,No
242,Advanced,"In liquid restaking protocols, which risk management mechanism is most critical for preventing cascading failures?",Diversification limits across different validation services,Insurance pools funded by protocol fees,Gradual slashing with appeal processes,Circuit breakers that halt operations during stress events,A,No
243,Advanced,Cookie DAO's AI-driven trading bot tokenomics model represents which innovation in automated DeFi strategies?,Community ownership of algorithmic trading strategies,Machine learning optimization of yield farming,Transparent fee sharing with token holders,Decentralized governance of trading parameters,"A, B",Yes
244,Advanced,"In the context of cross-chain restaking, what is the most complex challenge for maintaining economic security guarantees?",Synchronizing slashing conditions across different consensus mechanisms,Preventing double-signing attacks across multiple chains,Maintaining consistent validator set across different networks,Coordinating dispute resolution across different governance systems,A,No
245,Advanced,The Security Token Market's forecast of $30 trillion in asset tokenization by 2030 is primarily driven by tokenization of which asset classes?,Stocks and equity securities,Real estate and property assets,Government and corporate bonds,Commodities and precious metals,"A, B, C, D",Yes
246,Advanced,"In AI agent networks like SingularityNET, what mechanism ensures interoperability between AI services while maintaining economic incentives?",Standardized API protocols with token-based payments,Cross-chain bridges for multi-network AI service calls,Reputation systems that track service quality across platforms,Automated market makers for AI service pricing,A,No
247,Advanced,The transition from traditional staking to restaking represents which fundamental shift in blockchain economic security models?,From single-purpose to multi-purpose capital utilization,From protocol-specific to application-agnostic security,From inflationary to deflationary token economics,From centralized to decentralized validator selection,"A, B",Yes
248,Advanced,"In points-based airdrop systems that became popular in 2024, what is the optimal conversion ratio strategy for maximizing long-term token value?",Linear conversion based on total points accumulated,Logarithmic scaling to prevent whale dominance,Tiered multipliers based on engagement duration,Dynamic conversion based on network growth metrics,"B, C",Yes
249,Advanced,The integration of traditional finance with DeFi through RWA tokenization faces which primary regulatory arbitrage challenge?,Jurisdictional differences in securities law interpretation,Cross-border settlement and custody requirements,Tax treatment inconsistencies across different token structures,Compliance monitoring for decentralized trading platforms,A,No
250,Advanced,"In the evolution of tokenomics from 2024 to 2025, which trend represents the most significant paradigm shift toward sustainable Web3 economics?",Integration of real-world economic value through RWA tokenization,Transition from speculative to utility-driven token models,Adoption of AI-driven autonomous economic systems,Implementation of cross-chain economic security sharing,"A, B",Yes
251,Basic,Which of the following are used to measure token performance?,APY,Price change,Market capitalization,Holders amount,BCD,Multiple
252,Basic,Which of the following are related to token liquidity?,Liquidity pools,Automated market makers,Order book depth,Volume,ABCD,Multiple
253,Basic,Which of the following are usually with using value?,Meme tokens,VC tokens,ETH,Government-backed tokens,ABD,Multiple
254,Basic,Which of the following coins are not POW?,BTC,ETH,SOL,SUI,BCD,Multiple
255,Basic,Which of the following are benefits of decentralized token models?,Increased transparency,Reduced intermediaries,Enhanced user control,Guaranteed returns,ABC,Multiple
256,Intermediate,"In token economics, what problems can excessively high ""Token Velocity"" lead to?",Difficulty in accumulating token value,Insufficient token supply,Low token trading volume,Too few token holders,A,Not
257,Intermediate,Which token design model most effectively addresses the issue of token velocity?,Token burning mechanism,Token staking mechanism,Token distribution mechanism,Token trading mechanism,B,Not
258,Intermediate,What is the primary innovation of "Bonding Curve" in token economics?,Fixed token supply,Automated market pricing mechanism,Centralized price control,Random token distribution,B,Not
259,Intermediate,Which token economic model is most suitable for decentralized identity systems?,Speculative tokens,Transferable tokens,Pure utility tokens,Soulbound tokens,D,Not
260,Intermediate,Which token economic model is used to incentivize the tokenization of physical assets?,Pure governance model,Revenue-sharing model,Pure utility model,Speculative model,B,Not
261,Intermediate,What is the best practice for "Token Value Capture" in token economics?,Maximizing token supply,Directly linking protocol revenue to token value,Minimizing token lock-up,Increasing token circulation speed,B,Not
262,Intermediate,What does "Token Utility Trap" refer to in token economics?,Token utility is unstable,Token utility is too high,Token utility is insufficient to support its value,Token utility is overly complex,C,Not
263,Intermediate,Which token economic model is used for decentralized scientific research?,Pure governance model,Combination of proof-of-contribution and result verification,Pure utility model,Speculative model,B,Not
264,Intermediate,What is the core challenge of "Token Incentive Alignment" in token economics?,Balancing short-term and long-term incentives,Maximizing token price,Minimizing token volatility,Increasing token trading volume,A,Not
265,Intermediate,Which token economic model is most suitable for community-owned projects?,Fair launch model,Venture capital-dominated model,Team-dominated model,Centralized control model,A,Not
266,Intermediate,Which token economic innovation addresses the fairness issue in initial distribution?,Team allocation,Private sale round,Proof-of-contribution distribution,Foundation holding,C,Not
267,Intermediate,What is the key factor for "Token Incentive Sustainability" in token economics?,Endogenous value creation,External investment,Token price appreciation,Increase in token holders,A,Not
268,Intermediate,Which token economic innovation addresses the issue of governance attacks in token systems?,Random selection,One-person-one-vote,Centralized control,Time-weighted voting,D,Not
269,Intermediate,Which token economic innovation addresses the issue of low governance participation?,Centralized decision-making,Mandatory voting,Combination of delegated voting and incentives,Random selection of decision-makers,C,Not
270,Intermediate,What is the best mechanism for "Token Value Accrual" in token economics?,"Combining fee capture,buybacks and staking rewards",Reliance solely on price appreciation,Reliance solely on trading volume,Reliance solely on holder count,A,Not
271,Intermediate,Which token economic model is most suitable for decentralized media platforms?,Dual incentive model for creators and consumers,Pure creator incentive model,Pure consumer incentive model,Centralized control model,A,Not
272,Intermediate,Which token economic innovation addresses the liquidity issue of NFTs?,NFT fractionalization,NFT leasing,NFT staking,All of the above,D,Not
273,Intermediate,What is the main advantage of "Token Supply Elasticity" in token economics?,Ability to adjust supply based on demand,Fixed supply,Continuous inflation,Continuous deflation,A,Not
274,Intermediate,Which token economic model is most suitable for decentralized storage networks?,Combination of proof-of-work and proof-of-storage,Pure governance model,Pure utility model,Speculative model,A,Not
275,Intermediate,Which token economic innovation addresses the issue of initial token valuation?,Dynamic issuance mechanism,Fixed price issuance,Team pricing,Random pricing,A,Not
276,Intermediate,Which token distribution mechanism is most suitable for achieving broad initial distribution?,Private sale round,Proof-of-contribution airdrop,Team allocation,Foundation holding,B,Not
277,Intermediate,Which token economic model is most suitable for decentralized insurance?,Combination of risk pools and staking,Pure governance model,Pure utility model,Speculative model,A,Not
278,Intermediate,Which token economic innovation addresses the issue of token liquidity?,Increasing transaction fees,Token locking,Reducing trading channels,Liquidity mining 2.0,D,Not
279,Intermediate,What is the ideal state of "Token Value Capture Ratio" in token economics?,Fixed,As high as possible,As low as possible,Proportional to the value created by the network,D,Not
280,Intermediate,Which token unlocking mechanism best prevents market shocks?,One-time unlocking,Linear unlocking,Cliff unlocking,Random unlocking,B,Not
281,Intermediate,Which token economic model is most suitable for long-term infrastructure projects?,Speculation-driven model,Rapid distribution model,Gradual decentralization model,Short-term incentive model,C,Not
282,Intermediate,What is the best practice for "Token Utility Design" in token economics?,Centralized control,Single utility,No utility (pure speculation),Multi-layered utility combination,D,Not
283,Intermediate,Which token economic innovation addresses the "rich get richer" issue in token distribution?,Quadratic voting and distribution,Linear distribution,Whale-first distribution,Centralized distribution,A,Not
284,Intermediate,Which token economic innovation addresses the issue of token value volatility?,Random adjustment,Purely free-floating,Centralized control,Partially collateralized algorithmic stabilization mechanism,D,Not
285,Intermediate,What is the core principle of "Token Incentive Design" in token economics?,Maximizing token price,Maximizing short-term returns,Minimizing volatility,Alignment of incentives with contributions,D,Not
286,Intermediate,Which token economic model is most suitable for decentralized lending platforms?,Protocol revenue-sharing model,Pure governance model,Pure utility model,Speculative model,A,Not
287,Intermediate,Which token economic innovation addresses the misalignment between token holders and users?,Usage-binding mechanism,Increasing speculation,Reducing utility,Centralized control,A,Not
288,Intermediate,Which token economic model is most suitable for decentralized prediction markets?,Speculative model,Pure governance model,Pure utility model,Combination of result verification and staking,D,Not
289,Intermediate,What is the best combination for "Token Value Accrual Mechanism" in token economics?,"Fee sharing, token burning and staking rewards",Reliance solely on price appreciation,Reliance solely on trading volume,Reliance solely on holder count,A,Not
290,Intermediate,What is the best practice for "Token Incentive Layers" in token economics?,"Combining short-term, medium-term and long-term incentives",Short-term incentives only,Long-term incentives only,No incentives,A,Not
291,Intermediate,Which token economic model is most suitable for decentralized content platforms?,Combination of proof-of-attention and proof-of-creation,Pure governance model,Pure utility model,Speculative model,A,Not
292,Intermediate,Which of the following are the feature of SOL?,POW,POS,POH,Fast,CD,Multiple
293,Intermediate,Which of the following are components of AMM?,Liquidity pools,Tokenomics,Airdrop,Order book matching,AD,Multiple
294,Intermediate,Which of the following are economic principles relevant to token markets?,Arbitrage opportunities,Supply and demand,Inflation control,Market sentiment,BD,Multiple
295,Intermediate,Which of the following are risk factors specific to DeFi protocols?,Low APY,Impermanent loss,Regulatory uncertainty,Smart contract bugs,BCD,Multiple
296,Intermediate,Which of the following are key elements of decentralized exchanges?,Liquidity pools,Automated market making,APY,Transaction speed,ABD,Multiple
297,Intermediate,Which of the following metrics are used to evaluate DeFi performance?,TVL,APY,Security,POW,ABC,Multiple
298,Intermediate,Which of the following functions do governance tokens provide?,Centralized control,Staking rewards,Voting rights,Guaranteed returns,BC,Multiple
299,Intermediate,Which of the following are types of token distribution models?,Pre-sale,Airdrop,Gift,Vesting,ABD,Multiple
300,Intermediate,Which of the following are examples of stablecoin types?,Algorithmic,Collateralized,Defi,Unstable,AB,Multiple
301,Intermediate,Which of the following are methods to mitigate smart contract risks?,Code audits,Tokenize,Bug bounty programs,Create a new coin,AC,Multiple
302,Intermediate,Which of the following are economic risks in Defi?,Short term price change,Liquidity shortage,Unreasonable token economy,Stablecoin peg failure,BCD,Multiple
303,Intermediate,Which of the following are used for decentralized governance?,DAO,Token voting,Centralized oversight,Community proposals,ABD,Multiple
304,Intermediate,Which of the following are features of the token economy of ETH?,POS,Limited supply,Staking,Use gas fee,ACD,Multiple
305,Intermediate,Which of the following are indicators of protocol performance?,TVL,APY,User engagement,Mind share,ABCD,Multiple
306,Intermediate,Which of the following are features of the token economy of BTC?,POS,Limited supply,Staking,Use gas fee,BD,Multiple
307,Intermediate,Which of the following are features of the token economy of SOL?,POS,POH,Staking,Use gas fee,BCD,Multiple
308,Intermediate,Which of the following are usually included in token economy?,Allocation parts,Allocation amount of each part,Vesting,Price in USD,ABC,Multiple
309,Intermediate,Which parts of the following are usually included in token economy?,Government of country,VC that doen't invest,Airdrop to community,Group of the project,CD,Multiple
310,Intermediate,Which parts of the following are usually included in token economy?,VC of the project,Community,Group,OKX,ABC,Multiple
311,Intermediate,Which of the following are considered when design token economy?,Fair distribution,Long term development,Profit,VC's attitude,ABCD,Multiple
312,Intermediate,What exchanges can a project list their coins when TGE?,OKX,Binance,Hyperliquid,FTX,ABC,Multiple
313,Intermediate,Which of the following could a project TGE in?,OKX Wallet,Binance Wallet,Virtuals,Bitget Wallet,BC,Multiple
314,Intermediate,Which of the following factors are involved in decentralized governance?,Community voting,Token distribution,Centralized decision-making,DAO,ABD,Multiple
315,Intermediate,Which of the following are features of permissioned blockchain networks?,Restricted access,Enhanced privacy,Selective transparency,Open participation,ABC,Multiple
316,Advanced,"In a fixed supply token model, which of the following is true?",The token requires ongoing minting for staking rewards.,The token's inflation rate stays constant indefinitely.,The token supply increases according to network transaction volume.,The total token supply cannot exceed a capped limit.,D,Not
317,Advanced,Which of the following describes an inflationary token supply?,New tokens are minted continuously over time.,A set amount is minted in the genesis block only.,Tokens are permanently burned to reduce supply.,A smart contract destroys tokens after each transaction.,A,Not
318,Advanced,What is the primary impact of implementing a halving event in a blockchain's monetary policy?,It increases the overall supply of tokens quickly.,It doubles the transaction fees for security.,It reduces the rate of new token issuance periodically.,It guarantees deflation by burning tokens.,C,Not
319,Advanced,"In the context of tokenomics, what effect does a deflationary mechanism like token burning have?","It decreases token supply, potentially increasing scarcity.",It increases liquidity by adding tokens to the market.,It causes the token supply to infinitely inflate.,It ensures all tokens are locked forever.,A,Not
320,Advanced,Which characteristic is typical of a token with a fixed maximum supply compared to an inflationary token?,Encourages early selling due to fear of dilution.,Requires network participants to pay continuous minting fees.,Aligns token price stabilization with constant issuance.,Has predictable total supply growth over time.,D,Not
321,Advanced,"According to the equation of exchange (MV=PT), if the token velocity (V) increases while money supply (M) and transaction volume (T) are constant, what happens to the price level (P)?",P increases.,P decreases.,P remains the same.,P fluctuates unpredictably.,A,Not
322,Advanced,Which mechanism could be used to reduce token velocity in an economy?,Encouraging users to hold tokens in cold storage.,Implementing low staking rewards.,Reducing transaction fees to zero.,Increasing the token's total supply.,A,Not
323,Advanced,Token velocity is best defined as which of the following?,The rate at which tokens change hands in the economy.,The number of tokens a wallet receives per staking period.,The total supply of tokens in circulation.,The speed at which new tokens are minted by protocol.,A,Not
324,Advanced,Which of the following is an example of a liquidity mining incentive?,Reducing reward tokens for early adopters.,Charging fees to LPs for liquidity provisioning.,Rewarding liquidity providers with additional tokens.,Exclusively locking tokens in governance contracts.,C,Not
325,Advanced,"In yield farming, what is impermanent loss"" best described as?""",Temporary loss of token ownership rights during staking.,A permanent reduction in supply due to token burns.,The temporary loss of value when providing liquidity due to price divergence.,Loss of private keys resulting in lost funds.,C,Not
326,Advanced,Which of the following could cause high impermanent loss for a liquidity provider?,Equal value of assets in the liquidity pool at all times.,Stable token pair in AMM pool.,Significant price divergence between paired assets.,Earning only fees without any token rewards.,C,Not
327,Advanced,What is a potential drawback of unlimited liquidity mining incentives?,It may cause rapid token inflation and unsustainable APYs.,It can lead to continuously rising token value without risk.,It guarantees long-term staking for all investors.,It has no effect on network security.,A,Not
328,Advanced,What is the primary purpose of staking tokens in a proof-of-stake network?,To secure the network and validate transactions.,To provide immediate liquidity for traders.,To permanently remove tokens from circulation.,To guarantee fixed returns unrelated to network performance.,A,Not
329,Advanced,Slashing in a PoS blockchain typically refers to:,Reducing the token balance of a validator for misbehavior.,Cutting transaction fees for high-stakes validators.,Sharing staking rewards among smaller holders.,Slicing tokens to half at regular intervals.,D,Not
330,Advanced,How does staking typically affect a token's circulating supply in the short term?,It decreases circulating supply due to tokens being locked.,It increases circulating supply.,It has no effect on circulating supply.,It doubles the circulating supply.,A,Not
331,Advanced,What is one advantage of a token vesting schedule for team members?,It aligns team incentives with long-term project success.,It provides immediate liquidity to team members.,It prevents any team members from ever selling tokens.,It allows team members to vote with unlimited weight immediately.,A,Not
332,Advanced,"In a typical vesting schedule, what is a cliff""?""",A short initial period during which no tokens are vested.,A mechanism that doubles rewards after each vesting period.,A fee charged to withdraw vested tokens early.,A bonus given to team members who hold past the vesting end.,B,Not
333,Advanced,Which scenario describes linear vesting?,Tokens are released incrementally in equal amounts over time.,All tokens are released after a fixed waiting period.,Tokens are never released and permanently locked.,Tokens are released in random quantities sporadically.,A,Not
334,Advanced,Which of the following is a potential consequence of a very short lock-up period for token private sale investors?,Greater long-term price stability.,Increased risk of early large sell-offs.,Immediate trust from retail investors.,Lower token liquidity in early markets.,B,Not
335,Advanced,Which feature is most important in a well-designed governance token?,It should allow unlimited creation of new tokens for voters.,It should balance voting power to avoid concentration.,It should give special voting rights to whales only.,It should bypass all community discussions.,B,Not
336,Advanced,What is the purpose of a DAO treasury in tokenomics?,To hold funds for protocol development and community proposals.,To serve as a central bank issuing new tokens arbitrarily.,To allow private investors to retrieve their initial investment on demand.,To automatically burn tokens when the price falls.,A,Not
337,Advanced,Which statement best describes protocol-owned liquidity (POL)?,Liquidity that is not visible on any blockchain.,Liquidity provided by centralized exchanges.,Liquidity exclusively funded by user deposits.,Liquidity purchased and managed by the protocol itself.,D,Not
338,Advanced,A cross-chain bridge often relies on which mechanism to transfer tokens between blockchains?,Synchronous block confirmation across networks.,Oracle-based price feeds only.,Direct merging of two blockchain ledgers.,Burning tokens on one chain and minting equivalents on another.,D,Not
339,Advanced,What is one potential risk introduced by cross-chain token bridging?,It can introduce double-spend or bridge hacking vulnerabilities.,It decreases total liquidity across the ecosystem.,It creates trustless connectivity without any overhead.,It ensures tokens on multiple chains become hyper-deflationary.,A,Not
340,Advanced,What is a common effect of game-theoretic collusion among liquidity providers?,Artificially maintained high APYs at the protocol's expense.,Decreased rewards for all participants.,"A stable, trustless environment for all traders.",Improved network security through competition.,A,Multiple
341,Advanced,Which of the following mechanisms can act as disinflationary token supply controls?,Increase in base token issuance,Introduction of new token farms,Halving of block rewards,Token burns from transaction fees,CD,Multiple
342,Advanced,Which factors can contribute to a low token velocity?,High staking participation,Long-term lock-up requirements,Lack of utility for transactions,Frequent token burns increasing scarcity,ABC,Multiple
343,Advanced,What consequences might result from excessive liquidity mining incentives?,Inflated token supply and high issuance,Increased market depth and stable prices,Temporary user engagement followed by drop-off,Guarantee of sustained user activity,AC,Multiple
344,Advanced,Which of the following are features of a typical Proof-of-Stake system?,Energy-intensive mining hardware,Random block production by lottery without stake,Economic penalties for misbehavior (slashing),Validators must lock up tokens,CD,Multiple
345,Advanced,What design elements can help mitigate the risk of token price crashes due to large initial sales?,Implementing a vesting schedule for team and investors,Allowing unrestricted trading immediately after launch,Cliff periods delaying initial token releases,Burn mechanisms after each sale,AC,Multiple
346,Advanced,Which governance mechanisms aim to reduce the influence of large token holders?,Token-weighted voting,Quadratic voting,Delegated voting to representatives,Voting caps or ceilings,BD,Multiple
347,Advanced,Which of the following are considered forms of protocol-owned liquidity?,Tokens held in a DAO treasury and used for market making,Liquidity provided by external third-party market makers,Liquidity pools controlled by the protocol's smart contracts,User deposits on centralized exchanges,AC,Multiple
348,Advanced,What are potential risks of cross-chain token bridges?,Smart contract bugs leading to locked funds,Decentralization of token supply,Chain reorg allowing double-spend across chains,Dependence on validator or oracle security,ACD,Multiple
349,Advanced,Which factors can undermine a decentralized treasury?,Community governance via multi-sig or voting,Concentration of funds in a single asset,Lack of transparency in spending,Funds used for community proposals,BC,Multiple
