78,Advanced,Which design patterns are essential for creating composable tokenomics that integrate well with DeFi protocols?,ERC-20 compatibility with extensions,Standardized yield farming interfaces,Cross-protocol governance participation,Interoperable staking mechanisms,"A, B, D",Yes
79,Advanced,"In a Balancer-style weighted pool with 80% Token A and 20% Token B, what is the effective amplification of Token B's price impact?",2x,4x,5x,8x,B,No
80,Advanced,Select all mechanisms that can effectively implement fair token distribution in a decentralized launch.,Gradual Dutch auction with price discovery,Liquidity bootstrapping pools,Proof-of-participation airdrops,Bonding curve initial offerings,"A, B, C, D",Yes
81,Advanced,What is the optimal fee structure for a DEX to maximize long-term protocol revenue while maintaining competitiveness?,Fixed 0.3% fee across all pairs,Dynamic fees based on volatility,Tiered fees based on trading volume,Zero fees with token inflation funding,B,No
82,Advanced,"Which factors are critical for designing tokenomics that align with ESG (Environmental, Social, Governance) principles?",Carbon-negative consensus mechanisms,Inclusive governance structures,Transparent treasury management,Social impact measurement tokens,"A, B, C",Yes
83,Advanced,"In a rebase token mechanism, if the target price is $1 and current price is $1.20, what should be the rebase percentage to restore peg?",16.67%,20.00%,25.00%,33.33%,A,No
84,Advanced,Select all design elements that characterize effective tokenomics for cross-chain protocols.,Unified token standard across chains,Cross-chain governance mechanisms,Bridge security insurance funds,Multi-chain yield optimization,"A, B, C, D",Yes
85,Advanced,What is the break-even point for a liquidity provider in a 50% APY farming program with 20% impermanent loss?,146 days,182 days,219 days,255 days,A,No
86,Advanced,Which mechanisms are essential for implementing effective MEV redistribution in tokenomics?,Proposer-builder separation,MEV auction mechanisms,Validator reward sharing,Priority fee burning,"A, B, C",Yes
87,Advanced,"In a Uniswap V3 concentrated liquidity position with range [0.8, 1.2] and current price 1.0, what is the approximate capital efficiency compared to V2?",2.5x,3.2x,4.1x,5.0x,A,No
88,Advanced,Select all factors that contribute to the sustainability of algorithmic stablecoin mechanisms.,Diversified collateral backing,Counter-cyclical monetary policy,Emergency governance interventions,Market maker incentive programs,"A, B, D",Yes
89,Advanced,What is the effective slashing rate for a validator with 32 ETH stake that gets slashed 1 ETH and loses 50% of future rewards for 36 epochs?,3.13%,4.25%,5.38%,6.50%,B,No
90,Advanced,Which design patterns are essential for creating anti-dilutive tokenomics during bear markets?,Buyback and burn programs,Reduced token emission rates,Increased staking rewards,Emergency treasury interventions,"A, B, C",Yes
91,Advanced,"In a prediction market with binary outcomes, what is the optimal market maker constant product formula parameter to minimize arbitrage opportunities?",k = x * y,k = x + y,k = sqrt(x * y),k = (x * y) / (x + y),A,No
92,Advanced,Select all mechanisms that can effectively implement progressive taxation in tokenomics design.,Tiered transaction fees based on amount,Wealth-based governance voting costs,Progressive staking reward rates,Income-based token distribution,"A, B, D",Yes
93,Advanced,What is the optimal reserve ratio for a fractional reserve stablecoin to maintain 99% confidence in peg stability?,85%,90%,95%,100%,C,No
94,Advanced,Which factors are critical for designing tokenomics that resist regulatory capture?,Decentralized governance structures,Geographic distribution of stakeholders,Regulatory compliance mechanisms,Censorship-resistant infrastructure,"A, B, D",Yes
95,Advanced,"In a Bancor-style bonding curve with connector weight 50%, what is the price elasticity of demand?",-0.5,-1,-1.5,-2,B,No
96,Advanced,Select all design elements that characterize effective tokenomics for Layer 2 scaling solutions.,Gas fee optimization mechanisms,Sequencer decentralization incentives,Fraud proof reward systems,Cross-layer composability features,"A, B, C, D",Yes
97,Advanced,What is the optimal auction duration for a Dutch auction to maximize price discovery while minimizing gas wars?,15 minutes,30 minutes,60 minutes,120 minutes,C,No
98,Advanced,Which mechanisms are essential for implementing effective value accrual in utility tokens?,Fee-based token burning,Staking requirement for service access,Revenue sharing to token holders,Governance-gated feature access,"A, B, C, D",Yes
99,Advanced,"In a multi-token ecosystem, what is the optimal correlation coefficient between governance and utility tokens to maximize system stability?",0.3,0.5,0.7,0.9,B,No
100,Advanced,Select all factors that contribute to the long-term sustainability of tokenomics in a post-speculation market environment.,Real utility-driven demand,Sustainable yield generation,Effective governance mechanisms,Regulatory compliance frameworks,"A, B, C, D",Yes
101,Advanced,"A user locks 10,000 CRV tokens for 3.5 years in Curve's vote-escrow system. Given that the maximum lock period is 4 years, and assuming they provide $100,000 liquidity to a pool where total liquidity is $10M and total veCRV is 2M, what is their boost factor?",1.875,2.125,2.5,1.625,C,No
102,Advanced,"In a bonding curve mechanism with reserve ratio of 0.5 and connector weight of 1,000,000, if the current token supply is 1,000,000 tokens, what factors directly influence the marginal price of the next token minted?",Current supply and reserve ratio only,Connector weight and current supply only,"Reserve ratio, connector weight, and current supply",Market demand and trading volume,C,No
103,Advanced,Select all mechanisms that can effectively mitigate impermanent loss in automated market makers while maintaining capital efficiency.,Dynamic fee adjustment based on volatility,Concentrated liquidity with active management,Impermanent loss insurance protocols,Single-sided staking with synthetic assets,"A, B, C",Yes
104,Advanced,"In EigenLayer's restaking mechanism, an operator manages $50M in restaked ETH across 5 AVS (Actively Validated Services). If each AVS has a 2% slashing condition with independent 0.1% annual probability, what is the expected annual slashing loss?","$50,000 ","$25,000 ","$100,000 ","$75,000 ",A,No
105,Advanced,Which of the following are essential components of a sustainable DePIN (Decentralized Physical Infrastructure Network) tokenomics model?,Geographic distribution incentives for hardware deployment,Proof-of-coverage verification mechanisms,Deflationary token burns based on network usage,Cross-subsidization between high and low-demand areas,"A, B, C, D",Yes
106,Advanced,"A liquid staking derivative (LSD) token trades at a 2% discount to its underlying asset. Given a 4% annual staking yield and 30-day average unlock period, what is the implied market expectation of slashing risk?",0.8% annually,1.2% annually,2.4% annually,Cannot be determined from given information,D,No
107,Advanced,"In Uniswap V4's hook-enabled pools, which mechanisms can be implemented to optimize fee capture for liquidity providers?",Dynamic fee adjustment based on volatility and volume,MEV capture through just-in-time liquidity provision,Cross-pool arbitrage fee sharing,Time-weighted average price (TWAP) manipulation protection,"A, B",Yes
108,Advanced,"A ve(3,3) tokenomics model combines vote-escrow mechanics with Olympus DAO's (3,3) game theory. What is the Nash equilibrium strategy for rational actors in this system?",Always stake and vote for maximum rewards,Alternate between staking and selling based on market conditions,Lock tokens for maximum duration and participate in governance,The equilibrium depends on the relative rewards of staking vs. bonding,C,No
109,Advanced,"In a cross-chain bridge utilizing optimistic verification, select all factors that influence the economic security threshold.",Challenge period duration,Validator bond requirements,Cross-chain message frequency,Fraud proof verification costs,"A, B, D",Yes
110,Advanced,"A Layer 2 rollup captures $100,000 daily in sequencer fees. If 60% is distributed to token holders, 25% to the treasury, and 15% burned, what is the annual token burn rate assuming constant fee generation?",$5.475 million,$3.65 million,$15 million,$21.9 million,A,No
111,Advanced,"In Curve's gauge weight voting system, a protocol wants to maximize CRV emissions to their pool. Which strategies are most effective for acquiring voting power?",Direct veCRV accumulation through long-term CRV locking,Vote bribing through platforms like Votium or Hidden Hand,Acquiring Convex (CVX) tokens for meta-governance,Liquidity mining partnerships with other protocols,"A, B, C",Yes
112,Advanced,"A DeFi protocol implements a real yield model where 70% of revenue is distributed to stakers. If the protocol generates $50M annual revenue with $500M in staked tokens, what is the real yield APY?",7%,10%,3.50%,14%,A,No
113,Advanced,Which mathematical models are most appropriate for pricing tokenized real-world assets (RWAs) in DeFi protocols?,Discounted cash flow (DCF) with blockchain-specific risk adjustments,Black-Scholes option pricing for embedded optionality,Monte Carlo simulations for illiquid asset valuation,Constant product market maker pricing curves,"A, C",Yes
114,Advanced,"In a quadratic voting governance system with 1,000,000 total voting credits distributed among token holders, what is the maximum influence a single voter can have if they control 25% of all tokens?",25%,50%,12.50%,Approximately 33.3%,B,No
115,Advanced,Select all mechanisms that can be used to prevent MEV extraction in decentralized exchanges while maintaining market efficiency.,Commit-reveal schemes for transaction ordering,Frequent batch auctions with uniform clearing prices,Threshold encryption for pending transactions,Time-weighted average price (TWAP) oracles,"A, B, C",Yes
116,Advanced,"A liquidity mining program offers 1,000 tokens daily to a pool with $1M TVL. If the token price is $5 and follows a 50% annual inflation schedule, what is the effective APY for liquidity providers?",182.50%,91.25%,365%,Depends on token price appreciation,A,No
117,Advanced,"In Helium's DePIN model, which factors determine the optimal geographic distribution of hotspots for maximum token rewards?",Population density and data demand,Proof-of-coverage hexagon resolution and witness requirements,Network congestion and latency optimization,Regulatory compliance and spectrum availability,"A, B",Yes
118,Advanced,A protocol-owned liquidity (POL) strategy involves using treasury funds to provide liquidity. What is the primary advantage over traditional liquidity mining?,Eliminates impermanent loss risk,Reduces token emission requirements and maintains permanent liquidity,Increases trading volume through market making,Provides better price discovery mechanisms,B,No
119,Advanced,Which risk factors must be considered when designing tokenomics for a multi-chain protocol with cross-chain token transfers?,Bridge security and potential exploit scenarios,Cross-chain MEV and arbitrage opportunities,Regulatory compliance across different jurisdictions,Gas fee variations and transaction finality differences,"A, B, C, D",Yes
120,Advanced,"In a Dutch auction token sale mechanism, the clearing price is determined when cumulative demand equals token supply. If 1M tokens are offered and bids are: 500K tokens at $10, 400K at $8, 300K at $6, what is the clearing price?",$10 ,$8 ,$6 ,$7 ,C,No
121,Advanced,"A concentrated liquidity position in Uniswap V3 covers the price range $1,800-$2,200 for ETH/USDC with $100,000 capital. If ETH price moves from $2,000 to $2,400, what happens to the position?",Position becomes 100% USDC with impermanent loss,Position maintains 50/50 ratio with rebalancing,Position becomes 100% ETH with no impermanent loss,Position is automatically closed and fees collected,A,No
122,Advanced,Which mechanisms can be implemented in a DAO treasury management system to optimize risk-adjusted returns?,Diversified asset allocation with correlation analysis,Automated rebalancing based on volatility targets,Yield farming strategies with smart contract risk assessment,Options strategies for downside protection,"A, B, C, D",Yes
123,Advanced,"In a restaking protocol, an operator's expected return is calculated as: (Base Yield + AVS Rewards - Slashing Risk). Given 4% ETH staking yield, 2% additional AVS rewards, and 0.5% expected slashing, what is the risk-adjusted return?",5.50%,6.50%,4.50%,3.50%,A,No
124,Advanced,Select all factors that contribute to the sustainability of a token's deflationary mechanism.,Consistent protocol revenue generation,Elastic token supply adjustments,Network usage-based burn rates,Market maker inventory management,"A, C",Yes
125,Advanced,"A cross-chain arbitrage opportunity exists where Token A trades at $100 on Ethereum and $102 on Arbitrum. With bridge costs of $1.50 and gas fees of $0.75, what is the minimum trade size for profitable arbitrage?",$225 ,$450 ,$112.50 ,No profitable arbitrage exists,D,No
126,Advanced,"In a ve(3,3) model, which game-theoretic outcomes represent stable equilibria for token holders?","(Lock, Lock) - All participants lock tokens for maximum duration","(Sell, Sell) - All participants sell tokens immediately","(Lock, Sell) - Mixed strategy equilibrium",The equilibrium depends on the discount rate and reward structure,"A, D",Yes
127,Advanced,"A DePIN network requires 10,000 nodes for optimal coverage. If deployment costs $1,000 per node and annual maintenance is $200, what minimum token reward per node per year justifies participation at a 15% required return?",$350 ,$150 ,$200 ,$380 ,A,No
128,Advanced,Which mathematical models are most suitable for optimizing liquidity allocation across multiple DeFi protocols?,Modern Portfolio Theory with DeFi-specific risk factors,Kelly Criterion for optimal position sizing,Black-Litterman model with protocol-specific views,Markowitz mean-variance optimization,"A, B, C",Yes
129,Advanced,"In a liquid staking protocol, the exchange rate between staked tokens and underlying assets is determined by: (Total Underlying + Rewards - Penalties) / Total Staked Tokens. If 1M ETH is staked, earning 100K ETH in rewards with 10K ETH in penalties, what is the new exchange rate?",1.09 ETH per staked token,1.10 ETH per staked token,0.91 ETH per staked token,1.00 ETH per staked token,A,No
130,Advanced,Select all mechanisms that can be used to prevent governance attacks in token-weighted voting systems.,Time-locked voting with delegation,Quadratic voting with identity verification,Conviction voting with time-weighted preferences,Multi-token governance with different voting weights,"A, B, C",Yes
131,Advanced,"A bonding curve with reserve ratio 0.3 has 500,000 tokens in circulation. If the connector balance is 150,000 DAI, what is the current token price?",$0.30 ,$0.60 ,$1.00 ,$0.45 ,B,No
132,Advanced,Which factors determine the optimal fee structure for a decentralized exchange to maximize protocol revenue?,Trading volume elasticity and competitor pricing,Liquidity provider retention and capital efficiency,MEV capture potential and arbitrage frequency,Gas cost optimization and transaction batching,"A, B, C",Yes
133,Advanced,"In a multi-collateral CDP system like MakerDAO, the liquidation ratio for a new RWA collateral type should be set based on:",Historical volatility and liquidity depth only,Correlation with existing collateral types and systemic risk,Regulatory compliance and legal enforceability,All of the above factors plus oracle reliability,D,No
134,Advanced,Select all strategies that can be used to optimize yield in a multi-chain DeFi environment.,Cross-chain yield farming with automated rebalancing,Arbitrage between lending rates across different chains,Leveraged staking with cross-chain collateral,Delta-neutral strategies using perpetual futures,"A, B, D",Yes
135,Advanced,"A Layer 2 solution implements a fee-sharing mechanism where 40% goes to validators, 35% to token holders, and 25% is burned. If daily fees are $200,000, what is the annual deflationary pressure on the token supply?",$18.25 million,"$50,000 ",$25 million,$73 million,A,No
136,Advanced,Which risk management techniques are essential for a protocol implementing leveraged liquid staking?,Dynamic liquidation thresholds based on market volatility,Circuit breakers for extreme market conditions,Diversified validator selection algorithms,Insurance fund mechanisms for slashing events,"A, B, C, D",Yes
137,Advanced,"In a prediction market using automated market makers, the price of a binary outcome token represents the market's probability estimate. If a token trades at $0.65, what is the implied probability and required return for a $1 payout?","65% probability, 53.8% return","35% probability, 185.7% return","65% probability, 35% return",Cannot determine without knowing the time horizon,A,No
138,Advanced,Select all mechanisms that can be used to align long-term incentives in a DAO governance system.,Vesting schedules for governance tokens,Reputation-weighted voting based on historical participation,Skin-in-the-game requirements for proposal submission,Retroactive rewards for beneficial governance decisions,"A, B, C, D",Yes
139,Advanced,"A cross-chain bridge uses a 2/3 multisig with 9 validators. If each validator has a 1% annual probability of being compromised, what is the probability that the bridge remains secure for one year?",99.96%,91%,99.73%,95.12%,C,No
140,Advanced,Which factors should be considered when designing a token unlock schedule for a Web3 project to minimize market impact?,Market capitalization and trading volume,Holder distribution and concentration metrics,Utility demand and token velocity,Macroeconomic conditions and sector sentiment,"A, B, C",Yes
141,Advanced,"In a ve(3,3) tokenomics model, the optimal locking period for a rational actor depends on the discount rate and reward structure. Given a 10% annual discount rate and 15% base staking rewards with 2x multiplier for 4-year locks, what is the optimal strategy?",Lock for maximum duration (4 years),Lock for 2 years to balance risk and reward,Avoid locking and stake normally,The decision depends on the actor's risk tolerance,A,No
142,Advanced,Select all advanced mechanisms that can be implemented to optimize capital efficiency in automated market makers.,Dynamic fee adjustment based on volatility and inventory,Just-in-time liquidity provision with MEV capture,Multi-asset pools with correlated asset optimization,Impermanent loss mitigation through options strategies,"A, B, C, D",Yes
143,Advanced,"A DePIN protocol implements a spatial proof system where nodes must prove their geographic location. If the network requires 1 node per 10 km² and covers 100,000 km², what is the minimum token reward per node to achieve 95% coverage with $500 deployment cost and 20% required return?",$100 annually,$120 annually,$150 annually,$200 annually,A,No
144,Advanced,Which mathematical models are most appropriate for pricing illiquid tokenized real-world assets in DeFi protocols?,Monte Carlo simulation with stochastic volatility,Binomial option pricing with early exercise features,Discounted cash flow with liquidity risk premiums,Constant product market maker curves,"A, C",Yes
145,Advanced,"In a multi-chain governance system, a proposal requires approval from at least 3 out of 5 chains with different token distributions. Chain A has 40% of total tokens, Chain B has 25%, Chain C has 20%, Chain D has 10%, and Chain E has 5%. What is the minimum token percentage needed to block any proposal?",51%,35%,25%,15%,B,No
146,Advanced,Select all factors that influence the optimal collateralization ratio for a synthetic asset protocol.,Underlying asset volatility and correlation,Liquidation mechanism efficiency and slippage,Oracle reliability and update frequency,Market depth and arbitrage opportunities,"A, B, C, D",Yes
147,Advanced,"A liquid staking protocol implements a dynamic withdrawal queue where exit time depends on the ratio of pending withdrawals to available liquidity. If 10% of staked tokens are pending withdrawal and the protocol maintains 5% liquid reserves, what is the expected withdrawal delay multiplier?",2x normal withdrawal time,1.5x normal withdrawal time,3x normal withdrawal time,Cannot be determined without the specific algorithm,D,No
148,Advanced,Which mechanisms can be used to prevent flash loan attacks on governance systems while maintaining capital efficiency?,Time-locked voting with minimum holding periods,Snapshot-based voting at random block heights,Quadratic voting with identity verification,Multi-block voting with commitment schemes,"A, B, D",Yes
149,Advanced,"In a cross-chain MEV auction, searchers bid for the right to execute arbitrage across different chains. If the auction uses a second-price sealed-bid mechanism with bids of $1000, $800, $600, and $400, what does the winner pay?","$1,000 ",$800 ,$600 ,$400 ,B,No
150,Advanced,Select all advanced risk management techniques that should be implemented in a protocol offering leveraged yield farming.,Dynamic leverage caps based on market volatility,Automated deleveraging during extreme market conditions,Cross-collateralization with correlation-adjusted risk weights,Insurance fund mechanisms with parametric triggers,"A, B, C, D",Yes
151,Advanced,"In DePIN tokenomics, which mechanism is most critical for preventing the 'free rider problem' where participants consume network resources without contributing physical infrastructure?",Proof-of-Physical-Work requiring hardware attestation,Stake-weighted governance voting on resource allocation,Dynamic pricing based on supply-demand imbalances,Time-locked token bonding for infrastructure providers,A,No
152,Advanced,"According to the ve(3,3) model implementation in Aerodrome Finance, what happens during the 'Aero Fed' phase when veAERO holders vote to decrease emissions by 0.01% of total supply?",The protocol automatically burns equivalent tokens from the treasury,Future epoch emissions are reduced by 0.52% annualized rate,Liquidity provider rewards are redistributed to veAERO holders,The voting period is extended to allow for reconsideration,B,No
153,Advanced,"In Bittensor's Yuma Consensus mechanism, which factors determine the daily TAO token distribution to miners?",Neural network model performance rankings,Computational power contributed to the network,Stake weight of the mining node,Geographic distribution requirements,"A, C",Yes
154,Advanced,EigenLayer's restaking mechanism addresses which fundamental limitation of traditional Ethereum staking?,The 32 ETH minimum staking requirement,The inability to use staked ETH for additional security services,The lack of liquid staking token derivatives,The centralization risk from large staking pools,B,No
155,Advanced,"BlackRock's BUIDL fund, launched in March 2024, achieved what significant milestone in the tokenized Treasury market?",First institutional-grade tokenized fund on Ethereum,Captured nearly 30% of the $1.3 billion market within six weeks,Reached $657.41M in assets under management,Established regulatory precedent for tokenized securities,"B, C",Yes
156,Advanced,"In SingularityNET's AI marketplace, the AGIX token serves which primary economic function beyond payment for AI services?",Collateral for AI model training disputes,Staking for transaction validation and network governance,Liquidity provision for cross-chain AI service calls,Insurance fund for failed AI computations,B,No
157,Advanced,The restaking ecosystem's TVL of $15.3B as of September 2024 represents what proportion relative to major DeFi protocols?,Exceeds Aave's TVL of $13B,Represents over half of Lido's $26.48B TVL,Equals approximately 60% of Uniswap's total liquidity,Surpasses the combined TVL of all DEX aggregators,"A, B",Yes
158,Advanced,"In Ocean Protocol's data marketplace, what mechanism ensures fair compensation for data providers while maintaining privacy?",Zero-knowledge proofs for data quality verification,Datatokens that enable on-premise data access,Homomorphic encryption for computation on encrypted data,Federated learning with differential privacy,B,No
159,Advanced,"According to 2024 data, the tokenized RWA market (excluding stablecoins) grew by what percentage year-over-year?",65%,75%,85%,95%,C,No
160,Advanced,Pendle Protocol's token emission schedule since September 2024 implements which deflationary mechanism?,"216,000 tokens weekly with 1.1% weekly reduction until April 2026",Fixed 2% annual inflation with quarterly burn events,Dynamic emissions based on protocol revenue,Halving events every 18 months,A,No
161,Advanced,"In the context of DePIN networks, which tokenomics design best addresses the 'cold start problem' for physical infrastructure deployment?",Exponentially decreasing rewards over time,Geographic density bonuses for early adopters,Proof-of-coverage requirements before token rewards,Cross-subsidization from high-demand to low-demand areas,"B, D",Yes
162,Advanced,"The ve(3,3) model's 'plutocratic governance' concern primarily stems from which structural characteristic?",Voting power proportional to locked token amount and duration,Inability to unlock tokens before the lock period ends,Revenue sharing favoring larger token holders,Yield boost mechanisms creating compounding advantages,A,No
163,Advanced,Fetch.ai's Autonomous Economic Agents (AEAs) create a 'machine-to-machine economy' through which tokenomics mechanisms?,FET tokens for inter-agent transactions and negotiations,Staking FET for machine learning utility access,Automated market makers for agent service pricing,Cross-chain bridges for multi-network agent deployment,"A, B",Yes
